date,address,floor,type,age,twPing,bedRoom,livingRoom,restRoom,furniture,elevator,parkingSpace,price
2020-03-27,台北市中山區林森北路585號七樓之7,7,住宅,12,31.86535115874,1,1,1,1,1,0,53000.0
2020-03-17,台北市中山區新生北路二段68巷8號4樓之7,12,住宅,7,23.73112586295,0,0,0,1,1,0,56000.0
2020-03-17,台北市中山區林森北路107巷43號2樓之5,2,住宅,31,12.34805044902,0,0,0,1,1,0,15500.0
2020-03-31,台北市中山區松江路69巷11號三樓之3,3,住宅,10,16.88252561391,1,1,1,1,1,0,44000.0
2020-03-26,台北市中山區林森北路483號6樓之8,6,住宅,20,13.08312547575,0,0,0,1,1,0,21300.0
2020-03-30,台北市士林區天母西路38巷8號4樓,4,住宅,5,27.346000994400004,1,1,1,1,1,0,72000.0
2020-03-11,台北市士林區劍潭路73號七樓之2,7,住宅,16,41.251926500070006,3,2,2,1,1,0,53000.0
2020-04-01,台北市北投區文林北路10之1號四樓之1,4,住宅,10,57.844052103420005,3,2,2,1,1,0,63500.0
2020-03-24,台北市士林區中山北路六段195巷8號12樓,12,住宅,15,60.206577189330005,3,2,2,1,1,0,80000.0
2020-03-27,台北市士林區天母西路11之3號3樓,3,住宅,41,39.25240142736,3,2,2,1,1,0,65000.0
2020-03-28,台北市士林區士東路88號6樓,6,住宅,5,46.1917516797,2,2,2,1,1,0,86000.0
2020-03-23,台北市士林區天母東路70號4樓,4,住宅,34,37.65520136928,3,2,2,1,1,0,50000.0
2020-03-29,台北市北投區溫泉路３７巷３０號二樓之２,2,套房,18,16.66472560599,1,1,1,1,1,0,20000.0
2020-03-25,台北市士林區天母東路30號10樓,10,住宅,38,55.206252007500005,4,2,2,1,1,0,80000.0
2020-03-27,台北市大安區大安路二段66號九樓之7,9,住宅,14,20.60327574921,1,1,1,1,1,0,40000.0
2020-04-08,台北市大安區瑞安街208巷39號6樓之1,6,住宅,8,13.152700478280002,2,1,1,1,1,0,31000.0
2020-03-27,台北市大安區光復南路638號十二樓,12,住宅,15,22.63607582313,2,1,1,1,1,0,49000.0
2020-04-01,台北市大安區青田街8巷1之7號4樓,4,住宅,52,55.47245201718,4,2,2,0,1,0,45000.0
2020-03-16,台北市大安區信義路三段105號十四樓,14,住宅,16,14.934425543070002,1,1,1,1,1,0,43500.0
2020-03-29,台北市文山區仙岩路１６巷４６號四樓之７,4,套房,30,8.969125326150001,1,1,1,1,1,0,9300.0
2020-03-28,台北市信義區吳興街284巷39弄101號樓,1,住宅,36,31.06372612959,3,2,2,1,0,0,30000.0
2020-04-11,台北市大同區天水路45號3樓之3,3,住宅,15,14.42017552437,0,0,0,1,1,0,19000.0
2020-04-10,台北市中正區忠孝東路二段14號3樓,3,住宅,53,25.27387591905,0,0,0,0,0,0,29000.0
2020-04-09,台北市萬華區萬大路237巷10弄70號,1,住宅,47,12.8260004664,1,1,1,0,0,0,14000.0
2020-03-26,台北市中正區臨沂街３２巷２號六樓之２,6,套房,8,13.077075475530002,1,0,1,1,1,0,27000.0
2020-04-01,台北市大同區萬全街1號2樓之7,2,住宅,8,25.55520092928,1,2,1,1,1,0,62000.0
2020-04-01,台北市大同區太原路17號8樓之1,8,住宅,12,27.799751010900003,2,2,1,1,1,0,52000.0
2020-04-07,台北市萬華區康定路206號六樓之11,6,住宅,45,9.55597534749,1,0,1,1,1,0,10000.0
2020-04-07,台北市萬華區雙和街86號四樓,4,住宅,48,9.36237534045,2,1,1,1,0,0,9000.0
2020-04-09,台北市萬華區東園街66巷24弄1號四樓之1,4,住宅,6,50.55682683843,4,2,2,0,1,1,40000.0
2020-03-29,台北市信義區仁愛路四段508號9樓,9,住宅,39,33.901176232770005,3,2,2,1,1,0,60000.0
2020-03-25,台北市松山區敦化北路２２２巷１號六樓之１,6,住宅,40,39.30685142934,3,2,2,1,1,0,48000.0
2020-04-01,台北市中山區中山北路二段59巷45號13樓之4,13,住宅,24,32.28280117392,2,2,2,1,1,0,45000.0
2020-04-01,台北市中山區新生北路二段38號9樓之3,9,住宅,27,20.04970072908,1,2,1,1,1,0,41000.0
2020-04-01,台北市中山區新生北路二段40號11樓之1,11,住宅,27,15.987125581350002,1,2,1,1,1,0,31800.0
2020-04-01,台北市中山區農安街6號11樓之6,11,套房,14,22.965800835120003,1,1,1,1,1,0,39000.0
2020-04-01,台北市中山區錦西街31號6樓之5,6,套房,46,14.810400538559998,1,1,1,1,1,0,30000.0
2020-03-26,台北市內湖區康寧路三段１８９巷９０之１號八樓,8,住宅,28,27.27945099198,2,2,1,1,1,1,30000.0
2020-04-08,台北市中山區中山北路一段83巷9號三樓之7,3,住宅,49,18.01085065494,2,1,1,1,1,0,18000.0
2020-04-01,台北市士林區忠誠路二段86號11樓,11,住宅,38,43.87460159544,4,2,2,1,1,0,70000.0
2020-03-31,台北市士林區天母東路10-1號2樓,2,住宅,34,42.604101549240006,3,2,2,1,1,0,57000.0
2020-04-01,台北市士林區文林路556號12樓之2,12,住宅,7,47.69820173448,4,2,2,1,1,0,70000.0
2020-04-01,台北市士林區天母西路28號3樓,3,住宅,43,40.49567647257,4,2,2,1,1,0,59000.0
2020-04-01,台北市士林區中山北路六段405巷39號7樓,7,住宅,41,44.45842661667,3,2,2,1,1,0,62000.0
2020-04-01,台北市士林區中山北路六段47號4樓,4,住宅,11,49.10785178574,2,2,2,1,1,0,89000.0
2020-03-28,台北市士林區德行西路５９號六樓,6,住宅,33,37.66730136972001,3,2,2,1,1,0,35000.0
2020-03-28,台北市北投區知行路２５７號六樓,6,住宅,12,26.28120095568,2,1,1,1,1,1,25000.0
2020-03-29,台北市北投區振興街１號五樓之１２,5,套房,26,12.399475450890002,1,0,1,1,1,0,17000.0
2020-03-10,台北市士林區中山北路7段114巷61弄2-4號7樓,7,住宅,38,42.15337653285,3,3,3,1,1,0,54000.0
2020-04-01,台北市北投區東華街一段492號9樓,9,住宅,17,36.535951328580005,3,2,2,1,1,0,70000.0
2020-03-06,台北市北投區三合街一段71號8樓,8,住宅,9,96.71227851681,4,2,2,1,1,1,60000.0
2020-03-20,台北市士林區中山北路六段212號十樓,10,住宅,19,65.30067737457,4,2,2,1,1,0,102000.0
2020-03-31,台北市士林區天母西路18之9號六樓,6,住宅,44,39.73640144496001,3,2,2,1,1,0,60000.0
2020-04-01,台北市士林區中山北路七段１４１巷１７之４號四樓,4,住宅,43,49.01105178222,2,2,2,1,1,0,40500.0
2020-03-09,台北市北投區自強街180巷8號2樓,2,住宅,42,30.67047611529,3,2,1,1,0,0,18000.0
2020-03-31,台北市士林區天母東路43巷4弄12之1號4樓,4,住宅,27,51.42802687011,3,2,2,1,1,0,56000.0
2020-03-31,台北市士林區士東路2巷21號3樓,3,住宅,20,36.06102631131,3,2,2,1,1,0,65000.0
2020-03-30,台北市士林區中正路１２０號四樓,4,住宅,37,42.32277653901,3,2,2,1,1,0,35000.0
2020-04-01,台北市大安區信義路二段44巷2號5樓,5,住宅,24,46.887501705000005,4,2,2,1,1,0,50000.0
2020-03-24,台北市大安區潮州街８４號五樓之１,5,套房,14,10.3757503773,1,1,1,1,1,0,24600.0
2020-03-31,台北市大安區光復南路260巷7號6樓,6,住宅,22,52.58962691235,4,2,2,1,1,0,87000.0
2020-03-30,台北市中山區市民大道三段143號4樓,4,住宅,32,55.36052701311,0,0,0,0,1,0,77000.0
2020-04-01,台北市中山區林森北路587號9樓之8,9,住宅,12,27.143325987030003,1,2,1,1,1,0,54000.0
2020-04-13,台北市內湖區新明路380巷9弄14號3樓,3,住宅,43,29.4937510725,3,1,1,0,0,0,20000.0
2020-03-25,台北市中山區林森北路587號5樓之7,5,住宅,12,27.20685098934,2,1,1,1,1,0,57000.0
2020-03-31,台北市中山區新生北路二段62巷11號14樓之3,14,住宅,12,63.05007729273,2,2,2,1,1,0,80000.0
2020-03-31,台北市中山區中山北路二段138號7樓,7,住宅,15,51.02872685559,2,2,2,1,1,1,68950.0
2020-03-31,台北市中山區林森北路587號4樓,4,住宅,12,26.91645097878,1,2,1,1,1,0,53000.0
2020-04-13,台北市信義區松勤街9號11樓之7,11,套房,16,15.55757556573,0,0,0,1,1,0,36000.0
2020-04-09,台北市萬華區雅江街55號,1,住宅,52,13.23740048136,1,1,1,1,0,0,15000.0
2020-03-02,台北市大同區太原路115巷21號三樓,3,住宅,30,26.922500979,0,0,0,0,0,0,30000.0
2020-04-13,台北市內湖區民權東路六段180巷42弄15號六樓,6,住宅,5,47.84340173976001,2,2,2,1,1,1,49500.0
2020-04-13,台北市內湖區民權東路六段180巷42弄13號10樓之2,10,住宅,5,26.20557595293,2,1,1,1,1,0,38000.0
2020-03-01,台北市中山區松江路133巷50號八樓之1,8,住宅,19,14.87695054098,1,1,1,1,1,0,29000.0
2020-03-30,台北市內湖區成功路二段３２３巷３２號十一樓,11,住宅,8,73.62245267718001,3,2,2,1,1,1,73000.0
2020-02-26,台北市中山區復興北路62號12樓-3,12,住宅,42,49.14717678717,0,0,0,0,1,0,62000.0
2020-03-30,台北市內湖區康寧路三段９９巷３９弄２１號三樓,3,住宅,28,37.915351378740006,3,2,2,1,1,0,28000.0
2020-03-02,台北市內湖區民權東路六段296巷31弄1號1樓,1,住宅,36,32.44615117986,3,2,2,0,0,0,52000.0
2020-03-02,台北市內湖區成功路二段328號11樓之6,11,住宅,14,62.60842727667,2,2,2,0,1,1,45408.0
2020-03-27,台北市中山區南京東路2段108號12樓之11,12,套房,13,15.10685054934,1,1,1,1,1,0,34056.0
2020-04-02,台北市中正區三元街２１７號四樓之５,4,套房,31,13.11337547685,1,0,1,1,1,0,15000.0
2020-03-31,台北市大安區安和路一段１０１號十三樓之３,13,住宅,42,36.72652633551,2,2,2,1,1,0,38000.0
2020-03-31,台北市北投區行義路192巷15弄8號地下一層之13,-1,套房,23,20.91182576043,1,1,1,1,1,0,10000.0
2020-04-01,台北市士林區中山北路五段720號八樓,8,住宅,4,52.61685191334,3,2,2,1,1,0,90000.0
2020-03-31,台北市士林區忠誠路一段171巷12弄7號8樓,8,住宅,14,62.42692727007,4,2,2,1,1,0,85500.0
2020-03-31,台北市士林區士東路２６６巷５弄５號,1,住宅,43,38.96502641691,4,2,2,1,0,0,43000.0
2020-04-11,台北市大安區敦化南路二段60號7樓之3,7,住宅,41,77.04372780159001,5,2,3,0,1,0,94000.0
2020-04-06,台北市文山區忠順街一段２０號六樓之３,6,住宅,4,50.69597684349,3,2,2,1,1,1,36000.0
2020-04-06,台北市信義區松智路31巷11號一樓,1,住宅,25,53.81777695701,0,0,0,0,1,1,65187.0
2020-04-06,台北市中山區長安東路一段56巷1弄38號5樓,5,住宅,15,43.10927656761,3,2,2,0,1,0,40000.0
2020-04-02,台北市松山區慶城街73號9樓,9,住宅,36,71.92240261536,4,2,3,1,1,0,78000.0
2020-04-09,台北市信義區松勤街47號4樓,4,住宅,25,52.08445189398,3,2,2,1,1,0,40000.0
2020-04-11,台北市萬華區桂林路6號15樓之1,15,住宅,13,90.99502830891,4,3,2,1,1,0,83000.0
2020-04-01,台北市大同區南京西路288號三樓之17,3,住宅,11,46.79070170148,2,1,1,1,1,0,68918.0
2020-03-31,台北市中山區中山北路二段93巷18號4樓,4,住宅,10,50.260376827650006,3,2,2,1,1,0,73000.0
2020-02-27,台北市中山區建國北路一段３號６樓,6,住宅,5,84.6697530789,3,2,2,1,1,1,90000.0
2020-04-08,台北市大安區復興南路一段128號3樓之4,3,住宅,17,16.589100603240002,1,1,1,1,1,0,26000.0
2020-04-10,台北市大安區瑞安街208巷39號4樓之5,4,住宅,8,19.57780071192,2,1,1,1,1,0,39900.0
2020-04-15,台北市士林區士東路200巷15弄6號3樓,3,住宅,29,52.06025189310001,4,2,2,1,1,1,35000.0
2020-04-01,台北市北投區明德路38巷16號八樓,8,住宅,8,46.06167667497,3,2,2,1,1,0,80000.0
2020-04-08,台北市中山區德惠街16號4樓之4,4,住宅,41,11.567600420640002,1,1,1,1,1,0,16000.0
2020-04-03,台北市中山區林森北路121號7樓之3,7,住宅,15,7.48385027214,0,0,0,1,1,0,16000.0
2020-04-09,台北市松山區八德路四段636號5樓之7,5,住宅,10,11.92455043362,0,0,0,1,1,0,20000.0
2020-04-01,台北市信義區虎林街40巷29號四樓,4,住宅,38,31.35715114026,2,2,2,1,0,0,25000.0
2020-04-20,台北市大同區南京西路25巷32號六樓之1,6,住宅,15,30.16832609703,2,2,1,1,1,0,46000.0
2020-04-01,台北市大同區市民大道一段203號十樓之15,10,住宅,14,26.18742595227,2,1,1,1,1,0,62000.0
2020-03-30,台北市中山區德惠街３巷１號四樓之６,4,套房,17,12.487200454080002,1,1,1,1,1,0,15000.0
2020-04-20,台北市中山區撫順街23號八樓之1,8,住宅,19,39.79690144716,2,2,2,1,1,0,50000.0
2020-04-06,台北市中山區農安街8號五樓之12,5,住宅,14,15.394225559790002,1,0,1,1,1,0,30000.0
2020-03-07,台北市中山區明水路581巷17號2樓之6,2,住宅,27,48.4605017622,2,2,2,1,1,1,38000.0
2020-03-23,台北市士林區士東路200巷49弄1號3樓,3,住宅,14,81.39065295966,5,2,2,1,1,1,102000.0
2020-04-18,台北市士林區德行東路109巷77號九樓,9,住宅,9,74.98067772657001,4,2,2,1,1,0,100000.0
2020-04-16,台北市北投區裕民六路100號十一樓之3,11,住宅,20,44.37977661381,3,2,2,1,1,0,53000.0
2020-04-14,台北市士林區天玉街39巷4號7樓,7,住宅,38,50.0032518183,4,1,2,1,1,0,73000.0
2020-04-16,台北市北投區吉利街２８０巷３３弄８號,1,住宅,53,20.80292575647,1,1,1,1,0,0,16000.0
2020-04-09,台北市大安區瑞安街81巷12弄18號3樓,3,住宅,14,89.37362824995002,3,2,2,1,1,1,125000.0
2020-04-09,台北市信義區松山路421號9樓,9,住宅,30,44.99082663603,3,1,2,0,1,0,45000.0
2020-03-13,台北市中正區水源路131之2號1樓,1,住宅,41,18.87297568629,1,2,1,1,1,0,20000.0
2020-04-17,台北市大安區大安路二段66號5樓-1,5,住宅,14,26.88015097746,1,1,1,1,1,0,48000.0
2020-04-08,台北市士林區天母西路122之1號三樓,3,住宅,14,57.29955208362001,3,2,2,1,1,0,65000.0
2020-04-20,台北市士林區德行東路104巷9弄11號4樓,4,住宅,41,31.02137612805,3,2,2,0,0,0,19000.0
2020-03-09,台北市中山區農安街8號4樓之6,4,住宅,14,16.105100585640002,0,0,0,1,1,0,36000.0
2020-04-01,台北市中山區農安街8號十三樓之1,13,住宅,14,17.33022563019,1,1,1,1,1,0,40000.0
2020-04-05,台北市內湖區康寧路三段５４之６號七樓,7,住宅,27,35.819026302510004,2,2,1,1,1,1,31000.0
2020-04-14,台北市中山區天津街27號二樓,2,住宅,56,25.73367593577,1,1,1,1,0,0,26000.0
2020-04-09,台北市信義區松德路180巷5號4樓,4,住宅,34,35.10815127666,3,2,2,1,1,0,70000.0
2020-04-07,台北市信義區信義路5段18號2樓之1,2,住宅,34,113.51010412764,6,2,3,0,1,0,160000.0
2020-04-08,台北市信義區松信路16號2樓,2,住宅,42,32.60647618569,3,2,2,1,0,0,25000.0
2020-03-25,台北市信義區忠孝東路五段482號14樓之1,14,住宅,30,27.346000994400004,3,1,1,0,1,0,30000.0
2020-04-17,台北市萬華區德昌街7巷7號2樓,2,住宅,48,19.490075708730004,3,1,1,1,0,0,16300.0
2020-04-09,台北市萬華區中華路二段666之6號十樓之3,10,住宅,34,25.08935091234,2,1,1,1,1,0,20000.0
2020-03-23,台北市萬華區青年路132號3樓,3,套房,48,9.5590003476,1,1,1,1,1,0,10000.0
2020-04-10,台北市內湖區文德路22巷74弄10號二樓,2,住宅,45,23.876325868230005,2,1,1,1,0,0,23000.0
2020-04-11,台北市中山區五常街31號11樓之1,11,住宅,7,18.782225682990003,1,1,1,1,1,0,43138.0
2020-04-15,台北市中山區民生東路一段72號九樓之6,9,住宅,42,11.63415042306,1,0,1,1,1,0,14000.0
2020-04-15,台北市士林區社子街126巷10號,2,住宅,51,19.56872571159,3,2,1,1,0,0,18000.0
2020-04-14,台北市文山區景華街128巷7號三樓,3,住宅,42,28.69817604357,3,2,2,1,0,0,20000.0
2020-03-30,台北市文山區秀明路一段１２９巷６８弄１０號四樓,4,住宅,5,58.182852115740005,4,2,2,1,1,0,32000.0
2020-04-01,台北市士林區基河路16號七樓之5,7,住宅,19,18.40107566913,1,1,1,1,1,0,47500.0
2020-04-01,台北市中山區林森北路363號十一樓,11,住宅,14,18.842725685190004,1,1,1,1,1,0,52000.0
2020-04-01,台北市中山區南京東路二段108號十六樓之10,16,住宅,13,30.33470110308,1,1,1,1,1,0,73000.0
2020-04-01,台北市中山區新生北路二段68巷9號七樓,7,住宅,15,15.95385058014,1,1,1,1,1,0,30000.0
2020-04-01,台北市中山區雙城街25巷3號九樓,9,住宅,8,41.33360150304,2,1,2,1,1,0,76000.0
2020-04-09,台北市中山區雙城街４５號四樓,4,套房,35,11.156200405680002,1,1,1,1,1,0,17000.0
2020-04-09,台北市內湖區金湖路３４７巷１２１弄１８號,1,住宅,18,82.83962801235,4,2,2,1,1,1,80000.0
2020-04-01,台北市大同區太原路155號二樓之1,2,住宅,21,60.94770221628001,3,2,2,1,1,0,60000.0
2020-04-01,台北市大同區市民大道一段205號八樓之7,8,住宅,14,37.555376365650005,3,2,2,1,1,0,65000.0
2020-03-26,台北市萬華區青年路１０６巷９號四樓,4,住宅,48,13.87870050468,3,1,1,1,0,0,12000.0
2020-04-08,台北市萬華區西園路一段１１５號六樓之７,6,住宅,4,31.92887616105001,3,2,2,1,1,0,33000.0
2020-03-28,台北市大同區酒泉街10巷27號6樓之2,6,住宅,11,37.28615135586001,2,2,2,1,1,0,49000.0
2020-04-14,台北市松山區慶城街73號13樓,13,住宅,36,71.92240261536,3,2,2,1,1,1,95000.0
2020-04-15,台北市信義區信義路五段127號14樓之13,14,住宅,17,14.017850509740002,0,1,1,1,1,0,33000.0
2020-04-15,台北市信義區基隆路一段350號五樓之28,5,住宅,50,14.68032553383,2,1,1,1,0,0,12800.0
2020-04-22,台北市中山區龍江路1號7樓之3,7,住宅,18,27.681776006610004,1,1,1,1,1,0,40000.0
2020-03-29,台北市內湖區陽光街192號7樓,7,住宅,39,31.54167614697,3,2,1,0,1,0,30000.0
2020-04-14,台北市中山區中山北路一段84號13樓之6,13,住宅,14,12.10605044022,1,1,1,1,1,0,26000.0
2020-04-06,台北市內湖區民權東路六段123巷18號10樓之1,10,住宅,24,44.27087660985,1,0,1,0,1,1,40000.0
2020-03-19,台北市大安區信義路四段２６５巷２１弄２８號五樓,5,住宅,39,33.86185123134,3,2,1,1,1,0,32000.0
2020-03-22,台北市大安區瑞安街31巷1之1號,1,住宅,41,31.25430113652,2,1,1,0,0,0,32921.0
2020-04-01,台北市士林區忠誠路1段18號3樓之2,3,住宅,18,38.07870138468,3,2,2,1,1,0,63000.0
2020-04-21,台北市信義區基隆路二段39巷24弄1號四樓,4,住宅,31,77.04070280148,5,2,3,0,1,0,53000.0
2020-04-01,台北市士林區天母東路43巷4弄12號5樓,5,住宅,27,39.73337644485,3,2,2,1,1,0,60000.0
2020-04-01,台北市士林區天母東路43巷4弄12號2樓,5,住宅,27,39.67287644265,3,2,2,1,1,0,60000.0
2020-04-01,台北市士林區天母東路43巷4弄12號6樓,6,住宅,27,39.73337644485,3,2,2,1,1,0,60000.0
2020-04-15,台北市大安區泰順街40巷36號2樓,2,住宅,42,35.91885130614,0,0,0,0,0,0,35000.0
2020-04-15,台北市中山區錦州街50號5樓之5,5,住宅,39,11.45265041646,0,0,0,1,1,0,13000.0
2020-04-13,台北市中山區林森北路399巷23號8樓,8,住宅,39,10.832525393910002,0,0,0,1,1,0,16500.0
2020-04-20,台北市中山區林森北路121號4樓之11,4,住宅,15,9.0145003278,1,1,1,1,1,0,17000.0
2020-04-13,台北市中山區建國北路三段71號2樓之7,2,住宅,8,29.33645106678,1,1,1,1,1,0,63000.0
2020-04-15,台北市中山區錦州街30巷12號10樓之4,10,住宅,26,9.47430034452,1,1,1,1,1,0,13450.0
2020-04-01,台北市內湖區內湖路一段323巷4弄14號2樓,2,住宅,45,28.2232510263,3,2,1,1,0,0,31785.0
2020-04-22,台北市中山區建國北路一段148號6樓,6,住宅,24,50.44490183436,2,1,1,0,1,0,50000.0
2020-04-16,台北市中山區建國北路三段71號十樓之2,10,住宅,8,23.480050853820003,2,2,1,1,1,0,65000.0
2020-04-07,台北市中山區林森北路61號六樓之1,6,住宅,16,58.7455021362,3,2,2,1,1,0,60639.0
2020-04-16,台北市中山區中山北路二段59巷7號四樓,9,住宅,8,28.72237604445,2,1,1,1,1,0,56600.0
2020-04-15,台北市中山區復興北路400號十六樓,16,住宅,37,37.44042636147,1,1,2,1,1,0,40000.0
2020-04-21,台北市中山區建國北路三段71號五樓,5,住宅,8,22.67237582445,2,1,2,1,1,0,54000.0
2020-04-24,台北市中山區松江路69巷11號6樓之3,6,住宅,10,20.05272572919,2,2,1,1,1,0,44000.0
2020-04-01,台北市中山區中山北路二段93巷8號8樓之14,8,住宅,18,20.709150753060005,3,2,2,1,1,0,50000.0
2020-04-03,台北市中山區新生北路二段68巷8號5樓之1,5,住宅,7,25.113550913220003,2,2,1,1,1,0,64200.0
2020-04-08,台北市中山區林森北路585號11樓之1,11,住宅,12,31.86535115874,1,2,1,1,1,0,60000.0
2020-04-08,台北市中山區中山北路二段53巷8號3樓之13,3,套房,15,14.7922505379,1,1,1,1,1,0,30000.0
2020-04-11,台北市內湖區內湖路三段60巷31號16樓,16,住宅,6,56.4465020526,3,2,2,1,1,1,50000.0
2020-04-15,台北市內湖區港華街17-1號,1,住宅,39,31.496301145320004,3,2,1,0,0,0,26000.0
2020-04-16,台北市內湖區民權東路6段180巷6號11樓之15,11,住宅,24,18.23470066308,1,0,1,1,1,0,22704.0
2020-04-01,台北市中山區中山北路二段62巷7號6樓,6,住宅,11,32.87872619559,2,2,1,1,1,0,60000.0
2020-04-11,台北市內湖區新豐街１５６號三樓之１,3,住宅,13,69.10310251284,3,2,2,1,1,1,60000.0
2020-04-10,台北市中山區南京東路二段２４巷３號四樓,4,住宅,50,29.93540108856,3,3,2,1,0,0,35000.0
2020-04-14,台北市萬華區西寧南路36號6樓之56,6,住宅,45,15.35187555825,2,1,1,1,1,0,23000.0
2020-04-06,台北市萬華區環河南路三段365號三樓,3,住宅,51,23.337875848650004,3,2,1,1,0,0,15000.0
2020-04-08,台北市中正區信義路二段175號5樓,5,住宅,15,30.966926126070003,3,2,2,1,1,0,56284.0
2020-04-08,台北市大同區太原路80號10樓,10,住宅,15,16.88252561391,1,2,1,1,1,0,27400.0
2020-04-22,台北市松山區八德路二段348號四樓之6,4,住宅,14,14.3687505225,1,1,1,1,1,0,28000.0
2020-04-24,台北市信義區基隆路一段101巷1號14樓之1,14,住宅,8,33.07232620263,2,1,2,1,1,0,51000.0
2020-04-24,台北市松山區南京東路四段23號7樓,7,住宅,15,16.90370061468,1,1,1,1,1,0,35000.0
2020-04-02,台北市信義區永吉路8號8樓,8,住宅,16,38.26020139128,3,2,2,1,1,0,60000.0
2020-04-28,台北市大安區延吉街126巷12號5樓,5,住宅,47,18.76710068244,1,1,1,1,1,0,29750.0
2020-04-16,台北市大安區新生南路三段88號6樓,6,住宅,41,80.98832794503001,0,0,0,0,1,0,95000.0
2020-04-21,台北市士林區文林路570號二樓,2,住宅,28,19.29647570169,2,1,1,1,1,0,18000.0
2020-04-21,台北市北投區東華街二段22號八樓,8,住宅,10,58.85742714027,2,2,2,1,1,1,60500.0
2020-04-11,台北市北投區石牌路二段３４８巷１７號四樓之１,4,住宅,30,17.296950628980003,2,1,1,1,1,0,21000.0
2020-04-04,台北市士林區忠誠路二段21巷18號2樓,2,住宅,14,69.31182752043,4,2,2,1,1,0,68217.0
2020-04-05,台北市士林區中山北路六段45號4樓,4,住宅,11,50.73530184492,3,2,2,1,1,0,83500.0
2020-04-22,台北市士林區華齡街185巷6號10樓,10,住宅,15,47.82222673899,2,2,2,1,1,0,50000.0
2020-04-27,台北市士林區中山北路5段512號,1,住宅,8,285.21818537157003,0,0,0,0,1,0,280000.0
2020-04-13,台北市士林區天母東路75之3號1樓,1,住宅,38,35.77365130086,3,2,2,1,1,0,73000.0
2020-04-16,台北市大安區大安路一段２０２號九樓之３,9,套房,15,10.67522538819,0,1,1,1,1,0,25000.0
2020-03-20,台北市松山區民生東路五段27號4樓,4,套房,6,18.37082566803,1,1,1,1,1,0,50000.0
2020-04-29,台北市信義區基隆路二段107之1號4樓之1,4,住宅,38,34.33072624839,3,2,2,1,1,0,25000.0
2020-04-29,台北市信義區基隆路二段107-1號6樓,6,住宅,38,34.33980124872,2,2,2,1,1,0,26000.0
2020-04-16,台北市南港區松河街７７０號四樓之２,4,套房,14,14.69847553449,1,0,1,1,1,1,19000.0
2020-04-05,台北市大同區市民大道一段201號十六樓之1,16,住宅,14,41.45157650733,3,2,2,1,1,0,90000.0
2020-04-08,台北市大同區太原路80號13樓,13,住宅,15,41.548376510850005,3,2,2,1,1,0,59000.0
2020-04-13,台北市中正區杭州南路一段７９號十一樓,11,住宅,41,61.46497723509,2,2,1,1,1,1,52000.0
2020-03-24,台北市萬華區艋舺大道386巷8號1樓,1,住宅,37,29.611726076790003,3,2,2,1,0,0,26000.0
2020-04-06,台北市中山區中山北路二段183號七樓之5,7,住宅,4,67.23970244508,3,2,2,1,1,0,90000.0
2020-03-01,台北市中山區合江街127巷24號1樓,1,住宅,42,40.36257646773,3,2,2,0,0,0,45408.0
2020-03-17,台北市中山區林森北路363號9樓之1,9,住宅,14,42.72812655375,2,1,2,1,1,0,70000.0
2020-03-17,台北市中山區民權東路二段135巷32號9樓,9,住宅,9,25.04095091058,1,1,1,1,1,0,45000.0
2020-04-13,台北市內湖區新富街１３７號十二樓,12,住宅,10,78.33540284856,3,2,2,1,1,1,70000.0
2020-04-07,台北市中山區林森北路365號12樓之2,12,住宅,14,71.47167759897,3,2,2,1,1,0,110000.0
2020-04-09,台北市中山區松江路93巷3號6樓,6,住宅,26,56.546327056230005,2,2,2,1,1,0,62000.0
2020-03-13,台北市中山區中山北路2段118號6樓之3,6,住宅,4,21.21130077132,2,1,1,1,1,0,60000.0
2020-04-16,台北市中山區松江路４１０號六樓,6,住宅,8,70.39780255992001,4,2,2,1,1,1,80000.0
2020-04-28,台北市中山區林森北路409號三樓之7,3,住宅,41,32.4280011792,3,1,2,1,1,0,18000.0
2020-04-27,台北市中山區建國北路三段71號7樓之8,7,住宅,8,26.65327596921,2,1,2,1,1,1,52000.0
2020-04-24,台北市內湖區內湖路一段661號6樓之6,6,住宅,13,25.70645093478,2,1,1,1,1,0,42000.0
2020-04-28,台北市中山區遼寧街101巷2弄7號五樓,5,住宅,43,25.62477593181,3,2,1,1,0,0,18000.0
2020-04-29,台北市中山區中山北路二段50巷23號三樓,3,套房,49,19.28437570125,1,1,1,1,1,0,22000.0
2020-04-01,台北市中山區復興南路一段52號15樓,15,住宅,16,45.922526669910006,3,2,2,1,1,0,90000.0
2020-04-27,台北市大同區五原路19號七樓之9,7,住宅,14,11.522225418990002,1,0,1,1,1,0,18000.0
2020-04-28,台北市中正區臨沂街19巷19號1樓,1,住宅,11,16.79177561061,1,1,1,1,0,0,48000.0
2020-04-15,台北市萬華區桂林路１０９號四樓之１,4,住宅,4,24.69912589815,2,1,1,1,1,0,24000.0
2020-04-01,台北市松山區光復北路60巷26號4樓,4,住宅,44,32.55807618393,2,2,2,1,0,0,33000.0
2020-04-29,台北市南港區重陽路125巷1號4樓,4,住宅,16,58.27360211904,4,2,2,1,1,1,43000.0
2020-04-22,台北市中正區廈門街113巷6號4樓之3,4,住宅,8,48.887026777710005,3,2,2,1,1,1,39200.0
2020-04-14,台北市大安區和平東路三段228巷18號四樓之1,4,住宅,50,14.40202552371,2,1,1,1,0,0,18000.0
2020-04-27,台北市大安區信義路三段156號11樓之2,11,住宅,15,11.79145042878,1,0,1,1,1,0,20000.0
2020-04-17,台北市士林區天母東路43巷4弄10號六樓,6,住宅,21,55.82637703005,3,2,2,1,1,0,85000.0
2020-04-26,台北市士林區福國路47巷2號5樓,5,住宅,24,45.33265164846001,3,2,2,1,1,0,35000.0
2020-04-23,台北市士林區中山北路七段181巷22弄4號四樓,4,住宅,44,71.77417760997001,5,2,3,0,0,0,32000.0
2020-04-24,台北市中山區德惠街16號7樓之9,7,住宅,41,13.14967547817,1,1,1,1,1,0,15000.0
