date,address,floor,type,age,twPing,bedRoom,livingRoom,restRoom,furniture,elevator,parkingSpace,price
2019-08-05,新北市汐止區福德一路111-3號14樓,14,住宅,15,57.39332708703,5,2,3,1,1,0,39000.0
2019-08-02,新北市三重區重新路四段65號6樓之7,6,套房,27,14.52605052822,1,1,1,1,1,0,13000.0
2019-09-06,新北市三重區河邊北街60之1號2樓,2,住宅,47,55.38170201388001,1,1,1,0,0,0,28000.0
2019-09-04,新北市汐止區樟樹二路１０６巷９號７樓之１,7,套房,28,16.785725610390003,1,1,1,1,1,0,14000.0
2019-09-21,新北市汐止區龍安路28巷6號5樓-6,5,套房,26,11.14107540513,1,0,1,1,1,0,11000.0
2019-09-22,新北市汐止區復興路21號9樓,9,住宅,16,24.34217588517,2,2,2,0,1,0,22000.0
2019-09-20,新北市三重區環河南路125號十一樓之十三,11,住宅,7,13.70930049852,1,1,1,1,1,0,16000.0
2019-09-07,新北市樹林區復興路４０６巷７號六樓,6,住宅,27,40.42912647015,3,2,2,1,1,0,16500.0
2019-09-07,新北市泰山區信華一街４９號三樓,3,住宅,9,80.19880291632,3,2,3,1,1,1,40000.0
2019-08-31,新北市土城區清水路235巷1弄6號1樓,1,住宅,41,30.74307611793,3,2,2,0,0,0,18000.0
2019-09-05,新北市淡水區新市五路三段348號9樓,9,住宅,6,34.03730123772,2,2,1,1,1,1,13000.0
2019-09-20,新北市淡水區沙崙路一段126巷102號22樓,22,住宅,7,43.935101597640006,2,1,2,1,1,1,12000.0
2019-09-17,新北市淡水區新春街125巷14號12樓,12,住宅,28,38.99527641801,3,2,1,1,1,0,13000.0
2019-09-16,新北市淡水區新市一路一段48號十四樓,14,住宅,12,33.31130121132,3,2,2,1,1,0,18000.0
2019-08-31,新北市土城區學府路一段１２６巷７７號十一樓,11,住宅,29,24.98952590871,2,2,1,1,1,0,15000.0
2019-09-06,新北市中和區圓通路２９９巷２２號,1,住宅,15,25.80022593819,2,2,1,1,1,1,22000.0
2019-09-09,新北市汐止區汐平路一段６巷２號３樓,3,住宅,29,43.76570159148,4,2,2,1,1,0,14000.0
2019-09-10,新北市三重區貴陽街４７巷１１號三樓,3,住宅,42,25.410000924,3,2,1,1,0,0,16000.0
2019-09-03,新北市三重區重新路四段226之1號十樓,10,住宅,13,38.29045139238,2,2,1,1,1,0,22000.0
2019-09-02,新北市中和區中山路二段２巷４５弄５號六樓,6,住宅,24,45.677501661,4,2,2,1,1,0,29000.0
2019-09-18,新北市中和區中山路二段332巷21號9樓,9,住宅,6,27.8602510131,2,1,1,1,1,0,25000.0
2019-09-10,新北市新莊區公園路１２９號十二樓之八,12,住宅,21,25.295050919820003,3,2,1,1,1,0,20000.0
2019-09-26,新北市新莊區新北大道四段65號9樓,9,住宅,7,47.262601718640006,2,2,1,1,1,1,46000.0
2019-09-09,新北市板橋區南雅東路２７之２２號九樓,9,住宅,16,35.98237630845,3,2,2,1,1,0,30000.0
2019-09-01,新北市淡水區民族路６５巷２２號五樓,5,住宅,16,33.70455122562,3,2,2,1,1,0,26000.0
2019-08-31,新北市淡水區中山路70之67號,3,住宅,47,20.691000752400004,2,2,1,1,0,0,11000.0
2019-09-13,新北市三芝區樂全街60號12樓,12,住宅,27,14.42017552437,1,1,1,1,1,0,4400.0
2019-09-19,新北市淡水區新市五路三段226號26樓,26,住宅,6,32.89385119614,2,2,1,1,1,0,14400.0
2019-09-22,新北市板橋區雙十路二段41巷11號17樓,17,住宅,23,59.214377153250005,4,2,2,1,1,1,44500.0
2019-09-24,新北市土城區中央路四段125巷5號4樓,4,住宅,41,22.478775817410003,2,1,1,1,0,0,9500.0
2019-09-21,新北市五股區新城五路5號五樓,5,住宅,9,35.08395127578,2,1,1,1,1,1,18000.0
2019-08-31,新北市新莊區自立街250號四樓,4,住宅,47,20.497400745360004,2,2,1,0,0,0,10000.0
2019-09-11,新北市中和區圓通路３３５巷１弄２７之４號,5,住宅,44,25.08632591223,3,2,1,1,0,0,15000.0
2019-09-26,新北市蘆洲區三民路376號3樓,3,住宅,8,45.48995165418,3,1,2,1,1,1,29500.0
2019-09-26,新北市蘆洲區三民路376號10樓之5,10,住宅,8,45.78942666507,3,1,2,1,1,1,33105.0
2019-09-26,新北市蘆洲區三民路376號21樓,21,住宅,8,45.11485164054,3,1,2,1,1,1,31502.0
2019-09-26,新北市蘆洲區三民路368號3樓,3,住宅,8,68.0322524739,4,1,2,1,1,1,42314.0
2019-09-26,新北市蘆洲區三民路368號17樓,17,住宅,8,61.56782723882999,4,1,2,1,1,0,41252.0
2019-09-26,新北市蘆洲區三民路366號15樓,15,住宅,8,61.60110224004,4,1,2,1,1,0,40660.0
2019-09-26,新北市蘆洲區三民路368號20樓之1,20,住宅,8,61.58597723948999,4,1,2,1,1,0,43113.0
2019-09-09,新北市蘆洲區光華路72號2樓,2,住宅,32,47.78592673767001,5,1,1,1,1,0,35000.0
2019-09-24,新北市三重區大智街136號5樓,5,住宅,41,24.805000902,3,2,1,1,0,0,15570.0
2019-09-05,新北市三重區五華街２６０號五樓,5,住宅,11,33.880001232,2,2,1,1,1,1,26000.0
2019-09-02,新北市中和區景平路260號12樓之3,12,住宅,23,22.436425815870003,2,2,1,1,1,0,25760.0
2019-09-18,新北市中和區圓通路252巷12之2號,3,住宅,42,25.24665091806,3,2,1,1,0,0,15000.0
2019-08-31,新北市永和區永和路一段228號10樓之3,10,住宅,23,33.56842622067,2,2,2,1,1,0,30000.0
2019-09-13,新北市淡水區濱海路一段388號12樓,12,住宅,11,50.97730185372001,3,2,2,1,1,1,17000.0
2019-09-05,新北市淡水區北新路１８２巷４１弄１４號四樓,4,套房,34,6.90607525113,1,0,1,1,1,0,3600.0
2019-09-27,新北市淡水區新民街180巷21號三樓,3,套房,35,5.86245021318,1,1,1,1,1,0,3500.0
2019-09-27,新北市中和區和平街54巷9之1號,2,住宅,47,5.91992521527,1,0,1,1,0,0,8500.0
2019-09-23,新北市鶯歌區行政路69號4樓,4,住宅,6,27.83605101222,2,1,1,1,1,0,13000.0
2019-07-26,新北市三重區集仁街26號9樓,9,住宅,12,43.90787659664999,3,2,2,1,1,1,30000.0
2019-09-27,新北市三重區福和街1號2樓之7,2,住宅,26,34.73305126302,2,2,1,1,1,1,25000.0
2019-09-28,新北市汐止區龍安路28巷6號7樓-6,7,套房,26,11.12897540469,1,0,1,1,1,0,12000.0
2019-10-01,新北市三重區重新路二段128巷21之1號,2,住宅,52,22.13997580509,3,2,1,1,0,0,12000.0
2019-09-12,新北市樹林區日新街１１１號四樓,4,住宅,43,29.285026064910003,2,2,1,1,0,0,12000.0
2019-09-03,新北市中和區中正路83號3樓,3,住宅,45,26.108775949410003,3,2,1,0,0,0,18000.0
2019-09-07,新北市中和區莊敬路49巷10弄9號之1，2樓,2,住宅,43,26.2267509537,3,1,1,0,0,0,20000.0
2019-09-05,新北市中和區中正路268號4樓,4,住宅,45,29.62685107734,3,2,1,1,0,0,20000.0
2019-09-03,新北市新店區安興路5號地下一層之8,-1,住宅,28,63.57340231176001,0,0,0,0,1,0,27000.0
2019-09-12,新北市新店區中央三街１２７號六樓,6,住宅,23,55.42707701553,4,2,2,1,1,1,33000.0
2019-09-01,新北市新莊區思源路171號5樓,5,住宅,31,47.52880172832,0,0,0,0,1,0,30000.0
2019-09-10,新北市新莊區富國路176巷7號4樓之9,4,住宅,30,21.52892578287,2,1,1,1,1,0,15150.0
2019-09-16,新北市新店區中興路三段２３１號四樓之五,4,套房,27,23.69785086174,1,1,1,1,1,0,16500.0
2019-09-11,新北市土城區民安街２０巷７號四樓,4,住宅,29,32.67907618833,3,2,2,1,0,0,13000.0
2019-09-15,新北市中和區水源路３６巷１弄１０之２號,3,住宅,48,28.42290103356,3,2,1,1,0,0,25000.0
2019-09-11,新北市三峽區學成路１１１號二樓,2,住宅,16,50.99242685427,3,2,2,1,1,1,25000.0
2019-09-26,新北市蘆洲區三民路368號2樓,2,住宅,8,60.70267720737,4,1,2,1,1,0,39455.0
2019-09-26,新北市蘆洲區三民路368號18樓,18,住宅,8,69.98640254496,4,1,2,1,1,1,45538.0
2019-09-29,新北市汐止區福德一路111之2號7樓,7,住宅,15,55.45127701641,3,2,2,1,1,0,48500.0
2019-10-04,新北市新莊區中原路105號10樓之3,10,住宅,27,30.504101109240004,3,1,2,1,1,0,18500.0
2019-09-15,新北市板橋區光復街１９９號七樓,7,住宅,21,22.52112581895,2,2,1,1,1,0,20000.0
2019-09-15,新北市新店區中興路三段２１９號七樓之六,7,套房,25,15.76327557321,1,1,1,1,1,0,15000.0
2019-09-15,新北市新莊區中正路８９３巷９８號四樓,4,住宅,14,58.07092711167,4,2,2,1,1,0,28000.0
2019-09-15,新北市泰山區信華六街１３號十六樓,16,住宅,10,34.01612623695,2,1,1,1,1,1,22000.0
2019-09-16,新北市新莊區龍安路４７號二樓,2,住宅,20,33.01485120054,2,2,1,1,1,1,23000.0
2019-09-08,新北市淡水區民族路１６８號三樓,3,住宅,15,36.62670133188,3,2,2,1,1,0,21000.0
2019-09-14,新北市淡水區中山北路一段２５５號二十六樓之８,26,套房,24,15.427500561,1,0,1,1,1,0,9000.0
2019-09-19,新北市新店區安康路二段１４７之５號五樓,5,住宅,14,44.43422661579001,3,2,2,1,1,1,29000.0
2019-09-06,新北市中和區中山路三段223號15樓,15,住宅,6,24.73240089936,2,1,1,0,1,0,25000.0
2019-09-19,新北市永和區安樂路１４４巷２１之３號三樓,3,住宅,43,28.35635103114,3,2,2,1,0,0,20000.0
2019-09-16,新北市汐止區仁愛路１５１巷１６號十三樓,13,住宅,14,25.47655092642,2,2,1,1,1,0,19000.0
2019-10-04,新北市三重區環河南路125號十一樓之七,11,套房,7,13.403775487410002,1,1,1,1,1,0,17000.0
2019-10-06,新北市汐止區大同路二段184巷2號4樓-6,4,住宅,25,27.47305099902,2,2,1,0,1,0,20000.0
2019-09-18,新北市三重區長壽西街184號4樓,4,住宅,46,21.477500781,3,2,2,0,0,0,15000.0
2019-08-01,新北市中和區大智街42巷18號之4,5,住宅,44,26.6805009702,3,2,1,0,0,0,14000.0
2019-08-12,新北市中和區南山路27號,1,住宅,6,31.09095113058,0,0,0,0,1,0,30000.0
2019-08-25,新北市中和區福祥路70號10樓之2,10,住宅,16,15.92360057904,0,0,0,0,1,0,18000.0
2019-09-14,新北市中和區和平街54巷1弄142號,3,住宅,45,28.57717603917,3,1,1,0,0,0,18000.0
2019-09-16,新北市板橋區四川路一段31巷10樓,10,住宅,28,27.624301004520003,3,2,2,1,1,0,25000.0
2019-09-27,新北市板橋區新府路118號6樓,6,住宅,15,23.99430087252,2,2,2,0,1,0,28000.0
2019-09-22,新北市土城區中央路四段５０號二樓之２,2,住宅,8,44.23155160842,4,2,2,1,1,0,32000.0
2019-09-12,新北市林口區文化三路二段１１５巷４８號二樓,2,住宅,15,28.31702602971,2,2,1,1,1,0,15000.0
2019-09-20,新北市新莊區瓊林路３６號十三樓之一,13,住宅,15,43.93207659753,3,2,2,1,1,1,26162.0
2019-09-22,新北市淡水區中正東路一段３巷１４弄２３號十九樓,19,住宅,16,42.35302654011,2,2,2,1,1,0,23000.0
2019-09-22,新北市淡水區自立路８之１號七樓,7,套房,29,13.84542550347,1,1,1,1,1,0,12000.0
2019-08-19,新北市中和區建八路185號二樓,2,住宅,16,17.55407563833,1,0,1,0,1,0,14947.0
2019-09-21,新北市土城區中央路四段１６５巷１５之１號九樓,9,住宅,10,51.06805185702,3,2,2,1,1,1,22500.0
2019-09-22,新北市新莊區新北大道七段３１６號十八樓,18,套房,24,16.809925611270003,1,1,1,0,1,0,19500.0
2019-09-17,新北市林口區仁愛路一段３８２號九樓之二　,9,住宅,16,40.35652646751001,1,2,1,1,1,1,22000.0
2019-09-23,新北市新莊區裕民街４１之３號,4,住宅,46,22.3245008118,4,2,1,1,0,0,13500.0
2019-09-23,新北市新莊區思源路３７０巷７０號六樓,6,套房,11,24.21815088066,1,1,1,1,1,1,20000.0
2019-09-24,新北市新莊區福前街３２５號九樓,9,住宅,10,28.06595102058,2,2,1,1,1,0,25000.0
2019-09-22,新北市板橋區雙十路二段41巷11號17樓,17,住宅,23,59.214377153250005,4,2,2,1,1,1,44500.0
2019-10-10,新北市汐止區龍安路28巷6號11樓-12,11,套房,26,12.656600460240002,1,0,1,1,1,0,12500.0
2019-07-01,新北市新莊區中平路262號,1,住宅,26,102.28130371932,0,0,0,0,1,0,136224.0
2019-10-04,新北市樹林區俊保路16號10樓,10,住宅,25,36.07312631175,3,1,2,1,1,0,16000.0
2019-09-16,新北市中和區中正路160號5樓之2,5,住宅,27,11.655325423830002,0,0,0,0,1,0,9500.0
2019-10-04,新北市中和區華新街109巷26號10樓,10,住宅,27,39.46415143506,3,2,2,1,1,0,16200.0
2019-09-17,新北市中和區景平路159巷26之1號11樓,11,住宅,8,18.53720067408,1,1,1,1,1,0,22000.0
2019-09-17,新北市中和區保平路255號8樓,8,住宅,16,32.59437618525,2,2,2,0,1,0,25000.0
2019-10-01,新北市永和區得和路317號3樓,3,住宅,47,22.42432581543,2,1,1,1,0,0,19800.0
2019-10-04,新北市中和區景德街21號11樓之5,11,住宅,6,28.338201030480004,2,2,2,1,1,0,27000.0
2019-10-01,新北市中和區景德街5號十樓之7,10,住宅,6,34.59390125796,3,2,2,1,1,0,30000.0
2019-10-13,新北市汐止區樟樹二路339巷12號6樓-1,6,套房,26,14.0965005126,1,0,1,1,1,0,11000.0
2019-10-07,新北市三重區成功路10號3樓之9,3,套房,30,15.54245056518,1,1,1,1,1,0,15000.0
2019-10-10,新北市三重區中華路111巷12之1號2樓,2,住宅,51,19.33277570301,3,2,1,1,0,0,15000.0
2019-09-25,新北市蘆洲區三民路３６０號十五樓之三,15,住宅,8,53.00707692753001,4,2,2,1,1,1,41000.0
2019-09-22,新北市八里區中華路二段400號15樓,15,住宅,28,35.915826306030006,3,2,2,1,1,0,16000.0
2019-10-07,新北市淡水區淡金路12號十四樓,14,住宅,16,31.02742612827,2,2,1,1,1,0,24000.0
2019-10-03,新北市淡水區新春街190號18樓之3,18,住宅,24,32.68210118844,2,1,2,1,1,0,15000.0
2019-09-29,新北市淡水區新市三路一段116號四樓,4,住宅,4,34.926651270060006,2,1,2,1,1,1,15000.0
2019-09-26,新北市淡水區新春街８５巷２５弄７９號八樓,8,住宅,10,57.74120209968,3,2,2,1,1,1,15000.0
2019-10-04,新北市新莊區豐年街124巷20弄16之2號,3,住宅,47,23.26527584601,2,2,1,1,0,0,15200.0
2019-09-21,新北市土城區明德路二段56號9樓之2,9,住宅,25,19.39932570543,3,2,2,0,1,0,19000.0
2019-09-23,新北市土城區延吉街１７６號五樓,5,住宅,29,30.310501102200003,3,2,2,0,1,0,15000.0
2019-09-26,新北市板橋區東門街３０之２號三樓之八十五,3,住宅,35,39.42785143374,3,2,2,1,1,0,36800.0
2019-10-07,新北市新店區安祥路110巷81號10樓,10,住宅,28,36.25462631835,2,1,1,1,1,1,14000.0
2019-09-16,新北市新店區民權路103號3樓,3,住宅,33,29.436276070410003,0,0,0,0,1,0,30000.0
2019-09-27,新北市林口區文林五街５２號十一樓,11,住宅,9,36.33630132132,2,2,1,1,1,1,19000.0
2019-09-28,新北市新莊區中原路３４１號二樓,2,住宅,21,41.72080151712001,3,1,2,1,1,1,25000.0
2019-10-09,新北市蘆洲區鷺江街89巷13號六樓,6,套房,17,14.68940053416,1,0,1,1,1,0,15000.0
2019-09-26,新北市三重區自強路四段108號12樓,12,住宅,28,31.25732613663,3,2,2,1,1,0,22000.0
2019-08-23,新北市汐止區大同路二段281號5樓之4,5,住宅,28,33.64102622331,3,2,2,1,1,0,15210.0
2019-09-24,新北市汐止區福德一路256號7樓,7,住宅,28,22.76010082764,2,2,1,1,1,0,14760.0
2019-09-28,新北市中和區民富街７之３號,4,住宅,46,21.35347577649,3,1,1,1,0,0,15000.0
2019-09-03,新北市汐止區莊敬街130號11樓,11,住宅,28,43.34825157630001,3,2,2,1,1,1,30000.0
2019-09-25,新北市永和區永元路１２８巷１號三樓,3,住宅,48,27.4065009966,3,2,2,1,0,0,19000.0
2019-10-03,新北市中和區錦和路404之1號4樓,4,住宅,41,26.8317509757,3,2,1,0,0,0,14000.0
2019-09-26,新北市三重區重新路四段２４２號三樓之五,3,套房,14,16.55280060192,1,1,1,1,1,0,16500.0
2019-09-21,新北市新莊區新北大道二段276號七樓,7,住宅,27,42.17757653373,0,0,0,0,1,0,26000.0
2019-10-01,新北市泰山區明志路二段１０５巷１號四樓,4,住宅,28,30.20160109824,3,2,2,0,1,0,19000.0
2019-09-30,新北市新店區光華街10-2號9樓,9,住宅,5,31.07280112992,2,1,1,0,1,0,23500.0
2019-10-15,新北市永和區中山路一段232號五樓之二,5,套房,21,7.79845028358,1,0,1,1,1,0,12000.0
2019-10-01,新北市鶯歌區國中街49號七樓,7,住宅,5,38.27835139194001,2,2,1,1,1,1,17000.0
2019-07-31,新北市五股區芳洲一路71號五樓,5,住宅,9,29.269901064360003,2,1,1,1,1,1,18000.0
2019-08-17,新北市五股區新城六路245號八樓,8,住宅,8,32.93922619779,2,1,1,1,1,1,18000.0
2019-09-01,新北市五股區芳洲九路62號九樓,9,住宅,8,39.77572644639,2,1,1,1,1,1,21000.0
2019-08-31,新北市五股區新城五路5號七樓,7,住宅,9,26.54740096536,2,1,1,1,1,0,18150.0
2019-10-06,新北市五股區御史路60號二樓,2,住宅,5,28.65280104192,3,1,1,1,1,0,16500.0
2019-09-27,新北市新莊區民安西路２５２巷４３號八樓,8,住宅,5,39.42482643363,2,2,1,1,1,1,23000.0
2019-10-02,新北市淡水區新市三路一段126號六樓,6,住宅,4,26.2570009548,1,2,1,1,1,1,12000.0
2019-10-01,新北市樹林區啟智街８０巷５號,1,住宅,32,39.91487645145,0,1,1,0,0,0,20000.0
2019-10-03,新北市三重區進安街１８０號六樓,6,住宅,16,36.608551331220006,2,2,1,1,1,1,30000.0
2019-10-04,新北市蘆洲區三民路３８號七樓,7,住宅,17,68.6977524981,3,2,2,1,1,1,40000.0
2019-10-02,新北市淡水區濱海路一段１２３號五樓,5,住宅,5,68.41037748765,3,2,2,1,1,1,23000.0
2019-10-03,新北市新莊區西盛街２０１巷２２之４號,5,住宅,42,33.02695120098,4,2,2,1,0,0,14000.0
2019-09-18,新北市新店區安祥路102巷27號7樓,7,住宅,27,36.01262630955,3,2,2,1,1,0,16200.0
2019-08-16,新北市新店區安忠路57巷17號8樓,8,住宅,6,39.79085144694001,3,2,2,1,1,0,16200.0
2019-10-16,新北市汐止區龍安路28巷6號4樓-6,4,套房,26,11.12897540469,1,0,1,1,1,0,11000.0
2019-10-18,新北市汐止區龍安路28巷6號12F-1,12,住宅,26,25.40395092378,2,2,1,1,1,0,20000.0
2019-10-05,新北市汐止區南興路６２號二樓,2,住宅,11,34.37610125004,2,2,1,1,1,1,22609.0
2019-08-23,新北市蘆洲區三民路３７０號三樓之六,3,住宅,8,25.125650913660003,2,2,1,1,1,0,26000.0
2019-10-14,新北市三重區重新路二段42號19樓之6,19,住宅,15,27.56380100232,2,2,1,0,1,0,25000.0
2019-09-25,新北市三重區仁信街21號,1,住宅,27,14.62587553185,0,0,0,0,0,0,15000.0
2019-10-14,新北市永和區福和路193號7樓之4,7,住宅,41,13.195050479820004,1,0,1,1,1,0,14500.0
2019-10-02,新北市淡水區八勢路５０巷６３號十四樓,14,住宅,6,65.05565236566001,3,2,2,1,1,1,46000.0
2019-09-29,新北市淡水區自強路８號六樓,6,套房,16,12.82297546629,1,0,1,1,1,0,10000.0
2019-09-29,新北市板橋區新府路１３６號十八樓,18,套房,15,12.01832543703,1,1,1,1,1,0,19000.0
2019-10-05,新北市板橋區仁愛路６２巷１０之４號,5,住宅,40,29.814401084160004,3,2,2,1,0,0,16500.0
2019-09-29,新北市新莊區福前街３２１號七樓,7,住宅,10,29.0702510571,1,2,1,1,1,1,23500.0
2019-10-05,新北市林口區中山路５２８號八樓,8,住宅,16,45.97395167178001,3,2,2,1,1,1,20000.0
2019-10-14,新北市板橋區大仁街56號,1,住宅,50,29.89607608713,0,0,0,0,0,0,37000.0
2019-10-16,新北市板橋區中山路一段160之10號,1,住宅,14,38.47195139898,0,0,0,0,1,0,58000.0
2019-10-15,新北市淡水區濱海路二段202巷82號十樓,10,住宅,6,30.01405109142,2,1,1,1,1,1,15360.0
2019-09-30,新北市永和區永元路52巷28號三樓,3,住宅,52,28.807076047530003,3,1,1,1,0,0,20000.0
2019-08-13,新北市土城區中央路二段209號十二樓,12,住宅,27,34.80262626555,3,2,1,1,1,0,20000.0
2019-08-23,新北市土城區南天母路35號,1,住宅,29,17.72952564471,2,2,1,1,1,0,15000.0
2019-10-01,新北市永和區中和路435號四樓之一,4,住宅,32,27.91470101508,1,2,1,1,1,0,22000.0
2019-10-08,新北市永和區福和路353號11樓之10,11,住宅,42,12.05462543835,1,0,1,1,1,0,15000.0
2019-09-29,新北市淡水區新市一路一段２０８號十七樓,17,住宅,7,43.1365015686,3,2,2,1,1,0,25000.0
2019-09-06,新北市新莊區龍安路501巷2號3樓,3,住宅,36,23.44980085272,2,1,1,1,0,0,15000.0
2019-10-19,新北市板橋區文化路二段297號4樓,4,住宅,26,45.57767665737,3,2,2,1,1,0,31500.0
2019-10-09,新北市三重區仁義街２１４號五樓,5,住宅,29,18.6037506765,0,1,1,1,1,0,15000.0
2019-10-24,新北市蘆洲區三民路366號15樓之2,15,住宅,8,76.69282778883,4,1,2,1,1,1,48530.0
2019-10-24,新北市蘆洲區三民路366號18樓之2,18,住宅,8,76.83197779389,4,1,2,1,1,1,49996.0
2019-10-24,新北市蘆洲區三民路366號21樓之2,21,住宅,8,68.67052749711,4,1,2,1,1,0,46696.0
2019-10-24,新北市蘆洲區三民路366號22樓之2,22,住宅,8,76.83197779389,4,1,2,1,1,1,50882.0
2019-10-24,新北市蘆洲區三民路366號23樓之2,23,住宅,8,76.83197779389,4,1,2,1,1,1,50882.0
2019-10-24,新北市蘆洲區三民路368號23樓,23,住宅,8,69.84422753979,4,1,2,1,1,1,46059.0
2019-10-09,新北市汐止區福德一路２６號六樓,6,住宅,16,44.17407660633,4,2,2,1,1,1,26255.0
2019-09-29,新北市中和區中正路65巷2弄1號三樓,3,住宅,46,27.62430100452,3,2,1,0,0,0,16500.0
2019-10-11,新北市永和區得和路４１０號二樓,2,住宅,46,22.87807583193,0,1,1,1,0,0,17000.0
2019-10-02,新北市永和區安樂路310號8樓,8,住宅,28,42.51637654605,3,2,2,0,1,0,26500.0
2019-10-11,新北市汐止區保長路７０號十三樓,13,住宅,13,22.60885082214,2,2,1,1,1,0,19000.0
2019-10-22,新北市汐止區新昌路48號5樓,5,住宅,24,34.32467624817,3,2,2,0,1,0,23000.0
2019-10-13,新北市汐止區樟樹二路７９之１號四樓,4,住宅,7,25.14682591443,2,2,1,1,1,0,27000.0
2019-10-13,新北市三重區頂崁街２０１巷６號三樓,3,住宅,40,27.454900998360003,3,2,1,1,0,0,19000.0
2019-10-10,新北市板橋區新府路７０號四樓,4,套房,15,14.68637553405,1,1,1,1,1,0,20000.0
2019-10-05,新北市土城區學府路二段２３８號十七樓,17,住宅,7,68.82480250272,4,2,2,1,1,1,35000.0
2019-10-12,新北市板橋區民生路二段８之１號九樓,9,住宅,26,23.12310084084,2,2,1,1,1,0,20000.0
2019-10-07,新北市新莊區新泰路４２號十二樓之三,12,住宅,8,73.58010267564,4,2,2,1,1,1,47000.0
2019-10-13,新北市新莊區中華路一段１３６巷２６號五樓之三,5,套房,24,10.2547503729,0,1,1,1,1,0,10000.0
2019-10-09,新北市新莊區中央路２３２號十二樓,12,住宅,9,61.72815224466,2,2,2,1,1,1,30500.0
2019-10-07,新北市淡水區中正東路一段６３之５號十三樓,13,住宅,11,31.93492616127,2,2,1,1,1,1,17000.0
2019-10-14,新北市蘆洲區光復路７８號五樓,5,住宅,9,27.279450991980003,2,1,1,1,1,0,23000.0
2019-10-01,新北市汐止區新北市汐止區湖前街110巷97弄3-5號9樓,9,住宅,24,24.5630008932,1,2,1,0,1,0,15500.0
2019-10-07,新北市中和區中和路２２９號三樓,3,住宅,5,35.87045130438,2,2,2,1,1,1,32000.0
2019-10-08,新北市永和區永和路二段168號7樓,7,住宅,12,65.77862739195,4,2,3,1,1,1,50000.0
2019-10-13,新北市樹林區潭興街４５號十樓,10,住宅,26,37.35572635839,2,2,1,1,1,0,20000.0
2019-09-30,新北市中和區圓通路367巷20弄1號1樓,1,住宅,40,25.443275925210003,0,0,0,0,0,0,19800.0
2019-08-12,新北市中和區圓通路246號2樓,2,住宅,11,26.269100955240003,2,1,1,1,1,0,20000.0
2019-10-16,新北市三峽區大觀路１２之９號十樓,10,住宅,6,54.98240199936,3,2,2,1,1,1,27000.0
2019-10-14,新北市汐止區汐萬路一段２０９號三樓,3,住宅,8,32.77587619185,2,2,1,1,1,0,18500.0
2019-10-28,新北市汐止區大同路二段236號4樓-6,4,套房,27,11.34677541261,1,0,1,0,1,0,7500.0
2019-10-27,新北市汐止區復興路23號4樓,4,住宅,16,24.56602589331,2,2,1,1,1,0,21500.0
2019-10-15,新北市汐止區工建路５６號６樓,6,住宅,24,35.229151281060005,2,2,2,1,1,0,18500.0
2019-10-24,新北市蘆洲區三民路366號16樓之2,16,住宅,8,76.83197779389,4,1,2,1,1,1,49309.0
2019-10-28,新北市淡水區沙崙路一段117號17樓,17,住宅,4,26.25095095458,2,2,1,1,1,0,15000.0
2019-10-26,新北市淡水區新民街152巷6弄1號,1,住宅,45,20.1767507337,2,2,1,1,0,0,14000.0
2019-10-16,新北市新莊區萬安街３號十四樓之十八,14,套房,15,13.83030050292,1,1,1,1,1,0,16000.0
2019-10-28,新北市新莊區中央路238號21樓,21,住宅,9,52.571476911690006,2,2,2,1,1,0,45044.0
2019-10-16,新北市汐止區大同路三段６２１號１６樓之７,16,住宅,24,35.91582630603,3,2,2,1,1,1,16000.0
2019-10-13,新北市中和區景平路１５１之３號三樓,3,住宅,12,41.83877652141,2,2,1,1,1,1,30000.0
2019-10-25,新北市三峽區中華路38號13樓,13,住宅,4,30.05337609285,2,2,1,1,1,1,12000.0
2019-10-07,新北市中和區復興路２６８號十七樓之六,17,套房,25,8.545625310750001,1,1,1,1,1,0,9000.0
2019-10-12,新北市中和區連城路１３９巷３２之２號,3,住宅,54,18.8760006864,1,2,1,1,0,0,17500.0
2019-10-24,新北市中和區環中路120號4樓,4,住宅,41,8.799725319990001,1,0,1,1,0,0,4500.0
2019-10-30,新北市中和區景德街95之9號2樓,2,住宅,16,8.26127530041,1,1,1,1,1,0,13000.0
2019-10-03,新北市中和區景平路317之3號4樓,4,住宅,45,24.12135087714,3,1,1,1,0,0,15500.0
2019-10-24,新北市中和區捷運路58之11號10樓,10,住宅,12,17.923125651750002,2,1,1,1,1,0,20000.0
2019-10-24,新北市蘆洲區三民路366號22樓之2,22,住宅,8,76.83197779389,4,1,2,1,1,1,50882.0
2019-10-20,新北市淡水區沙崙路一段133號10樓,10,住宅,4,43.18187657025,2,2,2,1,1,0,21000.0
2019-10-15,新北市淡水區中正東路一段3巷14弄19號9樓之3,9,住宅,16,34.33677624861,3,2,2,1,1,0,16200.0
2019-10-07,新北市蘆洲區三民路505之1號3樓,3,住宅,13,50.51145183678,3,2,2,1,1,1,25000.0
2019-10-29,新北市淡水區水碓25巷16號,1,住宅,28,32.97855119922001,2,1,1,1,1,0,8000.0
2019-10-30,新北市淡水區新春街140號五樓之8,5,住宅,27,32.08012616655,3,2,2,1,1,0,13000.0
2019-10-12,新北市淡水區民權路２２１號二十一樓之３,21,住宅,16,27.02837598285,2,2,1,1,1,0,28000.0
2019-10-14,新北市淡水區沙崙路一段１０１號十六樓,16,住宅,4,54.44395197978001,3,2,2,1,1,1,21000.0
2019-09-25,新北市三重區仁義街220巷9號3樓,3,住宅,46,22.385000814,2,2,1,1,0,0,16200.0
2019-07-29,新北市三重區中央南路126號4樓,2,住宅,46,33.880001232,3,2,2,1,0,0,16200.0
2019-10-15,新北市蘆洲區三民路３７０號四樓之３,4,住宅,8,38.33582639403,3,2,2,1,1,0,32000.0
2019-10-31,新北市汐止區建成路56巷69弄15號19樓-1,19,套房,25,16.26240059136,1,1,1,1,1,0,16160.0
2019-10-30,新北市中和區景德街5號十樓之1,10,住宅,6,24.09110087604,2,2,1,1,1,0,26000.0
2019-10-18,新北市永和區得和路２４３巷１４弄４號,1,住宅,39,40.553151474660005,3,2,2,1,0,0,27000.0
