date,address,floor,type,age,twPing,bedRoom,livingRoom,restRoom,furniture,elevator,parkingSpace,price
2023-03-20,新北市中和區中正路１３８號２樓,2,套房,25,35.56795129338,1,1,1,1,1,0,12000.0
2023-03-06,新北市永和區永元路１８巷４０弄１７號,1,住宅,49,15.88730057772,2,2,1,1,0,0,25000.0
2023-03-21,新北市中和區莊敬路４９巷１５弄５號三樓,3,住宅,39,27.06165098406,3,2,1,1,0,0,14000.0
2023-03-13,新北市中和區永和路９巷１５號五樓,5,住宅,40,28.18997602509,3,2,2,1,0,0,20000.0
2023-03-16,新北市中和區中正路７６３號六樓,6,住宅,27,44.12265160446,3,2,2,1,1,0,29500.0
2023-03-25,新北市中和區南山路１２７巷１８弄３２號３樓,3,住宅,45,20.76360075504,3,2,1,1,0,0,20000.0
2023-03-10,新北市永和區中山路一段１８４巷９弄１１號２樓,2,住宅,46,30.1290010956,3,2,1,1,0,0,27000.0
2023-03-08,新北市中和區員山路１４８巷３９號三樓,3,住宅,44,26.38405095942,2,2,1,1,0,0,22500.0
2023-03-22,新北市三峽區學勤路１７２之３號十樓,10,住宅,14,29.775076082730003,2,1,1,1,1,0,21000.0
2023-03-24,新北市三峽區民生街２７巷１６號２樓之２,2,套房,27,7.0210252553100005,1,1,1,1,1,0,5800.0
2023-03-13,新北市鶯歌區龍七路２９６號６樓,6,住宅,3,32.57017618437,2,1,1,1,1,0,17700.0
2023-03-26,新北市鶯歌區鳳鳴路５４５號１０樓,10,住宅,2,22.25795080938,2,1,1,1,1,0,17100.0
2023-03-07,新北市樹林區學勤路５９５號２樓,2,住宅,12,56.76715206426,4,1,2,1,1,1,28500.0
2023-03-17,新北市樹林區學勤路６８７號十樓,10,住宅,15,40.87682648643,3,2,2,1,1,0,24000.0
2023-03-17,新北市鶯歌區尖山路２６６之８號１５樓,15,住宅,3,46.899601705440006,3,1,2,1,1,1,20000.0
2023-03-22,新北市樹林區保安街二段２９７號１２樓,12,住宅,29,50.42977683381,4,2,2,1,1,1,20200.0
2023-03-26,新北市鶯歌區育英街８９巷８號三樓,3,住宅,28,32.234401172160005,3,2,2,1,1,0,16000.0
2023-03-27,新北市三重區三和路二段３０號１０樓之１,10,住宅,30,13.53385049214,1,1,1,1,1,0,15000.0
2023-03-18,新北市三重區仁慈街１０號四樓,4,住宅,35,24.98952590871,2,2,2,1,0,0,20000.0
2023-03-20,新北市三重區集英路１４０號２樓,2,住宅,1,55.33027701201,3,2,2,1,1,1,55300.0
2023-03-16,新北市蘆洲區永平街３２巷１６弄９號五樓,5,住宅,35,28.673976042690004,2,2,1,1,0,0,20500.0
2023-02-10,新北市板橋區篤行路三段４０號３樓,3,住宅,23,33.12677620461,3,2,2,1,1,0,18000.0
2023-03-25,新北市板橋區南雅東路８號１０樓之１８,10,住宅,26,12.236125444950002,1,1,1,1,1,0,13000.0
2023-03-27,新北市板橋區華江一路２０２號十八樓,18,住宅,5,30.110851094940003,1,1,1,1,1,1,28300.0
2023-03-18,新北市土城區中央路四段７６之７號五樓,5,住宅,16,55.30305201102,4,2,2,1,1,0,38000.0
2023-03-09,新北市板橋區四川路二段２４３號５樓之５,5,套房,31,13.91802550611,1,0,0,1,1,0,13000.0
2023-03-21,新北市土城區學府路一段１２２之３號１７樓,17,套房,28,9.51967534617,1,1,1,1,1,0,10500.0
2023-03-20,新北市板橋區忠孝路４８巷４弄４５號五樓,5,住宅,38,25.455375925650003,3,1,1,1,0,0,15300.0
2023-03-25,新北市新莊區天泉二街２４巷１２號５樓,5,住宅,36,29.9777510901,3,2,2,1,0,0,15500.0
2023-03-20,新北市五股區新城一路６６號六樓,6,住宅,1,20.11927573161,2,2,1,1,1,0,22000.0
2023-02-13,新北市泰山區貴陽街１２號,1,住宅,28,53.551576947330005,0,0,0,1,1,0,48185.0
2023-03-22,新北市五股區五福路１００巷１９號三樓,3,住宅,7,31.92282616083,2,2,1,1,1,0,19500.0
2023-03-01,新北市新莊區民本街２３巷２５號二樓,2,住宅,42,20.775700755480003,2,2,1,1,0,0,16000.0
2023-03-15,新北市新店區建國路２２４號３樓,3,住宅,43,25.07120091168,3,2,1,1,0,0,18000.0
2023-03-15,新北市深坑區萬福路７５巷２５號三樓,3,住宅,40,21.489600781440004,2,1,1,1,0,0,14000.0
2023-03-05,新北市新店區吉安街４７號２樓,2,住宅,28,29.285026064910003,3,2,2,1,1,0,25000.0
2023-03-12,新北市汐止區大同路二段３２６號１１樓,11,住宅,29,17.992700654280004,2,1,1,1,1,0,18000.0
2023-03-10,新北市汐止區康寧街４５９巷９號５樓,5,住宅,3,36.602501331,2,1,1,1,1,0,28000.0
2023-03-13,新北市汐止區樟樹二路４９號十五樓,15,住宅,7,44.83655163042,3,2,2,1,1,1,31000.0
2023-03-16,新北市汐止區鄉長路一段５５巷９號３樓,3,住宅,15,28.53785103774,3,2,2,1,1,0,24700.0
2023-03-18,新北市汐止區新台五路二段９３號１６樓之４,16,住宅,28,41.06437649325,3,2,2,1,1,1,22000.0
2023-03-22,新北市汐止區大同路二段２３１號二十六樓,26,套房,12,15.08265054846,1,1,1,1,1,0,16300.0
2023-03-26,新北市汐止區大同路二段３３９號５樓之６,5,套房,23,11.004950400180002,1,0,1,1,1,0,13500.0
2023-03-07,新北市淡水區新民街２２２巷１０號之１十三樓,13,住宅,31,40.58340147576,3,2,2,1,1,0,17000.0
2023-03-18,新北市淡水區新民街１８０巷７弄１５號四樓,4,套房,34,11.29837541085,1,0,1,1,1,0,6000.0
2023-03-23,新北市淡水區北新路１８４巷６７號５樓,5,住宅,27,15.11592554967,1,1,1,1,1,0,11800.0
2023-03-18,新北市淡水區民權路２５號二十二樓之１１,22,住宅,15,15.835875575849998,2,1,1,1,1,0,20000.0
2023-03-18,新北市淡水區新市一路三段１０號十三樓,13,住宅,13,44.13172660479,1,2,2,1,1,1,32000.0
2023-03-13,新北市淡水區淡金路７７巷９號十二樓,12,住宅,23,40.63482647763,3,2,2,1,1,0,28000.0
2023-03-13,新北市淡水區淡金路１６巷１０５號十樓,10,住宅,9,29.436276070410003,2,2,1,1,1,0,23000.0
2023-03-17,新北市淡水區中正路二段４０號二十三樓,23,住宅,6,70.44620256168,2,2,2,1,1,1,42000.0
2023-03-25,新北市淡水區淡金路１４號十樓之５,10,住宅,16,25.94542594347,2,1,1,1,1,0,20000.0
2023-03-25,新北市八里區龍米路二段５５號六樓,6,住宅,27,34.11595124058,3,2,2,1,1,0,12000.0
2023-03-27,新北市淡水區新春街１４０號十六樓之１,16,住宅,27,19.22387569905,1,1,1,1,1,0,12000.0
2023-03-13,新北市汐止區東勢街２０１巷１２９弄４８號六樓,6,住宅,5,44.83957663053,4,2,2,1,1,1,60000.0
2023-03-27,新北市汐止區大同路一段２１７號３樓之３,3,住宅,14,22.1430008052,2,1,1,0,1,0,20000.0
2023-03-27,新北市汐止區忠孝東路４２８號１３樓之３,13,套房,27,10.1942503707,1,0,1,1,1,0,13000.0
2023-03-19,新北市汐止區仁愛路１７０號六樓之１,6,住宅,18,49.47690179916,3,2,2,1,1,1,28000.0
2023-03-18,新北市汐止區民族二街１３號三樓之１,3,住宅,7,28.168801024320004,2,1,1,1,1,0,15000.0
2023-03-28,新北市新店區富貴街１２巷１２號３樓,3,住宅,41,23.443750852500003,3,2,1,1,0,0,16000.0
2023-03-27,新北市新店區寶元路一段８５巷１７號２樓,2,住宅,36,35.35317628557,3,2,2,1,0,0,28000.0
2023-02-21,新北市五股區新城三路４３號２樓,2,住宅,8,38.51127640041,2,1,1,1,1,1,19500.0
2023-03-14,新北市新莊區中和街１８１號五樓,5,住宅,31,15.24902555451,1,1,1,1,1,0,15000.0
2023-03-10,新北市新莊區福壽街１５４號四樓,4,住宅,38,28.949251052700003,3,1,2,1,0,0,17000.0
2023-03-21,新北市泰山區黎明路５號二樓,2,住宅,36,27.11307598593,3,2,1,1,0,0,15000.0
2023-03-24,新北市土城區延吉街２１０號四樓,4,住宅,28,25.951475943690003,3,2,1,1,1,0,20000.0
2023-03-20,新北市土城區中華路一段４３號二樓,2,住宅,28,33.38692621407,3,2,1,1,1,0,22000.0
2023-03-10,新北市土城區金城路三段１６０號七樓,7,住宅,27,33.229626208350005,3,2,2,1,1,0,20000.0
2023-03-27,新北市土城區學士路８２號１４樓,14,住宅,2,27.17660098824,2,1,1,1,1,0,22900.0
2023-03-19,新北市板橋區漢生東路２６０號九樓,9,住宅,13,86.75397815468999,4,2,2,1,1,1,85000.0
2023-03-20,新北市板橋區萬板路３１２巷１２號４樓,4,住宅,34,31.505376145650004,3,2,2,1,0,0,17000.0
2023-03-16,新北市土城區延和路６２巷１５號４樓,4,住宅,42,25.36765092246,3,1,1,1,0,0,19000.0
2023-03-19,新北市板橋區長江路二段８８號六樓,6,住宅,25,34.3640012496,3,2,2,1,1,0,27280.0
2023-03-22,新北市土城區金城路二段１６０號十四樓,14,住宅,1,26.25095095458,2,1,1,1,1,1,27000.0
2023-03-07,新北市三重區車路頭街４４巷１１號,1,住宅,53,15.30347555649,1,1,1,1,0,0,23000.0
2023-03-01,新北市三重區三和路四段１２５巷３７號五樓,5,住宅,42,25.497725927190004,4,1,1,1,0,0,13000.0
2023-03-25,新北市三重區六張街１９９號１樓,1,住宅,30,13.68510049764,2,1,1,1,0,0,13000.0
2023-03-22,新北市三重區大同北路１５６巷３８號四樓,4,住宅,26,25.1377509141,1,2,1,1,1,0,18500.0
2023-03-09,新北市三重區集英路１２０號７樓,7,套房,14,11.35282541283,1,1,1,1,1,0,9000.0
2023-03-25,新北市三重區溪尾街１０３號３樓,3,住宅,36,31.42067614257,3,2,2,1,1,0,22000.0
2023-03-17,新北市三峽區復興路３６９號四樓之４,4,套房,28,12.00320043648,1,1,1,1,1,0,11000.0
2023-03-28,新北市樹林區保安街二段３３７巷７１號九樓,9,住宅,29,24.575100893640005,2,1,1,1,1,0,18000.0
2023-03-19,新北市三峽區學府路３０號１２樓,12,住宅,14,49.1562517875,3,2,2,1,1,1,28000.0
2023-03-25,新北市三峽區介壽路三段２００巷２弄１６號四樓,4,住宅,29,25.21942591707,2,1,1,1,0,0,9000.0
2023-03-21,新北市永和區得和路２４３巷７弄１０號二樓,2,住宅,47,26.05432594743,3,2,1,1,0,0,25000.0
2023-03-27,新北市中和區南山路１０號４樓,4,住宅,29,36.5117513277,4,1,2,1,1,0,25200.0
2023-03-21,新北市中和區錦和路１９５巷１弄１０號,1,住宅,47,22.07040080256,3,2,1,0,0,0,26000.0
2023-03-21,新北市永和區民生路７５號五樓,5,住宅,43,23.153350841940004,3,2,1,0,0,0,23000.0
2023-03-15,新北市永和區信義路８７號２樓,2,住宅,42,25.80930093852,5,2,2,1,0,0,25000.0
2023-03-22,新北市中和區景平路７０３巷２弄２５號二樓,2,住宅,45,25.23152591751,3,1,1,1,0,0,25000.0
2023-03-24,新北市中和區民德路６５號十六樓,16,套房,28,13.13455047762,1,1,1,1,1,0,13600.0
2023-03-20,新北市中和區南山路１４６ 巷７ 號２ 樓,2,住宅,51,13.93617550677,2,2,1,1,0,0,13000.0
2023-03-10,新北市中和區中正路２７６號５樓,5,住宅,29,49.52832680103,3,2,2,1,1,0,25000.0
2023-03-14,新北市中和區工專路６６號９樓,9,住宅,3,28.90387605105,2,1,1,1,1,0,23500.0
2023-03-29,新北市中和區員山路２６６巷２１號５樓,5,住宅,42,34.90547626929,3,2,1,1,0,0,15500.0
2023-03-15,新北市中和區景平路４８８ 號８ 樓,8,套房,15,19.65645071478,1,1,1,1,1,0,20000.0
2023-03-25,新北市永和區竹林路２０１巷１號２樓,2,住宅,52,27.66060100584,3,2,1,1,0,0,24000.0
2023-03-24,新北市中和區圓通路２９３之３號１０樓,10,住宅,30,48.200351752740005,4,2,2,1,1,0,31500.0
2023-03-09,新北市樹林區大慶街１５４號五樓,5,住宅,40,25.993825945230004,3,2,1,1,0,0,8000.0
2023-03-17,新北市三重區後竹圍街１７５ 巷２２ 號４ 樓,4,住宅,39,24.05177587461,3,2,2,1,0,0,19500.0
2023-03-15,新北市三重區安慶街１０４ 號２ 樓,2,住宅,29,9.69815035266,2,1,1,1,0,0,13000.0
2023-03-21,新北市三重區三和路四段１２５巷２１號二樓,2,住宅,42,29.03395105578,3,2,1,1,0,0,25000.0
2023-03-20,新北市三重區中正南路７７號二樓,3,住宅,29,40.1417514597,0,3,1,0,0,0,30000.0
2023-03-22,新北市三重區正德街３９ 號２ 樓,2,住宅,43,24.20000088,3,2,2,1,0,0,27500.0
2023-03-27,新北市三重區重陽路三段５巷４６號５樓,5,住宅,27,37.20447635289,3,2,2,1,1,0,20000.0
2023-03-19,新北市三重區福德南路４０號六樓之一,6,住宅,23,23.88540086856,2,1,1,1,1,1,30000.0
2023-03-21,新北市三重區仁興街３９巷４號３樓,3,住宅,53,20.872500759,3,1,1,1,0,0,20000.0
2023-03-08,新北市中和區中正路７５３號４樓,4,住宅,27,26.99812598175,2,1,0,1,1,0,10000.0
2023-03-20,新北市三重區溪尾街３２８之１４號１５樓,15,住宅,31,56.39810205084,4,2,2,1,1,0,31500.0
2023-03-03,新北市蘆洲區九芎街１９７巷３４號,1,住宅,23,27.539601001440005,3,1,1,1,1,0,18500.0
2023-03-03,新北市蘆洲區九芎街１６７巷５２號６樓,6,住宅,23,27.45490099836,3,1,2,1,1,0,18500.0
2023-03-07,新北市三重區集美街２４７巷３１弄８號五樓,5,住宅,24,22.85690083116,2,1,1,1,1,0,20000.0
2023-03-28,新北市板橋區中正路１巷２６號３樓,3,住宅,38,54.7827519921,3,2,2,1,1,0,38000.0
2023-03-23,新北市板橋區國泰街７０號二樓之２３,2,住宅,46,9.2565003366,2,1,1,1,0,0,15000.0
2023-03-24,新北市泰山區明志路二段６０巷１弄２號,1,住宅,27,44.87890163196,4,2,2,1,1,0,26000.0
2023-03-24,新北市新莊區中平路２９２巷１弄１８號十六樓,16,住宅,2,38.12710138644,3,2,2,1,1,0,35500.0
2023-03-27,新北市新莊區中華路一段１３６巷２６號５樓之３,5,套房,24,12.80482546563,1,1,1,1,1,0,15000.0
2023-03-20,新北市新莊區民安西路２６９號三樓之一,3,住宅,26,28.82522604819,3,1,1,1,1,0,12000.0
2023-03-21,新北市新莊區中和街１８３ 號６ 樓之１,6,套房,31,12.99540047256,1,1,1,1,1,0,11000.0
2023-03-22,新北市五股區凌雲路一段８３巷２２弄６之２號,3,住宅,44,18.16512566055,2,2,1,1,0,0,10000.0
2023-03-08,新北市五股區新五路二段６３２號十一樓,11,住宅,4,39.33407643033,2,2,1,1,1,1,21000.0
2023-03-22,新北市五股區自強路３２號四樓,4,住宅,36,26.5897509669,3,2,1,1,0,0,13000.0
2023-03-22,新北市五股區新城六路２４７號九樓,9,住宅,8,29.841626085150004,2,1,1,1,1,0,20000.0
2023-03-28,新北市五股區水碓路１６巷３５號三樓,3,住宅,26,10.88395039578,0,0,0,1,1,0,12000.0
2023-03-17,新北市新店區建國路３７巷７號,1,住宅,47,34.64230125972,4,2,1,1,0,0,31500.0
2023-03-15,新北市新店區復興路４４ 之４ 號１２ 樓,12,套房,28,12.39040045056,1,1,1,1,1,0,12000.0
2023-03-16,新北市新店區安祥路１０６ 巷２３８ 號２ 樓,2,住宅,25,24.484350890340004,2,1,2,1,0,0,20000.0
2023-03-28,新北市新店區安民街２７號３樓,3,住宅,45,21.2355007722,3,2,1,1,0,0,13500.0
2023-03-21,新北市汐止區保一街９巷５號６樓,6,住宅,28,37.6007513673,3,2,2,1,1,0,16000.0
2023-03-18,新北市汐止區民族二街１３號二樓,2,住宅,7,31.39647614169,2,1,1,1,1,0,16000.0
2023-03-18,新北市汐止區民族二街１３號四樓之１,4,住宅,7,28.168801024320004,2,1,1,1,1,0,15000.0
2023-03-16,新北市淡水區大忠街８５號十三樓之１５,13,套房,33,8.833000321200002,1,1,1,1,1,0,4000.0
2023-03-28,新北市八里區中華路二段５０８號十四樓之１,14,住宅,30,40.535001474000005,3,1,1,1,1,0,16000.0
2023-03-20,新北市八里區龍米路一段１９８號１８樓之５,18,住宅,18,20.51857574613,1,1,1,1,1,0,16000.0
2023-03-12,新北市淡水區新市五路三段１５６號二十七樓,27,住宅,6,42.07775153010001,2,2,1,1,1,1,22000.0
2023-03-24,新北市淡水區鄧公路３１巷２號四樓,4,住宅,43,31.90165116006,3,2,1,1,0,0,14000.0
2023-03-26,新北市淡水區民權路２３號十四樓之１９,14,住宅,15,19.18455069762,0,1,1,1,1,0,16000.0
2023-03-28,新北市三芝區中興街一段３５號５樓,5,住宅,29,30.40427610561,3,2,2,1,1,0,5000.0
2023-03-14,新北市汐止區福德一路１４１巷５６號,1,住宅,28,34.70280126192,2,1,1,1,1,0,30000.0
2023-03-30,新北市汐止區祥雲街２１號３樓,3,住宅,42,21.42305077902,2,1,1,1,0,0,12000.0
2023-03-26,新北市新店區新生街２４號二樓,2,住宅,44,29.312251065900004,3,2,2,1,0,0,23000.0
2023-03-19,新北市新店區建國路１２８巷２號二樓,2,住宅,24,26.30237595645,3,2,2,1,1,0,20900.0
2023-03-18,新北市五股區自強路８７巷１４號二樓,2,住宅,39,21.9312507975,3,1,1,1,0,0,14000.0
2023-03-20,新北市五股區成洲一路２３號六樓,6,住宅,8,51.06502685691,3,2,2,1,1,1,21700.0
2023-03-14,新北市五股區新城八路１００號九樓,9,住宅,10,45.0422516379,3,2,2,1,1,1,23700.0
2023-03-14,新北市五股區五福路１２６號八樓,8,住宅,27,34.97202627171,3,2,2,1,1,0,17000.0
2023-03-28,新北市林口區八德路２４０號１２樓,12,套房,8,20.993500763400004,1,1,1,1,1,0,26000.0
2023-03-23,新北市板橋區長江路二段４９號十九樓,19,住宅,25,31.931901161160003,3,2,2,1,1,0,25000.0
2023-03-27,新北市板橋區長江路二段２號二十樓之五,20,套房,27,12.3117504477,0,0,1,1,1,0,14000.0
2023-03-21,新北市土城區興城路４９巷１４號三樓,3,住宅,28,44.01072660039001,3,2,2,1,1,0,11000.0
2023-03-30,新北市蘆洲區重陽街７２之５號１４樓,14,住宅,15,40.34442646707,3,2,2,1,1,0,30000.0
2023-03-23,新北市三重區錦通街３８ 號４ 樓,4,住宅,42,14.822500539,2,2,1,1,0,0,14500.0
2023-03-28,新北市蘆洲區中山二路４６巷３２號５樓,5,住宅,43,28.435001034000003,3,2,1,1,0,0,19000.0
2023-03-15,新北市中和區員山路２９４巷１７號８樓,8,住宅,28,34.80867626577,3,2,1,1,1,0,19000.0
2023-03-15,新北市永和區竹林路３９巷９號３樓,3,住宅,55,30.56460111144,3,2,2,1,0,0,29000.0
2023-03-10,新北市永和區成功路二段１６１巷１弄５號４樓,4,住宅,45,22.478775817410003,3,2,1,1,0,0,19000.0
2023-03-26,新北市永和區安樂路１００巷２２號三樓之１,3,住宅,5,20.50345074558,2,2,1,1,1,0,26000.0
2023-03-04,宜蘭縣宜蘭市宜中路１２９號７樓之三,7,住宅,27,25.78812593775,2,1,1,1,1,0,15000.0
2023-03-13,宜蘭縣宜蘭市力行路１０６巷１弄３號４樓,4,住宅,38,34.164351242340004,3,1,1,1,0,0,8000.0
2023-03-16,宜蘭縣宜蘭市延平路３８之２９號６樓,6,住宅,30,25.05607591113,3,1,1,1,1,0,10000.0
2023-03-13,宜蘭縣羅東鎮和平路１１１之２號４樓,4,住宅,32,31.771576155330003,3,2,2,1,0,0,13500.0
2023-03-16,宜蘭縣羅東鎮義和巷５之９號,5,住宅,44,13.04985047454,2,1,1,1,0,0,5500.0
2023-03-13,宜蘭縣宜蘭市林森路３１１巷４０號３樓,3,套房,28,16.70102560731,1,1,1,1,1,0,9800.0
2023-03-13,宜蘭縣宜蘭市農權路１３巷２號五樓之二,5,住宅,30,39.07997642109,3,1,2,1,1,0,12000.0
2023-03-16,宜蘭縣礁溪鄉大忠路１２０之３號五樓,5,住宅,25,41.82365152086,3,1,2,1,1,1,19800.0
2023-03-14,宜蘭縣宜蘭市軍民路１１巷４７之４號,5,住宅,41,29.629876077450003,3,2,2,1,0,0,12000.0
2023-03-08,宜蘭縣宜蘭市泰山路８０之３號,4,住宅,42,38.269276391610006,3,2,2,1,0,0,16000.0
2023-03-24,宜蘭縣宜蘭市民族路３３６號五樓,5,住宅,29,34.40937625125,3,1,1,1,1,0,13000.0
2023-03-21,宜蘭縣羅東鎮學府街３３巷５號１樓,1,住宅,28,26.650250969100004,2,1,1,1,1,0,12500.0
2023-03-24,宜蘭縣礁溪鄉大忠路１４４之１號４樓之５,4,套房,26,13.21622548059,1,0,1,1,1,0,6500.0
2023-03-24,宜蘭縣礁溪鄉德陽路６２巷１２號４樓之７,4,套房,17,15.95687558025,1,1,1,1,1,0,11000.0
2023-03-22,宜蘭縣宜蘭市復興路一段８１之３號,4,住宅,40,29.7962510835,2,1,2,1,0,0,9000.0
2023-03-27,宜蘭縣宜蘭市復興路３６巷３號,1,住宅,48,15.35792555847,2,2,1,1,0,0,11000.0
2023-03-09,宜蘭縣員山鄉蘭城十路２８號四樓之三,4,住宅,1,21.42002577891,2,1,1,1,1,0,10000.0
2023-03-14,宜蘭縣宜蘭市民權新路３０３號二樓,2,住宅,30,31.65965115126,3,1,2,1,1,0,13000.0
2023-03-10,宜蘭縣宜蘭市民權新路２６０巷１弄８號四樓,4,住宅,19,52.47467690817,3,1,2,1,1,0,15000.0
2023-03-29,宜蘭縣羅東鎮光榮路２６９之１８號十樓,10,住宅,27,24.22722588099,3,1,2,1,1,0,14000.0
2023-03-28,宜蘭縣羅東鎮禮運路６２號六樓之２,6,住宅,26,34.11292624047,3,1,2,1,1,1,18000.0
2023-03-29,宜蘭縣礁溪鄉溫泉路３７號七樓之二,7,住宅,26,25.75787593665,2,1,2,1,1,0,15000.0
2023-03-04,桃園市桃園區國信街１０５號五樓,5,住宅,17,37.29220135608,2,1,1,1,1,1,15000.0
2023-03-17,桃園市桃園區朝陽街１１號四樓之１０,4,住宅,26,11.47685041734,0,0,0,1,1,0,8400.0
2023-03-13,桃園市桃園區龍安街７１號１１樓,11,住宅,28,32.2162511715,3,2,2,1,1,0,12000.0
2023-03-20,桃園市桃園區國際路一段１１７９號２４樓之１,24,住宅,26,23.349975849090004,2,1,1,1,1,0,15000.0
2023-02-24,桃園市桃園區天祥五街５１號５樓,5,住宅,39,31.2180011352,3,2,2,1,0,0,15000.0
2023-03-19,桃園市中壢區榮安一街３９７號八樓,8,住宅,29,12.01832543703,0,0,0,1,1,0,9700.0
2023-03-13,桃園市中壢區松信路２６號二樓之３,2,住宅,3,37.44647636169,2,1,1,1,1,1,18000.0
2023-03-17,桃園市中壢區慈惠三街１２８號八樓,8,住宅,33,47.22025171710001,4,2,2,1,1,0,15500.0
2023-03-15,桃園市中壢區延平路４９８號八樓之九,8,住宅,30,7.55040027456,0,0,0,1,1,0,5000.0
2023-02-28,桃園市觀音區育仁路一段６７８號四樓,4,住宅,27,27.35810099484,3,2,1,1,0,0,10000.0
2023-03-18,桃園市中壢區星文二街３１號四樓,4,住宅,27,24.58720089408,3,2,2,1,0,1,14000.0
2023-03-19,桃園市中壢區慈惠三街７２號五樓,5,住宅,4,17.54802563811,2,1,1,1,1,0,16900.0
2023-02-25,桃園市中壢區慈惠三街１２０號六樓,6,住宅,34,35.7857513013,3,2,2,1,1,0,10000.0
2023-03-20,桃園市楊梅區中山南路８００巷１３８弄３號４樓之２,4,住宅,29,25.90912594215,3,2,2,1,0,0,8800.0
2023-03-20,桃園市大溪區員林路一段３巷９號十二樓,12,住宅,9,42.77955155562001,1,1,1,1,1,1,13500.0
2023-03-20,桃園市蘆竹區奉化路１０４巷１０弄４號七樓,7,住宅,28,35.30780128392,3,2,2,1,1,1,19700.0
2023-03-20,桃園市蘆竹區光復路１４６號４樓之２,4,住宅,29,40.54105147422,3,1,2,1,1,0,15000.0
2023-03-13,桃園市八德區銀和街２７巷２弄２號十八樓之５,18,住宅,25,47.02665171006,3,2,2,1,1,1,14000.0
2023-03-20,桃園市八德區中華路２７５巷１１號１４樓,14,住宅,28,8.74527531801,1,0,1,1,1,0,7000.0
2023-03-20,桃園市八德區忠勇街２２６巷５號三樓,3,住宅,25,30.45872610759,3,2,2,1,1,0,14000.0
2023-03-15,桃園市八德區介壽路二段１２３３巷４８弄１５衖８號二樓,2,住宅,31,36.11547631329,3,2,2,1,0,0,11000.0
2023-03-17,桃園市龜山區樂學路１３３號十五樓,15,住宅,1,44.78815162866,3,2,2,1,1,1,22000.0
2023-03-18,桃園市龜山區文化一路３１６號１４樓,14,住宅,2,37.02297634629001,3,2,2,1,1,0,23000.0
2023-03-18,桃園市龜山區華亞三路３９巷３３號二十三樓,23,住宅,2,16.3047505929,1,1,1,1,1,0,17500.0
2023-03-11,桃園市龜山區紅寶一街７號４樓,4,住宅,41,25.29807591993,3,2,1,1,0,0,8000.0
2023-03-20,桃園市龜山區文化二路２６７號１４樓之３,14,住宅,2,37.81552637511,3,1,2,1,1,0,20500.0
2023-03-15,桃園市龜山區樂善三路１３１號１６樓,16,住宅,1,23.773475864490003,2,1,1,1,1,0,20000.0
2023-03-22,桃園市八德區介壽路一段６４５巷１１弄１９之１號,2,住宅,43,24.959275907610003,3,1,1,1,0,0,10000.0
2023-03-05,桃園市八德區建德路２７１號十五樓,15,住宅,8,30.86407612233,2,1,1,1,1,1,14500.0
2023-03-16,桃園市八德區仁德一路５７號七樓,7,住宅,8,34.07662623915,2,1,1,1,1,1,15500.0
2023-02-28,桃園市八德區豐德二路５９號三樓,3,住宅,5,37.03507634673,2,2,1,1,1,1,14800.0
2023-03-10,桃園市八德區新興路１４９８之１號五樓,5,住宅,3,36.79912633815,2,2,1,1,1,1,14000.0
2023-03-07,桃園市八德區廣興二路８５號十四樓,14,住宅,8,34.59390125796,2,2,1,1,1,0,15000.0
2023-02-24,桃園市八德區介壽路二段６８５巷６６弄１２８號二樓,2,住宅,42,25.410000924,3,2,1,1,0,0,12000.0
2023-03-20,桃園市八德區中華路２９８號十樓之３,10,住宅,27,30.25605110022,3,1,2,1,1,0,14000.0
2023-03-02,桃園市平鎮區環南路二段２８０號六樓之４,6,住宅,29,32.70327618921,2,1,1,1,1,0,10000.0
2023-03-12,桃園市平鎮區大連街１２２號十二樓,12,住宅,7,28.03267601937,2,2,1,1,1,0,14300.0
2023-03-21,桃園市平鎮區榮興街６號十二樓,12,住宅,28,30.452676107370003,3,2,2,1,1,0,9500.0
2023-03-12,桃園市平鎮區上海路２１６號九樓,9,住宅,9,29.04605105622,2,2,1,1,1,0,13500.0
2023-03-12,桃園市平鎮區文心路１１８號１２樓,12,住宅,6,28.25652602751,2,2,1,1,1,0,15000.0
2023-03-10,桃園市平鎮區文化街２４巷３號二樓之１,2,住宅,30,45.2842516467,4,2,2,1,1,0,15900.0
2023-03-10,桃園市蘆竹區六福路１６１號七樓之１０,7,住宅,30,36.79610133804,3,2,2,1,1,0,16700.0
2023-03-12,桃園市大園區五福路２１０巷３９弄２號５樓,5,住宅,30,25.08330091212,3,1,1,1,0,0,5500.0
2023-03-13,桃園市蘆竹區忠孝西路１６９巷１８號三樓之６,3,住宅,27,32.60345118558,3,2,1,1,1,1,18800.0
2023-03-13,桃園市龍潭區百年二街２４號,1,住宅,26,27.60010100364,3,2,2,1,1,0,15600.0
2023-03-21,桃園市龍潭區中興路３９６之２５號二樓,2,住宅,27,20.34010073964,0,0,0,1,1,0,7350.0
2023-03-22,桃園市楊梅區富民街１４３巷２５０弄３９號二樓,2,住宅,18,9.02962532835,0,0,0,1,1,0,6400.0
2023-03-15,桃園市楊梅區自立街１７０號６樓,6,住宅,28,25.682250933900004,3,2,1,1,1,0,13000.0
2023-03-20,桃園市楊梅區梅獅路一段５０６號三樓,3,住宅,44,33.02392620087,3,2,1,1,0,0,9000.0
2023-03-01,桃園市楊梅區湖山街３８號２樓,2,住宅,27,20.827125757350004,2,2,1,1,0,0,9000.0
2023-03-08,桃園市楊梅區環南路１０９巷９號７樓,7,住宅,28,27.4670009988,3,2,2,1,1,0,15100.0
2023-03-08,桃園市楊梅區青山六街１巷１０號５樓之２,5,住宅,28,28.29887602905,3,2,2,1,1,0,15000.0
2023-03-15,桃園市楊梅區三民東路２７８號三樓,3,住宅,26,31.84115115786,4,2,2,1,1,0,13000.0
