date,address,floor,type,age,twPing,bedRoom,livingRoom,restRoom,furniture,elevator,parkingSpace,price
2023-03-08,桃園市楊梅區中山北路一段３９０巷３３之３號五樓,5,住宅,30,30.38310110484,3,2,2,1,1,0,10200.0
2023-03-03,桃園市楊梅區永寧路８８號十四樓,14,住宅,2,46.14637667805,3,2,2,1,1,1,17000.0
2023-03-03,桃園市楊梅區新農街二段１１０巷１６號,1,住宅,10,34.98715127226,2,1,1,1,1,1,15400.0
2023-03-10,桃園市楊梅區中山北路一段３９０巷３３之２號,1,住宅,30,26.79545097438,3,2,2,1,1,0,10000.0
2023-03-22,桃園市新屋區中華路８３５巷３６號五樓,5,住宅,1,30.49805110902,2,1,1,1,1,1,16000.0
2023-03-10,桃園市楊梅區福德街９巷３０號４樓,4,住宅,28,30.625101113640003,3,1,1,1,1,0,16500.0
2023-03-22,桃園市新屋區中華路８３５巷２０號十三樓,13,住宅,1,37.18632635223,2,2,1,1,1,1,16500.0
2023-03-13,桃園市中壢區中園路３６之９號２３樓,23,住宅,13,14.56840052976,0,0,0,1,1,0,10000.0
2023-03-14,桃園市中壢區龍岡路二段７３巷２３號３樓,3,住宅,16,8.88140032296,0,0,0,1,1,0,5900.0
2023-03-10,桃園市中壢區興仁路二段６４８巷１６號十樓之２,12,住宅,10,27.22500099,2,2,1,1,1,0,13500.0
2023-03-05,桃園市中壢區華美一路１６巷１９號７樓,7,住宅,23,33.73480122672,3,2,2,1,1,0,14000.0
2023-03-20,桃園市中壢區普義路１７１號三樓,3,住宅,31,29.24267606337,3,2,2,1,1,0,17000.0
2023-03-20,桃園市觀音區吉祥街８１巷１３號五樓之１,5,住宅,2,19.31462570235,2,1,1,1,1,0,12500.0
2023-03-19,桃園市中壢區龍川四街５７號８樓,8,住宅,14,35.737351299539995,2,2,1,1,1,1,18300.0
2023-03-10,桃園市觀音區二聖路３１３巷４８號３樓,3,住宅,1,36.92617634277,2,1,1,1,1,1,19000.0
2023-03-09,桃園市中壢區中央西路二段１５２號十二樓之７,12,套房,31,11.18645040678,1,1,1,1,1,0,10200.0
2023-03-17,桃園市中壢區後寮二路２０１巷２１號九樓,9,住宅,21,24.01547587329,3,2,1,1,1,0,13000.0
2023-03-02,桃園市中壢區民權路２２６之２號十四樓,14,住宅,27,41.79642651987,3,2,2,1,1,0,15300.0
2023-02-24,桃園市中壢區中華路一段７８３巷２２號４樓,4,住宅,10,12.43880045232,1,1,1,1,1,0,14000.0
2023-03-10,桃園市中壢區中山東路三段１２２號七樓,7,住宅,1,28.83430104852,2,2,2,1,1,0,11000.0
2023-03-10,桃園市中壢區榮民路５６巷１６之３號,4,住宅,45,21.80420079288,3,2,1,1,0,0,15000.0
2023-03-10,桃園市中壢區中央西路一段１１號７樓之１７,7,住宅,42,10.43322537939,1,1,1,1,1,0,11000.0
2023-02-01,桃園市中壢區龍岡路三段３７巷１２號九樓,9,住宅,6,27.488175999570004,2,2,1,1,1,0,13600.0
2023-03-10,桃園市中壢區南園二路２９６巷２１弄５６號十五樓,15,住宅,10,39.98142645387001,2,2,1,1,1,0,16400.0
2023-03-08,桃園市中壢區大仁二街２０號八樓之２,8,套房,20,9.59832534903,1,1,1,1,1,0,6600.0
2023-03-07,桃園市中壢區龍岡路三段３７巷１８號五樓,5,住宅,6,24.278650882860003,2,1,1,1,1,0,12200.0
2023-01-31,桃園市中壢區仁慈路１７２號８樓,8,住宅,28,7.79845028358,0,0,0,1,1,0,6500.0
2023-02-15,桃園市觀音區福祥街１０２號十樓,10,住宅,2,43.82922659379,3,2,2,1,1,1,20500.0
2023-03-15,桃園市中壢區振興街１４０號二樓之２０,2,套房,34,8.690825316030002,1,1,1,1,1,0,4800.0
2023-03-14,桃園市中壢區大仁街２５號二樓之１１,2,套房,29,7.58065027566,1,1,1,1,1,0,7200.0
2023-03-03,桃園市中壢區中北路二段２０２號六樓,6,住宅,22,32.80007619273,3,2,2,1,1,1,22000.0
2023-03-07,桃園市中壢區忠孝路２５５號八樓,8,套房,18,12.60517545837,0,0,0,1,1,0,10000.0
2023-03-21,桃園市桃園區中正路３６６號１４樓之１０,14,住宅,28,11.38610041404,1,0,1,1,1,0,6000.0
2023-03-21,桃園市桃園區瑞慶路３９３號３樓,3,住宅,29,32.38565117766,3,1,2,1,1,0,15100.0
2023-03-04,桃園市桃園區介壽路２１之２號,3,住宅,43,29.17915106106,3,1,2,1,0,0,12000.0
2023-03-05,桃園市桃園區復興路９９號２１樓之１７,21,住宅,26,18.02597565549,1,1,1,1,1,0,12000.0
2023-03-01,桃園市桃園區國際路一段１１９５號二十四樓之３,24,住宅,26,22.7782508283,2,1,1,1,1,0,12500.0
2023-03-15,桃園市桃園區新埔三街３８巷１６號三樓,3,住宅,5,25.40395092378,2,1,1,1,1,0,16500.0
2023-03-12,桃園市桃園區中正路９１９號六樓之八,6,住宅,28,32.76680119152,3,2,2,1,1,0,17000.0
2023-03-13,桃園市桃園區博愛路６７號十樓之１２,10,住宅,41,10.12770036828,0,0,0,1,1,0,10000.0
2023-03-10,桃園市桃園區民有六街１６號９樓之１０,9,套房,27,12.09092543967,1,0,0,1,1,0,6900.0
2023-03-13,桃園市桃園區龍泉一街９號十樓,10,住宅,11,47.04177671061,3,2,2,1,1,1,16500.0
2022-12-07,桃園市桃園區和平路１號８樓之９,8,住宅,30,12.408550451220002,0,0,0,1,1,0,10000.0
2023-02-24,桃園市桃園區介壽路３之１３號十樓,10,住宅,20,19.76232571863,2,1,1,1,1,0,14900.0
2023-03-09,桃園市桃園區建國路６１巷２３號八樓之２,8,住宅,21,39.15862642395,3,2,2,1,1,1,19500.0
2023-01-16,桃園市桃園區南豐街２３４號５樓,5,住宅,29,34.23997624509,2,2,1,1,0,0,15000.0
2023-03-07,桃園市桃園區復興路９９號十七樓之５,17,套房,26,18.331500666600004,0,0,0,1,1,0,14900.0
2023-03-03,桃園市桃園區中正路１３９０號三樓之二,3,住宅,29,37.2377513541,3,2,1,1,1,1,18400.0
2023-03-08,桃園市桃園區保定二街１０之４號,5,住宅,37,32.90595119658,4,3,2,1,0,0,15000.0
2023-03-06,桃園市桃園區龍城二街５４號五樓,5,住宅,26,37.1772513519,4,2,2,1,1,1,18000.0
2023-03-22,桃園市桃園區同安街４５５巷３弄１８之１號,2,住宅,42,32.243476172490006,3,1,1,1,0,0,17500.0
2023-03-13,桃園市桃園區宏昌七街９８號四樓之１,4,套房,21,12.57492545727,0,0,0,1,1,0,10000.0
2023-03-14,桃園市桃園區天祥五街１１號十六樓之３,16,套房,24,16.37735059554,1,1,1,1,1,0,14500.0
2023-03-14,桃園市桃園區春日路１１５５號五樓之６,5,套房,28,17.25762562755,0,0,0,1,1,0,11000.0
2023-03-09,桃園市桃園區桃智路１９號四樓,4,住宅,11,46.80582670203,3,2,2,1,1,1,22400.0
2023-03-15,桃園市桃園區愛八街３９號７樓,7,住宅,27,35.531651292060005,3,1,2,1,1,0,15000.0
2023-03-16,桃園市桃園區永安路１２１６巷６號４樓之８,4,套房,12,11.6765004246,1,0,0,1,1,0,14500.0
2023-03-10,桃園市桃園區民有十五街２８號六樓,6,住宅,17,33.813451229580004,3,2,2,1,1,0,15000.0
2023-03-15,桃園市中壢區吉利六街３９號四樓,4,住宅,42,26.26305095502,3,2,1,1,0,0,16000.0
2023-03-10,桃園市中壢區復華街３０２號六樓,6,住宅,12,36.75677633661,2,1,1,1,1,1,16300.0
2023-03-04,桃園市中壢區金鋒四街５０巷６號五樓,5,住宅,19,27.70295100738,2,1,1,1,1,0,13500.0
2023-03-10,桃園市中壢區南園二路２７８號十一樓,11,住宅,12,44.189201606880005,3,2,2,1,1,1,20300.0
2023-03-22,桃園市中壢區後寮二路２０１巷２０號十一樓,11,住宅,21,22.67540082456,2,1,1,1,1,0,14000.0
2023-03-22,桃園市中壢區榮安十五街２８之１１號二樓,2,住宅,27,8.539575310530001,0,0,0,1,1,0,8500.0
2023-03-06,桃園市觀音區二聖路３１３巷３２號六樓,6,住宅,1,38.562701402280005,2,2,1,1,1,1,16800.0
2023-03-08,桃園市觀音區長春街１３５號二樓,2,住宅,1,17.83237564845,2,2,1,1,1,0,15000.0
2023-03-22,桃園市中壢區大智街１０號五樓之２,5,住宅,34,8.61520031328,0,0,0,1,0,0,6500.0
2023-03-15,桃園市中壢區環中東路二段３１２巷２號十二樓之１,12,住宅,24,33.822526229910004,3,2,2,1,1,0,17000.0
2023-03-13,桃園市中壢區延平路３７２號八樓之５,8,套房,23,13.74862549995,0,0,0,1,1,0,9300.0
2023-03-01,桃園市中壢區林森路１０８號六樓之２,6,套房,25,11.38307541393,0,0,0,1,1,0,8000.0
2023-02-19,桃園市中壢區功學路３８號七樓,7,住宅,29,33.08442620307,3,2,2,1,1,0,11000.0
2023-03-07,桃園市中壢區溪洲二街２３巷４號２層,2,住宅,43,23.33485084854,3,2,2,1,0,0,14000.0
2023-03-08,桃園市觀音區仁德街２１號四樓之１,4,住宅,8,25.64897593269,2,2,2,1,0,0,14000.0
2023-03-15,桃園市觀音區興二街２６號三樓,3,住宅,1,18.67635067914,2,1,1,1,1,0,11000.0
2023-03-10,桃園市觀音區民權路８３號三樓,3,住宅,4,19.07565069366,2,2,1,1,1,0,13000.0
2023-03-18,桃園市龍潭區民治路３３９號六樓之七,6,住宅,21,26.82267597537,0,0,0,1,1,1,13000.0
2023-03-14,桃園市大溪區和二路５２號三樓,3,套房,1,29.86582608603,0,0,0,1,1,1,14500.0
2023-03-14,桃園市大溪區和二路５６號三樓,3,套房,1,32.23742617227,0,0,0,1,1,0,12000.0
2023-03-19,桃園市蘆竹區南順一街９號,1,住宅,28,29.05512605655,3,1,1,1,1,0,10000.0
2023-03-22,桃園市大園區拔子林一路９３巷２７號四樓,4,住宅,2,26.49295096338,0,0,0,1,1,0,11300.0
2023-03-11,桃園市八德區介壽路二段６８５巷５０弄９９號二樓,2,住宅,42,25.410000924,3,2,1,1,0,0,11000.0
2023-03-03,桃園市八德區銀和街２９號二樓之１５,2,套房,25,19.36605070422,0,0,0,1,1,0,7500.0
2023-03-22,桃園市八德區和平路９９１巷５８弄７０衖９號三樓,3,住宅,29,27.64547600529,3,2,2,1,0,0,13000.0
2023-03-06,桃園市八德區豐德路２７８號八樓,8,住宅,5,39.42482643363,2,2,1,1,1,1,16000.0
2023-03-03,桃園市八德區永福街１３０之３號,4,住宅,44,21.39582577803,3,2,1,1,0,0,14000.0
2023-03-14,桃園市八德區忠勇街４２６巷３２之２號,1,住宅,27,33.16307620593,3,2,1,1,1,0,12000.0
2023-02-09,桃園市八德區中正一路１０號十四樓,14,住宅,8,40.96757648973001,2,2,1,1,1,1,19000.0
2023-03-13,桃園市八德區廣興二路１號十四樓之６,14,住宅,9,68.04132747423,3,2,2,1,1,1,20000.0
2023-03-03,桃園市八德區福德三街３５之３號,4,住宅,39,24.502500891,3,2,1,1,0,0,13000.0
2023-03-13,桃園市八德區中正路１６０號９樓,9,住宅,8,39.65170144188,2,1,2,1,1,1,18000.0
2023-03-16,桃園市八德區東勇街１２５巷２６號三樓,3,住宅,15,44.42212661535,4,2,2,1,1,0,19500.0
2023-03-06,桃園市龜山區文化二路２６９號六樓之３,6,住宅,2,46.34905168542,3,2,2,1,1,1,26500.0
2023-03-07,桃園市龜山區林森路１０３巷１４弄２６號二樓,2,住宅,44,19.06657569333,3,2,1,1,0,0,20000.0
2023-03-18,桃園市龜山區萬壽路一段１６３號六樓之３,6,套房,30,11.6765004246,1,0,1,1,1,0,10500.0
2023-02-24,桃園市桃園區大興西路一段３２１號五樓之５,5,住宅,26,19.5717507117,2,1,1,1,1,0,19900.0
2023-03-02,桃園市龜山區樂學三路８７號八樓之１,8,住宅,3,39.11930142252,3,1,2,1,1,0,6000.0
2023-03-15,桃園市八德區中華路 ３１４ 號十四樓之 ２,14,住宅,27,20.799900756360003,2,2,1,1,1,0,14500.0
2023-03-05,桃園市八德區銀和街２７巷１弄１號十五樓之６,15,住宅,25,50.48422683579,3,2,2,1,1,1,19500.0
2023-03-02,桃園市八德區豐田一路７６號三樓之５,3,住宅,1,41.12790149556,3,2,2,1,1,1,16500.0
2023-02-22,桃園市平鎮區龍南路６５４巷３３號七樓,7,住宅,29,37.591676366970006,3,2,2,1,1,0,13500.0
2023-03-07,桃園市平鎮區中庸路１２８號二樓之１,2,住宅,18,30.82777612101,3,2,2,1,1,0,16000.0
2023-03-16,桃園市平鎮區環南路三段１９３號１０樓,10,住宅,19,24.70517589837,2,1,1,1,1,0,15000.0
2023-03-15,桃園市平鎮區新德街１９８號六樓,6,住宅,10,52.577526911910006,4,1,2,1,1,1,22200.0
2023-03-16,桃園市蘆竹區五福路 １０６ 巷 ２６ 號 ３ 樓,3,住宅,19,46.27947668289001,3,2,2,1,1,1,22500.0
2023-03-11,桃園市蘆竹區吉林路６１號四樓之２,4,住宅,20,26.5292509647,2,1,1,1,1,1,15300.0
2023-03-13,桃園市蘆竹區南山路一段６７號,1,住宅,28,40.06310145684,4,2,2,1,1,0,22000.0
2023-03-22,桃園市大溪區文化路２１１巷１０號七樓,7,住宅,26,40.71045148038,3,2,2,1,1,0,8000.0
2023-03-14,桃園市龍潭區龍平路５６３巷３６之１２號,1,住宅,28,23.92472586999,3,1,2,1,1,0,15000.0
2023-03-15,桃園市大溪區和二路５２號二樓,2,套房,1,29.86582608603,0,0,0,1,1,1,14500.0
2023-03-18,桃園市大溪區大鶯路６０ 巷２３８ 號三樓,3,住宅,27,22.90530083292,5,2,1,1,1,0,13200.0
2023-03-16,桃園市楊梅區金山街 ２９８ 巷 ５２ 號 ６ 樓,6,住宅,10,36.856601340240005,2,2,1,1,1,1,10000.0
2023-03-23,桃園市楊梅區青山五街１０巷９號１１樓之３,11,住宅,28,50.78370184668,3,2,2,1,1,1,22000.0
2023-03-03,桃園市楊梅區中山北路二段８２巷１７號二樓,2,住宅,30,30.87920112288,3,1,2,1,1,0,11100.0
2023-03-07,桃園市楊梅區中山北路一段３９０巷４５弄５號四樓,4,住宅,30,31.620326149830003,3,1,2,1,1,0,14200.0
2023-03-08,桃園市楊梅區永美路４５９巷３５號二樓,2,住宅,41,22.614900822360003,3,1,1,1,0,0,10000.0
2023-03-09,桃園市楊梅區中山北路二段５６巷３６號３樓之２,3,住宅,28,22.7480008272,2,2,1,1,1,0,7700.0
2023-03-15,桃園市中壢區春德路３０７號四樓,4,套房,4,18.93952568871,1,0,0,1,1,1,17200.0
2023-03-16,桃園市中壢區黃興街７８巷１號,1,住宅,41,28.08107602113,3,2,1,1,0,0,9000.0
2023-03-05,桃園市中壢區環西路二段３００巷６之１號八樓,8,住宅,12,30.08967609417,2,2,1,1,1,1,20000.0
2023-03-05,桃園市中壢區實踐路２２５號五樓之５３,5,套房,19,9.28070033748,1,0,1,1,1,0,5500.0
2023-03-05,桃園市中壢區福州二街５２０號十二樓之６,12,住宅,10,31.7322511539,1,2,1,1,1,1,18000.0
2023-03-21,桃園市中壢區金鋒四街５０巷１６號六樓,6,住宅,19,26.8317509757,2,1,1,1,1,0,12000.0
2023-03-23,桃園市中壢區力行北街５３號六樓之６,6,住宅,34,9.02660032824,0,0,0,1,1,0,5500.0
2023-03-10,桃園市中壢區星文二街２１號二樓之３,2,住宅,2,13.261600482240002,0,0,0,1,1,0,12000.0
2023-03-23,桃園市中壢區九和一街１號十九樓之２,19,住宅,15,13.60947549489,0,0,0,1,1,0,11000.0
2023-03-22,桃園市中壢區百韜二街５２巷３１號七樓,7,住宅,26,9.33515033946,0,0,0,1,1,0,7200.0
2023-03-03,桃園市中壢區九和一街６號十七樓之６,17,套房,22,13.84542550347,0,0,0,1,1,0,10000.0
2023-03-08,桃園市中壢區龍岡路三段３７巷１８號十樓,10,住宅,6,35.07790127556,2,1,1,1,1,1,16500.0
2023-03-20,桃園市中壢區福壽七街５號,1,住宅,29,45.43852665231,3,2,2,1,1,1,18000.0
2023-03-15,桃園市中壢區同慶路２３９號十一樓,11,住宅,19,22.463650816860003,2,2,1,1,1,0,15000.0
2023-02-25,桃園市中壢區環北路３６０號１６F之１,16,住宅,14,46.875401704560005,3,2,2,1,1,1,35000.0
2023-03-15,桃園市中壢區龍和一街２４３巷４號９樓,9,住宅,28,36.82937633925,3,1,2,1,1,0,13000.0
2023-03-13,桃園市中壢區環中東路３１９之２號十七樓,17,住宅,27,39.26752642791,3,2,2,1,1,1,18500.0
2023-03-14,桃園市中壢區莊敬路８２９巷１６號三樓,3,住宅,9,23.295525847110003,2,1,1,1,1,0,19000.0
2023-03-15,桃園市桃園區泰昌一街 ５２ 之 １ 號一樓,1,住宅,29,26.99812598175,3,2,2,1,1,0,18000.0
2023-03-17,桃園市桃園區成功路二段 １ 號三樓之 ４,3,住宅,42,40.5047514729,3,2,2,1,1,0,16000.0
2023-03-17,桃園市桃園區成功路二段 １ 號三樓之 ４,3,住宅,42,40.5047514729,3,2,2,1,1,0,16000.0
2023-03-05,桃園市桃園區大興西路二段１３９巷５７號五樓,5,住宅,15,45.250976645490006,3,2,2,1,1,1,23500.0
2023-03-03,桃園市桃園區中正路１４０６之２號九樓,9,住宅,10,88.7232532263,4,2,3,1,1,1,40000.0
2023-03-17,桃園市桃園區莊敬路一段３７１號十四樓之一,14,住宅,28,34.851026267310004,3,2,2,1,1,0,12000.0
2023-03-17,桃園市桃園區大興西路二段１３９巷１７３號十一樓,11,住宅,15,39.10720142208,2,2,1,1,1,1,17900.0
2023-03-23,桃園市桃園區中埔六街１８之１號２樓,2,住宅,20,25.53705092862,2,1,1,1,1,0,17000.0
2023-03-23,桃園市桃園區復興路８３號十二樓之４,12,住宅,43,7.91945028798,0,0,0,1,1,0,10000.0
2023-03-21,桃園市桃園區中埔一街３６１巷１８號五樓,5,住宅,25,28.994626054350004,3,2,2,1,1,1,18500.0
2022-12-07,桃園市桃園區大興西路二段２１７之１號４樓,4,住宅,20,40.87682648643,4,2,2,1,1,1,20000.0
2023-02-24,桃園市桃園區大德三街１６０號七樓,7,住宅,3,45.45365165286,2,1,1,1,1,1,18000.0
2023-03-13,桃園市桃園區博愛路６９巷１號２樓之５,2,套房,25,8.02532529183,1,0,0,1,1,0,5500.0
2023-03-16,桃園市桃園區向善街４５號５樓,5,住宅,28,19.67460071544,2,1,1,1,1,0,15000.0
2023-03-01,桃園市桃園區林森路７１巷３弄１６號,1,住宅,43,26.66840096976,3,2,2,1,0,0,14000.0
2023-03-17,桃園市桃園區大興西路二段５７之１號六樓之５,6,住宅,27,19.00607569113,2,1,2,1,1,0,16000.0
2023-03-23,桃園市桃園區龍城一街８５號九樓,8,住宅,4,40.76187648225,2,2,1,1,1,1,19000.0
2023-03-24,桃園市桃園區莊敬路二段１８１之１號１０樓,10,住宅,20,31.163551133220004,3,1,2,1,1,0,22000.0
2023-02-25,桃園市桃園區桃鶯路２３１巷１１號７樓,7,住宅,28,15.51220056408,1,0,1,1,1,0,10000.0
2023-03-21,桃園市桃園區大興西路二段２８之１號十六樓,16,住宅,29,25.97265094446,2,1,1,1,1,0,12900.0
2023-02-28,桃園市桃園區國豐七街２６號６樓,6,住宅,29,33.23567620857,3,2,1,1,1,0,16500.0
2023-03-10,桃園市桃園區大興西路二段１３９巷１１９號十樓,10,套房,15,26.09062594875,1,1,1,1,1,1,17500.0
2023-03-01,桃園市桃園區大有路７８２號６樓,6,住宅,16,36.95340134376,3,2,1,1,1,0,15000.0
2023-03-16,桃園市桃園區大興西路二段２６之５號１３樓,13,住宅,29,38.595976403490006,3,2,2,1,1,0,13500.0
2023-03-01,桃園市桃園區民生路８６號三樓之６,3,套房,26,9.407750342100002,1,1,1,1,1,0,6200.0
2023-03-01,桃園市桃園區同德六街１７８號七樓,7,住宅,17,34.857076267530005,3,2,2,1,1,1,25500.0
2023-03-11,桃園市桃園區民有十三街２６號四樓之２,4,住宅,27,23.54357585613,1,1,1,1,1,0,12000.0
2023-03-16,桃園市桃園區大業路一段３３６號８樓,8,住宅,17,44.07727660281,4,1,2,1,1,1,18000.0
2023-03-20,桃園市桃園區吉安一街１８３號四樓,4,住宅,5,33.92235123354,2,2,1,1,1,1,22000.0
2023-03-16,桃園市桃園區三民路三段３１７號七樓之１７,7,套房,37,11.86102543131,1,1,1,1,1,0,10500.0
2023-02-28,桃園市桃園區中埔六街７８號二樓,2,住宅,22,38.71395140778,3,1,2,1,1,1,21000.0
2023-03-10,桃園市桃園區龍城一街６５號二樓,2,住宅,4,55.865702031480005,4,2,2,1,1,1,23000.0
2023-03-10,桃園市桃園區桃鶯路７０之３號八樓,8,住宅,27,36.7235013354,3,2,2,1,1,0,16200.0
2023-03-10,桃園市桃園區春日路１１１９號七樓之２,7,住宅,23,37.80040137456,2,1,1,1,1,1,16000.0
2023-03-24,桃園市觀音區建國路３５號二樓,2,住宅,2,21.00862576395,2,1,1,1,1,0,15000.0
2023-03-09,桃園市中壢區榮安十四街８之４號五樓,5,住宅,29,34.20670124388,3,2,2,1,1,0,15000.0
2023-03-15,桃園市中壢區龍岡路三段５８０巷３６號,1,住宅,32,28.522726037190004,3,1,1,1,0,0,8000.0
2022-12-16,桃園市觀音區福壽街３７０號五樓,5,住宅,3,24.42687588825,3,2,2,1,1,0,15500.0
2022-12-19,桃園市觀音區新富路７６５巷２３號三樓,3,住宅,29,30.82172612079,3,2,2,1,0,1,10500.0
2023-03-23,桃園市中壢區大智街１０號五樓之７３,5,住宅,34,7.408225269390001,0,0,0,1,0,0,5000.0
2023-03-16,桃園市中壢區環中東路３２１之２號５樓,5,住宅,27,39.26752642791,3,2,1,1,1,1,18500.0
2023-03-16,桃園市中壢區環中東路１６７號４樓之７,4,套房,28,7.577625275550001,1,0,0,1,1,0,4000.0
2023-03-08,桃園市觀音區長春街３４３號三樓,3,住宅,3,25.161950914980004,3,2,2,1,1,0,15000.0
2023-03-12,桃園市觀音區中山路１４３號四樓之２,4,住宅,2,23.516350855140004,2,2,2,1,1,0,15000.0
2023-03-09,桃園市中壢區南園二路２８８號十三樓,13,住宅,12,47.76777673701,3,2,2,1,1,1,17700.0
2023-03-24,桃園市中壢區榮安十三街１９３巷９號,1,住宅,20,26.03920094688,2,2,1,1,1,0,17000.0
2023-03-01,桃園市觀音區福壽街３７２號三樓,3,住宅,3,24.58115089386,3,2,2,1,1,0,15000.0
2023-03-01,桃園市觀音區長春街３４１號,1,住宅,3,22.977900835560003,3,2,2,1,1,0,15000.0
2023-03-10,桃園市觀音區建國路３７號四樓,4,住宅,2,18.54022567419,2,2,1,1,1,0,13000.0
2023-03-10,桃園市觀音區建國路２９之６號四樓,4,住宅,2,20.851325758230004,2,2,1,1,1,0,14000.0
2023-03-01,桃園市楊梅區新農街二段１１２號五樓,5,住宅,10,45.73195166298,3,2,2,1,1,1,17500.0
2023-03-06,桃園市楊梅區新農街２８２號２樓,2,住宅,28,33.10560120384,3,2,2,1,1,1,13700.0
2023-03-02,桃園市楊梅區新農街３６８號八樓,8,住宅,26,42.555701547480005,3,2,2,1,1,1,16500.0
2023-03-24,桃園市楊梅區快速路五段８２５巷４６弄１號四樓,4,住宅,29,29.84465108526,3,2,2,1,1,0,10500.0
2023-03-04,桃園市楊梅區環南路１０９巷１４號４樓,4,住宅,28,30.74912611815,3,2,2,1,1,0,13500.0
2023-02-28,桃園市楊梅區福羚路２００巷１５號五樓,5,住宅,30,50.913776851410006,3,1,2,1,1,1,22000.0
2023-03-24,桃園市大溪區大鶯路６０巷１８６號三樓,3,住宅,27,22.21257580773,3,1,1,1,1,0,9300.0
2023-02-28,桃園市龍潭區民族路３７０巷７０之１號,2,住宅,32,48.19732675263,4,1,2,1,1,0,10500.0
2023-03-01,桃園市大溪區石園路６３巷６７號三樓,3,住宅,45,26.76217597317,3,2,2,1,0,0,7000.0
2023-03-25,桃園市大溪區埔頂路一段３５７巷１４７號二樓,2,住宅,16,26.62302596811,2,2,1,1,1,0,10800.0
2023-03-01,桃園市大溪區員林路二段２１８號四樓,4,住宅,17,37.83065137566,3,1,2,1,1,0,14300.0
2023-03-10,桃園市蘆竹區南山路１段３３號１４樓之７,14,套房,28,11.09267540337,1,0,1,1,1,0,7000.0
2023-02-28,桃園市蘆竹區南山路１段３３號１２樓之４,12,套房,28,14.426225524590002,1,1,1,0,1,0,7500.0
2023-02-28,桃園市蘆竹區南山路１段３１號８樓之４,8,套房,28,8.00415029106,1,0,1,1,1,0,7000.0
2023-03-10,桃園市大園區拔子林一路９３巷２５號二樓,2,套房,2,19.0877506941,1,1,1,1,1,0,9500.0
2023-02-21,桃園市平鎮區延平路二段３號五樓,5,住宅,12,37.81552637511,3,2,2,1,1,0,18700.0
2023-02-20,桃園市平鎮區中正三路９３號９樓,9,住宅,8,70.19512755255,3,2,2,1,1,1,18000.0
2023-03-25,桃園市平鎮區振興西路１４０號十三樓,13,住宅,28,22.35172581279,2,1,1,1,1,0,8500.0
2023-02-21,桃園市平鎮區桃園市平鎮區榮興街１６號七樓,7,住宅,28,23.19872584359,2,2,1,1,1,0,13000.0
2023-03-22,桃園市平鎮區龍南路１８８巷２１號六樓,6,住宅,29,27.355075994730004,3,2,2,1,1,0,16500.0
2023-03-01,桃園市平鎮區文化街３０３號五樓,5,住宅,30,32.25255117282,3,2,2,1,1,0,13000.0
2023-03-10,桃園市平鎮區湧安路３號十樓,10,住宅,10,40.48660147224,2,2,1,1,1,1,16000.0
2023-03-20,桃園市八德區忠勇街２２６巷５號三樓,3,住宅,25,30.45872610759,3,2,2,1,1,0,14000.0
2023-03-17,桃園市八德區東勇街７號八樓,8,住宅,27,40.7467514817,3,2,2,1,1,0,15000.0
2023-03-23,桃園市八德區中正路１８６號三樓,3,住宅,8,46.47307668993,3,2,2,1,1,1,20000.0
2023-03-01,桃園市八德區長興路７２號七樓,7,住宅,9,25.186150915860004,2,1,1,1,1,0,16000.0
2023-03-10,桃園市八德區明光街４９巷２７號之１  九樓,12,住宅,29,24.496450890780004,2,2,1,1,1,0,12000.0
2023-03-16,桃園市八德區山下街１１號８樓之１,8,住宅,5,43.4390015796,2,1,1,1,1,1,17500.0
2023-03-17,桃園市龜山區萬壽路二段１１７０號十一樓１３號,11,套房,42,8.94190032516,1,0,1,1,1,0,9000.0
2023-03-17,桃園市龜山區幸福三街４３號４樓,4,住宅,42,24.805000902,2,1,1,1,0,0,13000.0
2023-03-16,桃園市龜山區萬壽路二段１１７０號四樓６號,4,套房,42,9.48640034496,1,0,0,1,1,0,10000.0
2023-03-16,桃園市龜山區萬壽路二段１１７０號七樓６號,7,套房,42,9.48640034496,1,0,0,1,1,0,10000.0
2023-02-23,桃園市龜山區明成街２１２號二樓,2,套房,16,11.67045042438,1,0,1,1,1,0,7000.0
2023-03-22,桃園市龜山區樂善二路５２２號六樓,6,住宅,1,34.512226254990004,3,1,2,1,1,0,19500.0
2023-03-21,桃園市八德區介壽路二段４２８巷１７弄６衖７之１號,2,住宅,43,27.24012599055,3,2,1,1,0,0,10000.0
2023-03-24,桃園市平鎮區平安南街３６之４號,5,住宅,42,26.798475974490003,3,2,1,1,0,0,13000.0
2023-03-26,桃園市平鎮區南京路１０２巷６號七樓,7,住宅,8,41.52417650997,2,1,1,1,1,1,15700.0
2023-03-22,桃園市蘆竹區南福街１５９之１號五樓,5,住宅,30,38.55967640217,4,1,2,1,1,0,17000.0
2023-03-26,桃園市龍潭區民治三街１５１號之３,1,住宅,32,10.75992539127,0,0,0,1,1,0,5000.0
2023-03-26,桃園市大溪區中華路３６８號六樓,6,住宅,28,23.979175871970003,2,1,1,1,1,0,10000.0
2023-03-20,桃園市大溪區三元一街６７巷１９號四樓,4,住宅,29,32.3070011748,3,2,2,1,0,0,10000.0
2023-03-12,桃園市楊梅區金山街１０９號１０樓之４,10,住宅,28,25.40395092378,6,0,6,1,1,0,30000.0
2023-03-25,桃園市楊梅區永平路２１０巷２之２號六樓,6,住宅,29,30.91247612409,3,2,2,1,1,0,10000.0
2023-03-27,桃園市楊梅區金山街３２８號十三樓,13,住宅,8,40.79817648357,2,2,1,1,1,1,16900.0
2023-03-25,桃園市中壢區松勇路６６號四樓,4,住宅,5,22.04317580157,2,1,1,1,1,0,15000.0
2023-03-25,桃園市中壢區興仁路二段９９號四樓之８８,4,套房,17,9.81007535673,1,0,1,1,1,0,7000.0
2023-02-20,桃園市觀音區六合二街９８號五樓,5,住宅,1,25.56427592961,2,2,2,1,1,1,19500.0
