date,address,floor,type,age,twPing,bedRoom,livingRoom,restRoom,furniture,elevator,parkingSpace,price
2021-11-11,桃園市平鎮區新光路四段１５５號四樓,4,住宅,9,49.66445180598001,3,2,2,1,1,1,16000.0
2021-11-16,桃園市平鎮區復旦路二段１３０號六樓之１,6,住宅,16,28.90992605127,2,1,1,1,1,0,15000.0
2021-11-16,桃園市平鎮區新華路７２巷８號２樓,2,住宅,27,25.80627593841,2,1,2,1,1,0,8000.0
2021-10-08,桃園市平鎮區上海路２００號８樓之３,8,住宅,17,21.81327579321,2,1,1,1,1,0,12000.0
2021-10-05,桃園市平鎮區環南路二段２３８號９樓,9,住宅,30,25.10145091278,2,2,1,1,1,0,13000.0
2021-10-10,桃園市平鎮區東豐路５２６巷６２號７樓,7,住宅,9,21.51380078232,0,0,0,1,1,0,7000.0
2021-10-12,桃園市平鎮區新德街２３３號十四樓,14,住宅,5,36.50570132748,2,2,2,1,1,1,14000.0
2021-10-16,桃園市龜山區文青路３４２號五樓,5,住宅,3,25.67922593379,2,2,1,1,1,0,15500.0
2021-11-17,桃園市龜山區萬壽路二段１１７０號４樓１５號,4,套房,42,10.33340037576,1,0,1,1,1,0,5500.0
2021-10-09,桃園市大溪區員林路二段３９２巷２５號五樓,5,住宅,29,38.85007641273,3,1,2,1,0,0,10000.0
2021-10-30,桃園市龍潭區龍平路１１巷９號四樓,4,住宅,42,18.15000066,3,2,2,1,0,0,10000.0
2021-11-12,桃園市龍潭區民族路４３４巷２０之３號９樓,9,住宅,7,43.54790158356,3,1,2,1,1,0,13000.0
2021-11-05,桃園市龜山區文青路１６５號５樓之７,5,住宅,8,47.45620172568,3,2,2,1,1,0,21000.0
2021-11-07,桃園市大溪區大鶯路６０巷１８６號三樓,3,住宅,27,22.21257580773,2,1,1,1,1,0,10000.0
2021-11-01,桃園市龜山區文德二路８６巷６７號四樓,4,住宅,28,42.66157655133,3,1,2,1,0,0,12000.0
2021-11-01,桃園市龜山區文善街２９號三樓,3,住宅,28,22.07947580289,3,1,2,1,0,0,10000.0
2021-11-24,桃園市龜山區文化一路５３３號十樓之３,10,住宅,2,30.53435111034,2,2,1,1,1,0,20000.0
2021-11-02,桃園市八德區銀和街２７巷２弄７號十八樓之６,18,住宅,25,46.07377667541,2,1,2,1,1,0,13000.0
2021-10-18,桃園市八德區中華路３１４號七樓之２,7,住宅,27,20.86645075878,2,1,1,1,1,0,11000.0
2021-11-16,桃園市八德區介壽路二段１２３３巷４８弄１７衖１號三樓,3,住宅,31,36.11547631329,3,2,2,1,0,0,16000.0
2021-10-30,桃園市蘆竹區長興路一段８號三樓,3,住宅,11,47.39267672337001,3,2,1,1,1,1,21000.0
2021-10-01,桃園市大園區拔子林三路５３巷１７弄５１之２３號四樓,4,住宅,9,16.767575609730002,0,0,0,1,1,0,10800.0
2021-10-28,桃園市中壢區福安一街１６巷１號二樓,2,住宅,34,33.37785121374,3,2,2,1,0,0,18000.0
2021-10-16,桃園市中壢區黃興街７８巷１２號五樓,5,住宅,41,29.89002608691,3,2,1,1,0,0,7000.0
2021-10-27,桃園市中壢區龍岡路三段１１５巷６５弄１１號十三樓,13,住宅,11,34.48802625411,2,2,2,1,1,0,14000.0
2021-10-12,桃園市中壢區中山路２０１號五樓之八,5,套房,29,10.74782539083,1,0,1,1,1,0,7500.0
2021-11-05,桃園市中壢區吉利五街１４號四樓,4,住宅,42,26.56555096602,3,1,1,1,0,0,15000.0
2021-11-09,桃園市中壢區龍川二街１１３號四樓,4,住宅,23,28.89782605083,3,2,2,1,1,0,12500.0
2021-11-03,桃園市中壢區南園二路１巷２４弄１９號四樓,4,住宅,42,22.49995081818,3,2,1,1,0,0,8500.0
2021-10-28,桃園市中壢區溪洲三街６３號三樓,3,住宅,43,25.62780093192,3,2,2,1,0,0,12000.0
2021-11-27,桃園市中壢區中園路２２號九樓之１２,9,套房,16,18.68542567947,1,1,1,1,1,0,11500.0
2021-11-23,桃園市中壢區環西路二段２２６巷２號二樓,2,住宅,9,33.54120121968,3,2,1,1,1,1,16500.0
2021-10-29,桃園市中壢區中山東路三段６３號１８樓之１,18,住宅,15,40.586426475870006,3,2,2,1,1,0,15000.0
2021-10-02,桃園市中壢區興仁路二段６４８巷６０號１２樓,12,住宅,12,34.73305126302,3,2,2,1,1,0,16000.0
2021-10-20,桃園市中壢區執信一街１７３之２８號８樓,8,住宅,25,9.41985034254,0,0,0,1,1,0,8000.0
2021-10-27,桃園市中壢區大智街１０號３樓之２,3,住宅,34,8.61520031328,0,0,0,1,0,0,5300.0
2021-10-04,桃園市中壢區新興路２３０巷５０號１３樓,13,住宅,12,38.81680141152,2,2,2,1,1,0,15000.0
2021-10-07,桃園市中壢區榮安一街３３０號６樓之８,6,住宅,22,26.53832596503,3,1,2,1,1,0,12000.0
2021-10-15,桃園市中壢區新中一街１４號２樓,2,住宅,32,36.81122633859,4,1,2,1,1,0,17700.0
2021-10-25,桃園市中壢區榮安一街２３６號２樓,2,住宅,25,44.81840162976,3,2,2,1,1,1,11000.0
2021-11-13,桃園市中壢區志航街１７３號,1,住宅,42,26.647225968990004,2,2,2,1,0,0,20000.0
2021-11-08,桃園市中壢區環北路３５２號５樓之１６,5,住宅,14,12.87137546805,0,0,0,1,1,0,13000.0
2021-10-20,桃園市中壢區福星三街４５號３樓,3,住宅,32,31.940976161490003,3,1,2,1,1,0,15000.0
2021-11-19,桃園市中壢區慈惠三街３３號十一樓之６,11,套房,22,14.16910051524,1,1,1,1,1,0,11500.0
2021-11-05,桃園市八德區高城七街２１巷１９之１號,2,住宅,42,20.68192575207,3,2,1,1,0,0,9000.0
2021-11-23,桃園市平鎮區高雙路１７號十二樓,12,住宅,5,39.81505144782,2,2,1,1,1,1,16500.0
2021-10-05,桃園市平鎮區龍南路４３０巷５４弄３號３樓,3,住宅,30,31.97122616259,3,1,2,1,1,0,13000.0
2021-10-24,桃園市平鎮區文化街２９１號４樓,4,住宅,30,43.17885157014,3,2,2,1,1,1,12500.0
2021-10-13,桃園市平鎮區東豐路１４５巷２０號５樓之３,5,住宅,2,37.74897637269,2,2,1,1,1,1,15000.0
2021-09-24,桃園市龍潭區新龍路１４１號,1,住宅,31,26.39917595997,2,1,1,1,0,0,11000.0
2021-08-20,桃園市龍潭區新龍路１４１之１號,2,住宅,31,26.28120095568,3,2,1,1,0,0,10000.0
2021-10-30,桃園市龍潭區民強街３５號５樓之１０,5,住宅,25,14.75897553669,1,0,0,1,1,0,7300.0
2021-11-08,桃園市大溪區美山路一段６０１巷１４２弄９號２號,2,住宅,28,25.30715092026,2,2,2,1,1,1,8100.0
2021-11-19,桃園市龜山區幸福十一街３９號４樓,4,住宅,42,22.10670080388,2,2,1,1,0,0,12000.0
2021-11-18,桃園市龜山區頂興路８３巷１６號３樓,3,住宅,42,29.41510106964,3,2,1,1,0,0,14000.0
2021-11-19,桃園市龜山區明德路３２６號２樓之１２,2,套房,22,9.11735033154,1,0,1,1,1,0,6000.0
2021-11-18,桃園市龜山區萬壽路二段１１７０號４樓１３號,4,套房,42,8.94190032516,1,0,1,1,1,0,5500.0
2021-10-24,桃園市平鎮區新富街１０２號４樓,4,住宅,23,45.27820164648001,3,2,2,1,1,0,10000.0
2021-11-01,桃園市平鎮區中豐路南勢二段７５巷２１弄３號,1,住宅,42,20.8120007568,3,1,1,1,0,0,8000.0
2021-10-29,桃園市八德區長興路１０１號２樓,2,住宅,8,47.02362670995,3,2,2,1,1,1,19000.0
2021-11-18,桃園市八德區介壽路一段４２５巷７之３號,4,住宅,42,26.84687597625,3,1,1,1,0,0,11000.0
2021-11-26,桃園市桃園區中平路１２１號三樓,3,住宅,29,33.160051205820004,3,2,1,1,1,0,13000.0
2021-11-26,桃園市桃園區同德十街９號四樓,4,住宅,30,33.849751230900004,3,2,2,1,1,0,14000.0
2021-12-01,桃園市桃園區新埔十街１４巷１２號七樓,7,住宅,30,31.67780115192,3,1,2,1,1,0,15000.0
2021-11-27,桃園市桃園區大興西路二段６９巷１２０號二樓,2,住宅,12,19.662500715,1,2,1,1,1,0,16000.0
2021-11-19,桃園市桃園區中埔六街１９０巷４號４樓,4,住宅,29,33.56842622067,3,1,2,1,1,0,18800.0
2021-11-26,桃園市桃園區上海路１０６號十二樓,12,住宅,30,32.512701182280004,3,2,2,1,1,0,14700.0
2021-11-18,桃園市桃園區春日路９８１巷４之２號,3,住宅,35,33.98587623585,3,1,2,1,0,0,11000.0
2021-11-20,桃園市蘆竹區南山路一段３３號７樓之８,7,套房,28,11.01705040062,1,0,1,1,1,0,6400.0
2021-08-23,桃園市楊梅區文化街５７８號５樓,5,住宅,29,28.88270105028,2,1,2,1,0,0,8500.0
2021-11-27,桃園市中壢區延平路３５６之７號九樓,9,住宅,30,16.09905058542,1,1,1,1,1,0,9000.0
2021-11-26,桃園市中壢區青商路２８號五樓,5,住宅,6,63.60667731297,3,2,2,1,1,1,16200.0
2021-11-18,桃園市中壢區吉長街１８巷１５號３樓,3,住宅,42,22.34265081246,2,1,2,1,0,0,10000.0
2021-11-29,桃園市中壢區環北路３５２號六樓之１９,6,住宅,14,12.49022545419,0,0,0,1,1,0,11500.0
2021-11-11,桃園市中壢區龍岡路二段７３巷４２號,1,住宅,16,7.934575288530001,0,0,0,1,1,0,7000.0
2021-11-22,桃園市中壢區後興路一段９０巷２號,1,住宅,23,19.29647570169,3,2,1,1,1,0,9500.0
2021-11-29,桃園市中壢區富村街５６之３號三樓,3,住宅,27,37.21960135344,3,2,2,1,1,0,15000.0
2021-11-04,桃園市觀音區福祥街１１６號４樓,4,住宅,2,25.107500913000003,2,1,1,1,1,0,13000.0
2021-11-04,桃園市觀音區福祥街１００號十樓,10,住宅,2,25.23152591751,2,1,1,1,1,0,15500.0
2021-11-04,桃園市楊梅區湖山街２８巷５２號５樓,5,住宅,27,26.973925980870003,3,2,2,1,0,0,9000.0
2021-10-26,桃園市蘆竹區中正路１９７之３號,4,住宅,35,30.44965110726,3,2,1,1,0,0,12000.0
2021-09-30,桃園市蘆竹區南福街１８６巷１號六樓之１,6,住宅,16,27.88142601387,2,2,1,1,1,1,18000.0
2021-11-15,桃園市楊梅區青山一街１２９號三樓,3,住宅,5,28.79497604709,2,1,1,1,1,0,13400.0
2021-11-21,桃園市龜山區華亞三路３９巷３３號５樓,5,套房,2,16.3047505929,1,0,1,1,1,0,10000.0
2021-11-18,桃園市龜山區文七一街６７巷６號四樓,4,住宅,28,41.203526498310005,3,2,1,1,0,0,6500.0
2021-11-24,桃園市龜山區文青二路３９號１９樓之１,19,住宅,8,48.97475178090001,4,2,2,1,1,0,20000.0
2021-11-12,桃園市龜山區長峰路７６號十八樓之８,18,住宅,9,27.35810099484,1,1,1,1,1,1,12000.0
2021-10-29,桃園市蘆竹區中正路３０６號１６樓之２,16,住宅,27,10.64497538709,0,0,0,1,1,0,11600.0
2021-11-14,桃園市觀音區福祥街１０８號九樓,9,住宅,2,35.59215129426,2,1,1,1,1,1,14000.0
2021-11-01,桃園市中壢區福州一街６號十樓之四,10,住宅,28,14.61377553141,0,0,0,1,1,0,7700.0
2021-11-25,桃園市觀音區福祥街１１６號十三樓,13,住宅,2,34.36097624949,2,1,1,1,1,1,15500.0
2021-12-03,桃園市中壢區榮安一街４２５號十三樓,13,住宅,20,51.08620185768,3,2,2,1,1,1,17000.0
2021-11-01,桃園市中壢區遠東路５７巷１５號３樓,3,住宅,42,28.01452601871,3,2,1,1,0,0,16500.0
2021-11-14,桃園市觀音區福祥街１０８號八樓,8,住宅,2,35.59215129426,2,1,1,1,1,1,16500.0
2021-12-03,桃園市中壢區興仁路二段２號五樓之１０,5,住宅,27,7.90130028732,0,0,0,1,1,0,5500.0
2021-11-18,桃園市觀音區福祥街１１０號二樓,2,住宅,2,35.816001302400004,2,1,1,1,1,1,18000.0
2021-11-05,桃園市中壢區永康三街２１號４樓,4,住宅,30,33.90117623277,3,2,1,1,1,0,15000.0
2021-11-10,桃園市中壢區仁慈路１７６號四樓,4,住宅,28,9.17785033374,0,0,0,1,1,0,6000.0
2021-11-19,桃園市楊梅區金山街３６８巷６２號二樓,2,住宅,6,35.38342628667,2,1,1,1,1,1,14000.0
2021-11-24,桃園市楊梅區金山街３６８巷２號十樓,10,住宅,6,37.52512636455,2,1,1,1,1,1,14500.0
2021-11-26,桃園市楊梅區金山街２７５巷３６號十五樓,15,住宅,7,40.02075145530001,2,2,1,1,1,1,17500.0
2021-12-06,桃園市蘆竹區中正路２７號１９樓之６,19,住宅,26,18.03807565593,2,1,1,1,1,0,11000.0
2021-11-16,桃園市桃園區三民路三段１８８號九樓之２,9,住宅,26,35.79482630163,3,2,2,1,1,0,14000.0
2021-11-28,桃園市桃園區同德十街３０巷１０號七樓,7,住宅,27,30.83987612145,2,2,1,1,1,1,22000.0
2021-11-28,桃園市桃園區同德二街１２８號二十一樓,21,住宅,10,51.95437688925,3,2,2,1,1,1,30000.0
2021-11-21,桃園市桃園區寶山街２３３號３樓之２,3,住宅,26,20.76360075504,4,2,2,1,1,0,14000.0
2021-11-23,桃園市桃園區興一街９８之７號５樓,5,住宅,30,36.5420013288,3,2,2,1,1,0,16200.0
2021-11-19,桃園市楊梅區梅獅路二段２７７號十五樓,15,住宅,2,40.09335145794,2,2,1,1,1,1,15000.0
2021-11-21,桃園市楊梅區青山二街４１５號３樓,3,住宅,28,34.38820125048,3,1,1,1,1,0,10000.0
2021-11-28,桃園市中壢區三光路２０１號七樓,7,住宅,16,37.543276365210005,3,2,2,1,1,1,22000.0
2021-11-22,桃園市中壢區長沙路３號８樓,8,住宅,31,32.972501199,3,1,2,1,1,0,16000.0
2021-11-29,桃園市平鎮區振興西路１５５巷１０號,1,住宅,30,25.3797509229,3,2,1,1,1,0,10000.0
2021-11-19,桃園市平鎮區游泳路１５３巷１０弄８號３樓,3,住宅,30,31.275476137290003,3,2,1,1,1,0,12000.0
2021-11-23,桃園市八德區介壽路二段６８５巷６６弄８２號４樓,4,住宅,42,25.410000924,3,1,1,1,0,0,7000.0
2021-11-22,桃園市八德區富城街１６巷３號,1,住宅,47,20.76965075526,3,1,1,1,0,0,10000.0
2021-11-05,桃園市大溪區員林路一段３巷１３號１４樓,14,住宅,9,61.36212723135,2,2,2,1,1,1,16000.0
2021-11-05,桃園市大溪區民權東路１８５巷１號２樓之３,2,住宅,30,36.62367633177001,2,2,2,1,1,0,12200.0
2021-11-24,桃園市大溪區華興街１３巷８之２號,3,住宅,45,19.50520070928,3,1,1,1,0,0,10000.0
2021-11-15,桃園市龍潭區北龍路１５巷２２號２樓之５,2,住宅,3,16.55885060214,0,0,0,1,1,0,12200.0
2021-11-15,桃園市大溪區中華路７０巷２７號７樓,7,住宅,29,41.49695150898,3,2,1,1,1,1,12500.0
2021-11-15,桃園市大溪區埔頂路一段３５７巷１５號２樓,2,住宅,18,53.88432695943,3,2,2,1,1,1,13000.0
2021-12-01,桃園市龜山區文三二街３１號二樓,2,住宅,25,38.77747641009,3,1,2,1,0,0,15000.0
2021-12-01,桃園市八德區豐田路２９９號八樓,8,住宅,10,51.186026861310005,3,2,2,1,1,1,17000.0
2021-12-01,桃園市平鎮區南平路１４９之５號六樓,6,住宅,9,42.09892653087,2,2,1,1,1,1,17000.0
2021-11-23,桃園市中壢區元化路２６８號５樓之１１,5,套房,18,15.5787505665,1,0,1,1,1,0,8400.0
2021-11-11,桃園市中壢區成章三街１４３巷１１號７樓,7,住宅,25,38.77445140998,3,2,2,1,1,1,13500.0
2021-11-12,桃園市中壢區振興街１之１號４樓之１,4,住宅,30,12.093950439780002,2,1,2,1,1,0,13700.0
2021-11-24,桃園市中壢區吉長街１８巷１３號３樓,3,住宅,42,22.34265081246,3,1,1,1,0,0,8500.0
2021-11-25,桃園市中壢區高鐵南路二段３６２之５號２４樓,24,套房,4,19.56872571159,1,0,1,1,1,0,18000.0
2021-11-15,桃園市中壢區龍岡路三段１１２號１０樓,10,住宅,30,37.03507634673,3,1,1,1,1,0,15000.0
2021-11-12,桃園市中壢區元化路２１５巷１０樓之５,10,住宅,23,9.44102534331,0,0,0,1,1,0,8000.0
2021-11-20,桃園市蘆竹區南山路１段７３號１７樓之４,17,套房,28,7.214625262349999,1,0,1,1,1,0,7500.0
2021-11-20,桃園市蘆竹區南山路１段７３號１７樓之４,17,套房,28,7.214625262349999,1,0,1,1,1,0,7500.0
2021-12-01,桃園市蘆竹區南山路１段３１號１６樓之４,16,套房,28,8.00415029106,1,0,1,0,1,0,5500.0
2021-11-30,桃園市蘆竹區大新四街６８號七樓,7,住宅,7,27.29760099264,2,2,1,1,1,0,12000.0
2021-12-01,桃園市桃園區中正路６３６號４樓,4,套房,32,8.41555030602,1,0,1,1,1,0,8000.0
2021-11-01,桃園市桃園區龍壽街１４５巷７之２號,3,住宅,43,19.09682569443,3,2,1,1,0,0,13000.0
2021-11-09,桃園市桃園區忠五路１７１號４樓,6,住宅,31,30.95482612563,3,2,2,1,1,0,17000.0
2021-11-10,桃園市桃園區龍安街１４巷８號７樓之１,7,住宅,27,36.80820133848,3,2,2,1,1,0,14000.0
2021-10-21,桃園市桃園區莊敬路一段１５２巷５號九樓,9,住宅,29,38.06357638413,2,2,2,1,1,1,18000.0
2021-11-26,桃園市桃園區忠二路１８３之１號九樓,9,住宅,4,39.78782644683,2,1,1,1,1,1,20000.0
2021-11-05,桃園市桃園區上海路１６３號三樓,3,住宅,20,25.355550922020004,2,1,1,1,1,0,13500.0
2021-10-30,桃園市桃園區鎮撫街３６２號七樓之１,7,住宅,27,26.17532595183,2,1,1,1,1,0,11000.0
2021-10-31,桃園市桃園區中正路１３８８號四樓之一,4,住宅,29,34.04637623805,3,2,2,1,1,1,18600.0
2021-10-25,桃園市桃園區大有路７３８號十樓,10,住宅,8,56.37390204996001,3,2,2,1,1,1,17500.0
2021-11-01,桃園市桃園區天祥五街３９號４樓,4,住宅,30,36.40285132374,3,2,1,1,1,0,15400.0
2021-10-15,桃園市桃園區大興西路一段１９１巷１０弄１４之２號,3,住宅,42,35.147476278090004,3,2,1,1,0,0,12000.0
2021-12-08,桃園市桃園區大興西路二段２７９號十四樓之２,14,住宅,28,34.90245126918,3,2,2,1,1,0,19000.0
2021-11-24,桃園市桃園區雙?路１９４號六樓,6,住宅,31,24.0790008756,2,2,1,1,1,0,13000.0
2021-11-01,桃園市桃園區龍安街１０號２樓之２,2,住宅,27,21.43515077946,2,2,1,1,1,0,12000.0
2021-11-26,桃園市桃園區大興西路二段２６５號１９樓之１,19,住宅,28,35.392501287,3,2,2,1,1,0,16500.0
2021-11-26,桃園市桃園區民生路３１０之１號１０樓,10,套房,16,15.69067557057,1,0,1,1,1,0,10500.0
2021-11-05,桃園市蘆竹區六福路２２９號３樓,3,住宅,21,50.251301827320006,3,2,2,1,1,1,20500.0
2021-11-23,桃園市蘆竹區中正路２９５號八樓之２,8,住宅,21,30.87012612255,2,1,1,1,1,0,18000.0
2021-12-08,桃園市蘆竹區大竹北路７２３巷２０號二樓之１,2,住宅,29,29.935401088560003,3,2,2,1,1,0,12500.0
2021-11-05,桃園市楊梅區青山一街１４９號三樓,3,住宅,5,38.43867639777,2,2,1,1,1,1,13500.0
2021-12-01,桃園市中壢區新中北路７６號三樓之１０；新中北路７６號三樓之１１,3,住宅,28,22.89320083248,0,0,0,1,1,0,12000.0
2021-10-31,桃園市中壢區興仁路二段６４８巷１０號六樓之１,6,住宅,10,45.80757666573,3,1,2,1,1,1,17000.0
2021-10-26,桃園市中壢區榮安十五街２８之２號七樓,7,住宅,27,23.13822584139,2,2,1,1,1,0,11000.0
2021-11-25,桃園市中壢區永強街１２６號９樓,9,住宅,21,57.71397709869001,3,2,2,1,1,1,13800.0
2021-11-26,桃園市中壢區中北路二段２０８巷４０號７樓,7,住宅,22,25.45840092576,2,2,1,1,1,0,16000.0
2021-10-24,桃園市中壢區中山東路三段４８１巷５２號四樓之２,4,住宅,13,34.41845125158,3,2,2,1,1,0,18000.0
2021-12-08,桃園市中壢區環中東路二段３１２巷１號九樓之１,9,住宅,24,33.840676230570004,3,2,2,1,1,0,16000.0
2021-12-09,桃園市中壢區領航北路二段２６６號七樓之２,7,住宅,2,34.30955124762,2,2,1,1,1,1,18500.0
2021-11-25,桃園市中壢區執信一街１７３之１０號６樓,6,住宅,25,9.17180033352,0,0,0,1,1,0,5900.0
2021-11-29,桃園市中壢區中美路一段１８號１４樓之１１,14,住宅,26,12.76247546409,0,0,0,1,1,0,6300.0
2021-11-10,桃園市中壢區莊敬路８６９號八樓之２,8,住宅,24,9.47430034452,0,0,0,1,1,0,6000.0
2021-11-30,桃園市平鎮區福龍路一段５５０巷２弄１２號５樓,5,住宅,19,30.70677611661,3,2,2,1,1,0,7000.0
2021-11-29,桃園市平鎮區復旦路二段１９５號六樓,6,住宅,30,32.530851182940005,3,1,2,1,1,0,10600.0
2021-12-09,桃園市平鎮區中豐路１１０號三樓,3,住宅,26,19.44167570697,2,1,1,1,1,0,8300.0
2021-11-11,桃園市平鎮區平安南街５１號８樓,8,住宅,31,53.233951935780006,4,2,2,1,1,1,17500.0
2021-11-25,桃園市平鎮區新富五街１６０號１５樓,15,住宅,11,45.60792665847,3,2,2,1,1,1,15000.0
2021-11-01,桃園市八德區天祥街２４巷３之１號,2,住宅,42,28.51062603675,2,2,1,1,0,0,8000.0
2021-11-01,桃園市八德區陸光街５８號１０樓,10,住宅,24,43.70217658917,3,2,2,1,1,0,11500.0
2021-11-23,桃園市八德區前程街１０之６號１５樓,15,住宅,28,36.71140133496,3,2,2,1,1,0,15000.0
2021-11-29,桃園市八德區廣興一路１號１３樓之１,13,住宅,9,45.84992666727,3,2,2,1,1,1,16500.0
2021-11-29,桃園市八德區建國路１３３巷３弄１０號３樓,3,住宅,25,40.02680145552,3,2,2,1,1,0,11000.0
2021-10-24,桃園市龜山區自強南路８１巷５弄１號,1,住宅,42,26.61697596789,4,1,1,1,0,0,18500.0
2021-11-26,桃園市龍潭區北龍路１５巷２２號２樓之５,1,住宅,3,12.08185043934,0,0,0,1,1,0,12200.0
2021-11-28,桃園市龍潭區民治路３３９號６樓之１７,6,住宅,21,26.82267597537,0,0,0,1,1,1,11500.0
2021-11-01,桃園市平鎮區大連街１０８之１號８樓,8,住宅,7,36.99877634541,3,2,2,1,1,0,10000.0
2021-11-06,桃園市平鎮區高雙高雙路５號１３樓,13,住宅,5,46.36417668597,2,2,1,1,1,1,17000.0
2021-11-23,桃園市八德區建德路２７１號９樓,9,住宅,8,24.06085087494,2,1,1,1,1,0,10800.0
2021-11-09,桃園市八德區建國路５０巷１號４樓,4,住宅,31,35.25940128216,3,2,1,1,1,1,17000.0
2021-11-21,桃園市大溪區僑愛一街１０５巷１５弄８號９樓,9,住宅,21,60.48185219934,4,2,2,1,1,1,15600.0
2021-11-04,桃園市龜山區萬壽路二段６２８巷２８號８樓,8,住宅,18,44.524976619090005,3,2,2,1,1,1,22000.0
2021-11-24,桃園市桃園區大有路１５２號九樓之６,9,住宅,29,21.75277579101,1,1,1,1,1,0,12000.0
2021-11-27,桃園市中壢區龍慈路２３９巷２６號１８樓,18,住宅,23,30.95180112552,3,2,1,1,1,0,13000.0
2021-12-04,桃園市中壢區榮安一街２１２巷４８號５樓,5,住宅,23,42.11707653153001,4,2,2,1,1,0,18000.0
2021-10-15,桃園市中壢區中園路二段１４５之９號７樓,7,住宅,27,10.66312538775,1,1,1,1,1,0,9500.0
2021-11-01,桃園市中壢區仁福三街７８號１０樓,10,住宅,29,27.966126016950003,3,2,2,1,1,0,14000.0
2021-11-09,桃園市中壢區愛國路８５號２樓之４,2,住宅,31,13.17387547905,1,1,1,1,1,0,8000.0
2021-12-07,桃園市楊梅區青山三街３６巷８號９樓,9,住宅,17,22.43340081576,2,1,1,0,1,0,12000.0
2021-11-12,桃園市楊梅區青山二街３８２號７樓之６,7,住宅,28,12.64147545969,1,1,1,1,1,0,6500.0
2021-11-18,桃園市桃園區復興路９９號１４樓之１９,14,套房,26,14.87090054076,1,0,1,1,1,0,8000.0
2021-11-30,桃園市桃園區桃園區法院後街２６號５樓,5,住宅,3,34.10990124036,3,2,2,1,1,0,15000.0
2021-11-30,桃園市桃園區宏昌十三街７２４號,1,住宅,28,32.503626181950004,2,1,1,1,1,0,13500.0
2021-11-12,桃園市桃園區莊敬路一段３７２號７樓,7,住宅,29,34.68465126126,2,2,2,1,1,0,18500.0
2021-11-11,桃園市桃園區新埔八街３６號２樓,2,住宅,42,27.0435009834,3,1,2,1,0,0,18000.0
2021-11-16,桃園市桃園區雙龍街３５巷５號,1,套房,49,12.705000462,1,1,1,1,1,0,10000.0
2021-12-05,桃園市桃園區大業路一段３２５號五樓,5,住宅,17,33.65615122386,2,2,1,1,1,1,20000.0
2021-12-05,桃園市桃園區桃智路３１號五樓,5,住宅,11,77.87257783173,4,2,2,1,1,1,31000.0
2021-11-23,桃園市桃園區慈德街１７２號九樓,9,住宅,19,26.70167597097,2,2,1,1,1,0,17000.0
2021-11-27,桃園市桃園區民光東路１１６號十三樓,13,住宅,22,46.597101694440006,3,2,2,1,1,1,17500.0
2021-11-22,桃園市桃園區朝陽街９號六樓之３,6,套房,26,10.584475384890002,1,0,1,1,1,0,8000.0
2021-11-28,桃園市桃園區文中三路７３號２樓,2,住宅,3,38.61715140426,3,1,2,1,1,0,17800.0
2021-10-05,桃園市楊梅區裕成南路３７３號５樓,5,住宅,27,23.61920085888,2,2,1,1,1,0,11500.0
2021-11-25,桃園市楊梅區青山五街１０巷１３號十二樓之１,12,住宅,28,56.81555206602,3,2,2,1,1,0,10000.0
2021-11-27,桃園市大園區和平二街１１４巷２號五樓,5,住宅,26,27.84210101244,3,2,2,1,1,0,15000.0
2021-11-26,桃園市大園區和平西路１００號２樓之２,2,住宅,5,53.46990194436,3,2,2,1,1,1,21000.0
2021-11-29,桃園市蘆竹區大興十街１１５號十二樓,12,住宅,8,58.7455021362,3,2,2,1,1,1,19000.0
2021-11-23,桃園市中壢區慈惠一街１１６號五樓,5,住宅,40,28.31702602971,3,2,2,1,0,0,11500.0
2021-11-27,桃園市中壢區中北路二段１１７號９樓之５,9,套房,30,16.46810059884,1,0,1,1,1,0,8000.0
2021-11-23,桃園市觀音區長春街１７０之３號四樓,4,住宅,3,20.42782574283,2,2,1,1,1,0,12500.0
2021-11-17,桃園市中壢區晉元路３３７巷６６號六樓之３,6,住宅,2,36.36655132242,3,2,2,1,1,0,16500.0
2021-10-18,桃園市中壢區仁德五街９之１號七樓,7,住宅,24,40.97362648995,3,2,2,1,1,1,14000.0
2021-11-02,桃園市中壢區嘉興二街１１之１號五樓,5,住宅,30,30.94272612519,3,2,1,1,1,0,16000.0
2021-11-27,桃園市中壢區福州二街５２０號七樓之３,7,住宅,10,45.39617665077,3,2,2,1,1,1,20000.0
2021-11-15,桃園市觀音區建國路８６號四樓之２,4,住宅,2,21.54707578353,2,2,2,1,1,0,13800.0
2021-11-27,桃園市中壢區龍岡路二段３６７之２號八樓,8,住宅,29,24.5630008932,2,1,1,1,1,0,9000.0
2021-11-04,桃園市中壢區中山東路四段３９巷２０號十四樓之５,14,住宅,25,13.606450494780002,2,1,1,1,1,0,9000.0
2021-11-26,桃園市龍潭區中原路二段３７８巷８號５樓,5,住宅,29,32.41287617865,3,1,2,1,1,0,11000.0
2021-11-28,桃園市大溪區大鶯路６０巷１５０號５樓,5,住宅,27,22.2640008096,4,1,1,1,1,0,5000.0
2021-11-18,桃園市八德區福國北街７２號三樓之２,3,住宅,31,28.298876029050003,3,2,2,1,1,0,14500.0
2021-10-28,桃園市八德區仁愛街８巷５號十三樓,13,住宅,24,41.04622649259,3,2,2,1,1,0,18500.0
2021-11-26,桃園市八德區廣興一路３號九樓之３,9,住宅,9,36.65695133298,2,2,1,1,1,1,13143.0
2021-11-23,桃園市平鎮區新榮路７８巷６弄７號三樓,3,住宅,39,22.79640082896,3,2,2,1,0,0,10000.0
2021-11-30,桃園市平鎮區延平路二段４３０巷７１號六樓,6,住宅,16,33.28710121044001,3,2,2,1,1,1,13000.0
2021-11-27,桃園市平鎮區復旦路二段１２８之２１號四樓,4,住宅,30,32.264651173260006,3,2,2,1,1,0,11000.0
2021-11-01,桃園市平鎮區開封街４２０號１２樓,12,住宅,12,45.79245166518,3,2,2,1,1,1,14000.0
2021-10-28,桃園市平鎮區龍南路４３０巷７０號二樓,2,住宅,29,32.521776182610004,3,1,1,1,0,0,10000.0
