date,address,floor,type,age,twPing,bedRoom,livingRoom,restRoom,furniture,elevator,parkingSpace,price
2019-09-17,台北市中山區新生北路二段68巷9號十一樓之1,11,住宅,15,22.959750834900003,2,1,1,1,1,0,42000.0
2019-09-10,台北市中山區復興北路400號4樓之6,4,住宅,37,23.93682587043,2,1,1,1,1,0,38000.0
2019-09-07,台北市中山區農安街1巷55號12樓,12,住宅,7,41.16722649699,3,2,2,1,1,0,65000.0
2019-08-31,台北市中山區中山北路二段65巷9號13樓,13,套房,22,26.771250973500003,1,1,1,1,1,0,40000.0
2019-09-05,台北市中山區建國北路一段124巷3號11樓之1,11,住宅,27,60.15515218746,3,2,2,1,1,0,55000.0
2019-09-01,台北市中山區中山北路一段121巷33號8樓之1,8,住宅,12,20.80897575669,2,1,1,1,1,0,38000.0
2019-08-30,台北市中山區明水路５６７號十樓,10,住宅,28,70.89390257796,2,2,2,1,1,1,63000.0
2019-08-30,台北市中山區堤頂大道二段352號4樓,4,住宅,20,88.35722821299001,4,2,3,1,1,1,102168.0
2019-03-26,台北市松山區延壽街95號,1,住宅,49,34.96597627149,0,0,0,1,0,0,65000.0
2019-09-10,台北市松山區南京東路4段23號12樓之5,12,住宅,15,16.90067561457,1,1,1,1,1,0,30000.0
2019-08-31,台北市南港區重陽路480號13樓,13,住宅,7,29.47257607173,2,1,1,1,1,0,28445.0
2019-09-24,台北市中正區忠孝東路二段39巷2弄16號4樓,4,住宅,49,43.01852656431,6,3,4,0,0,0,35000.0
2019-08-20,台北市大同區民權西路118巷2號7樓之7,7,住宅,17,10.57842538467,0,0,0,1,1,0,25000.0
2019-09-25,台北市萬華區東園街66巷24弄1號四樓,4,住宅,6,51.77892688287001,4,2,2,1,1,1,43000.0
2019-09-17,台北市士林區中正路655巷8號二樓之2,2,住宅,9,48.0672517479,3,2,2,1,1,1,38000.0
2019-09-10,台北市北投區大業路５２９號五樓之４,5,套房,28,13.155725478389998,1,1,1,1,1,0,14000.0
2019-09-10,台北市北投區石牌路二段３４８巷１９號二樓之２,2,套房,30,15.14012555055,0,1,1,1,1,0,12500.0
2019-09-02,台北市大安區復興南路二段２９１號九樓之５,9,套房,35,15.03122554659,1,1,1,1,1,0,25000.0
2019-09-25,台北市大安區大安路一段191號6樓,6,住宅,46,55.93225203389999,2,2,1,1,1,0,53000.0
2019-09-16,台北市大安區敦化南路二段128號16樓之3,16,住宅,44,35.67080129712,3,2,2,1,1,0,48200.0
2019-09-25,台北市大安區通化街101巷29號3樓,3,住宅,31,24.36940088616,3,1,1,1,0,0,18000.0
2019-09-24,台北市大安區瑞安街208巷39號5樓之2,5,套房,8,13.37655048642,1,1,1,1,1,0,30000.0
2019-09-21,台北市大安區信義路二段52號9樓之6,9,住宅,13,11.22880040832,1,1,1,1,1,0,25000.0
2019-09-09,台北市大安區通安街８號四樓,4,住宅,11,24.160675878570004,3,2,1,1,1,0,40000.0
2019-09-18,台北市大安區信義路四段134號7樓,7,住宅,43,42.534526546710005,3,1,2,1,1,0,47500.0
2019-09-16,台北市大安區瑞安街208巷39號5樓之3,5,住宅,8,12.62635045914,0,1,1,1,1,0,28000.0
2019-09-21,台北市士林區劍潭路73號14樓之1,14,住宅,16,26.29027595601,2,1,1,1,1,0,40000.0
2019-09-09,台北市士林區忠誠路二段180號7樓,7,住宅,28,58.2010021164,3,2,2,1,1,0,91000.0
2019-09-25,台北市士林區福志路66號7樓,7,住宅,21,39.60935144034,3,2,1,1,1,0,34056.0
2019-09-27,台北市北投區大度路3段270巷69號13樓之6,13,住宅,11,47.61350173140001,1,1,1,1,1,1,34690.0
2019-09-25,台北市中正區仁愛路二段38巷7弄6號3樓之2,3,住宅,30,10.182150370260002,1,0,1,1,1,0,13500.0
2019-09-21,台北市信義區信義路五段95號16樓,16,住宅,16,88.62040322256001,3,2,2,1,1,1,150000.0
2019-09-19,台北市信義區永吉路32號4樓之9,4,住宅,38,18.56442567507,2,1,1,1,1,0,26500.0
2019-09-02,台北市信義區吳興街600巷128號14樓,14,住宅,13,63.73070231748,2,2,2,1,1,1,45502.0
2019-09-02,台北市松山區南京東路五段167號15樓之2,15,住宅,13,75.42837774285,3,2,2,1,1,1,116000.0
2019-09-09,台北市中山區德惠街16號10樓之1之2,10,住宅,41,17.68717564317,2,1,1,1,1,0,25000.0
2019-09-02,台北市中山區林森北路363號8樓之6,8,套房,14,24.47527589001,1,1,1,1,1,0,48000.0
2019-09-10,台北市中山區新生北路二段68巷9號9樓之3,9,住宅,15,20.05877572941,2,2,1,1,1,0,40000.0
2019-09-08,台北市中山區松江路１８４巷２６弄１６號五樓,5,住宅,15,33.24172620879,3,2,2,1,1,0,39000.0
2019-09-06,台北市中山區德惠街16號3樓之2,3,住宅,41,11.597850421740002,1,0,1,1,1,0,13000.0
2019-09-16,台北市內湖區成功路四段315號2樓,2,住宅,42,27.22500099,3,2,1,0,0,0,31000.0
2019-09-01,台北市中山區德惠街32號9樓之1,9,住宅,46,19.9045007238,1,1,2,1,1,0,22000.0
2019-08-30,台北市中山區中山北路一段121巷33號6樓之2,6,住宅,12,21.305075774730003,1,1,1,1,1,0,45000.0
2019-09-03,台北市信義區松平路１３５號九樓之３,9,住宅,32,61.05055222002,3,2,2,1,1,1,73000.0
2019-09-24,台北市內湖區民權東路六段123巷18號2樓,2,住宅,24,85.99470312708,1,0,2,0,1,1,70000.0
2019-09-10,台北市大安區四維路１７０巷３６號三樓之５,3,套房,14,12.24520044528,1,1,1,1,1,0,28000.0
2019-08-26,台北市士林區中山北路六段728巷9弄9號二樓,2,住宅,39,35.168651278860004,3,2,2,1,0,0,35000.0
2019-09-19,台北市北投區公館路402號3樓,3,住宅,43,48.62687676825,4,2,2,0,0,0,29500.0
2019-08-20,台北市北投區三合街一段82巷50弄35號5樓,5,住宅,5,86.57852814831,4,2,2,1,1,1,62000.0
2019-09-18,台北市大同區華陰街79號五樓之3,5,住宅,10,25.8940009416,2,1,1,1,1,0,55000.0
2019-06-16,台北市大同區市民大道一段211號13樓之13,13,住宅,14,19.71090071676,1,1,1,0,1,0,32000.0
2019-09-17,台北市中正區和平西路一段55巷22號六樓,6,住宅,13,32.933176197570006,3,2,2,1,1,0,58600.0
2019-09-28,台北市文山區興隆路三段207之6號2樓,2,住宅,39,28.35937603125,0,0,0,0,0,0,24000.0
2019-08-26,台北市松山區健康路418號9樓,9,住宅,12,74.68120271568,4,2,2,1,1,0,119438.0
2019-09-10,台北市信義區吳興街２８號三樓,3,住宅,51,30.603926112870003,2,2,2,1,0,0,34000.0
2019-09-11,台北市信義區基隆路二段56號2樓之2,2,住宅,28,40.10545145838,0,0,0,0,1,0,40000.0
2019-09-03,台北市中山區林森北路119巷20號3樓之1,3,住宅,17,6.29805022902,0,0,0,1,1,0,15000.0
2019-08-16,台北市中山區建國北路二段151巷26號3樓,3,住宅,44,56.91235206954,4,1,1,0,1,0,48000.0
2019-09-03,台北市中山區天祥路61巷8號7樓,7,住宅,9,24.87457590453,3,1,1,1,1,0,60000.0
2019-09-12,台北市中山區林森北路587號5樓之6,5,住宅,12,39.06787642065,1,1,1,1,1,0,55000.0
2019-09-28,台北市內湖區民權東路六段280巷10號2樓,2,住宅,9,105.89315385066,3,2,2,1,1,1,90000.0
2019-09-24,台北市中山區安東街16巷34之3號,1,住宅,40,31.5507511473,0,0,0,0,1,0,34400.0
2019-09-12,台北市內湖區新富街１３５號三樓,3,住宅,10,78.71352786231,2,2,2,1,1,1,80000.0
2019-09-11,台北市信義區基隆路一段400號9樓之3,9,住宅,16,16.80992561127,0,0,0,1,1,0,30650.0
2019-09-27,台北市信義區吳興街220巷27號5樓,5,住宅,35,41.212601498640005,4,2,2,1,1,0,33000.0
2019-08-23,台北市信義區光復南路567號4樓之15,4,套房,15,13.004475472889998,1,1,1,1,1,0,24000.0
2019-09-21,台北市大同區延平北路一段129號9樓之1,9,住宅,9,53.65745195118,4,2,2,0,1,0,40000.0
2019-08-07,台北市北投區實踐街72號1樓,1,住宅,53,31.38135114114,0,0,0,0,0,0,38000.0
2019-09-08,台北市大安區光復南路638號10樓,10,住宅,15,22.33055081202,2,1,1,1,1,0,38000.0
2019-09-03,台北市士林區天玉街26之1號4樓,4,住宅,28,73.01140265496,4,2,3,1,1,1,82000.0
2019-09-18,台北市士林區芝玉路一段222號14樓之2,14,住宅,15,56.08047703929,3,2,2,1,1,1,70000.0
2019-08-21,台北市大安區敦化南路二段38號10樓之1,10,住宅,35,61.6192522407,3,1,1,0,1,0,99898.0
2019-09-11,台北市大安區新生南路一段１４５巷１２號四樓,4,住宅,42,35.91885130614,3,2,2,1,0,0,32000.0
2019-09-11,台北市士林區福華路１２８巷１弄２１號二樓,2,住宅,52,22.22770080828,4,1,2,0,0,0,25000.0
2019-09-28,台北市士林區忠誠路一段147巷3號3樓,3,住宅,31,38.520351400740005,3,2,2,1,1,0,37000.0
2019-10-01,台北市北投區泉源路28號3樓之9,3,住宅,42,12.03042543747,1,0,1,1,1,0,10000.0
2019-10-01,台北市中山區新生北路二段68巷8號3樓之10,3,住宅,7,20.51555074602,2,1,1,1,1,0,48000.0
2019-08-13,台北市中山區林森北路575號11樓之1,11,住宅,46,55.97157703533,4,1,1,0,1,0,85000.0
2019-08-17,台北市中山區新生北路二段62巷16號7樓之5,7,住宅,7,37.06230134772,2,2,2,1,1,0,73000.0
2019-08-26,台北市內湖區成功路四段61巷55號5樓之1,5,住宅,6,32.921076197130006,2,1,1,1,1,0,50000.0
2019-08-26,台北市內湖區民權東路六段173號8樓,8,住宅,17,89.96652827151,4,2,3,1,1,1,85770.0
2019-10-02,台北市中山區復興北路66號10樓之4,10,住宅,44,9.867550358820004,1,0,1,1,1,0,13500.0
2019-09-09,台北市內湖區成功路四段167巷10弄8號2樓,2,住宅,43,34.887326268630005,3,2,1,1,0,0,26000.0
2019-09-11,台北市內湖區內湖路二段179巷52號4樓,4,住宅,42,31.36622614059,3,2,2,1,0,0,27000.0
2019-10-01,台北市中正區水源路127號6樓之1,6,住宅,44,14.093475512490002,1,1,1,1,1,0,12000.0
2019-10-01,台北市文山區景興路188號13樓之8,13,住宅,27,13.40680048752,1,0,1,1,1,0,14000.0
2019-08-23,台北市大同區承德路三段40號7樓,7,住宅,41,75.04420272888001,0,0,0,0,1,0,86000.0
2019-09-16,台北市大同區保安街４３號六樓之２,6,套房,26,12.01530043692,1,1,1,1,1,0,12000.0
2019-09-16,台北市萬華區東園街８６巷９號五樓,5,住宅,43,24.52065089166,3,1,1,1,0,0,20000.0
2019-10-01,台北市北投區杏林二路30之1號2樓,2,住宅,30,22.58465082126,2,1,2,1,1,0,17000.0
2019-09-26,台北市士林區中山北路六段290巷23弄9號4樓,4,住宅,38,38.42960139744,3,2,2,0,0,0,28500.0
2019-09-15,台北市北投區溫泉路３７巷２８號十三樓之１,13,套房,18,19.780475719290003,1,1,1,1,1,1,18000.0
2019-09-30,台北市大安區和平東路一段13號7樓,7,住宅,34,30.23790109956,1,1,2,0,1,0,29000.0
2019-10-02,台北市大安區信義路四段60之10號4樓,4,住宅,52,11.50710041844,2,1,1,1,1,0,14000.0
2019-09-25,台北市大安區安和路2段5號6樓之3,6,住宅,42,34.596926258070006,2,1,0,1,1,0,45000.0
2019-09-12,台北市士林區中山北路六段360號七樓,7,住宅,29,64.6442523507,4,2,2,1,1,0,70000.0
2019-10-01,台北市萬華區武成街63巷12弄2號2樓,2,住宅,59,5.66280020592,1,1,1,1,0,0,8300.0
2019-10-01,台北市萬華區內江街81巷1號2樓,2,住宅,53,11.33467541217,1,1,1,1,0,0,11280.0
2019-08-25,台北市大同區華陰街91號13樓之3,13,住宅,12,20.125325731830003,0,0,0,1,1,0,34056.0
2019-10-05,台北市萬華區西園路一段１２０號二樓,11,住宅,26,42.05355152922,2,2,2,1,1,0,37000.0
2019-09-19,台北市萬華區環河南路三段３６９號四樓,4,住宅,51,24.3815008866,2,2,1,1,0,0,14000.0
2019-09-23,台北市萬華區西寧南路127號十三樓之3,13,住宅,11,43.78082659203001,2,2,2,1,1,0,48533.0
2019-09-07,台北市文山區羅斯福路六段１５０巷２７號十二樓,12,住宅,6,29.291076065130007,2,2,1,1,1,0,34000.0
2019-09-17,台北市文山區指南路三段２６號七樓之５,7,套房,15,14.565375529650002,1,1,1,1,1,0,13500.0
2019-09-20,台北市松山區南京東路四段23號15樓之5,15,住宅,15,53.32772693919,3,2,2,1,1,1,75000.0
2019-09-18,台北市南港區福德街３７３巷３９號十三樓,13,住宅,25,38.73512640855,2,2,1,1,1,0,27000.0
2019-09-17,台北市南港區南港路三段２０５號三樓之１,3,住宅,36,30.71585111694,3,2,2,1,0,0,26000.0
2019-09-26,台北市中山區八德路二段315號七樓,7,住宅,5,40.82540148456,2,2,1,1,1,1,50000.0
2019-09-29,台北市中山區中山北路一段83巷32號七樓之1,7,住宅,15,24.39057588693,1,1,1,1,1,0,45000.0
2019-09-17,台北市中山區新生北路二段62巷12號九樓之2,9,住宅,7,49.1260017864,3,2,2,1,1,0,90000.0
2019-09-12,台北市中山區中山北路2段93巷8號10樓之3,10,住宅,18,12.89255046882,1,2,1,1,1,0,30000.0
2019-08-26,台北市中山區復興北路28號10樓之3,10,住宅,12,106.72502888091,3,2,3,1,1,0,158000.0
2019-09-18,台北市中山區中山北路一段83巷5號8樓之10,8,住宅,45,12.05765043846,0,0,0,1,1,0,20000.0
2019-09-13,台北市中山區林森北路119巷20號3樓之7,3,住宅,17,7.008925254870001,0,0,0,1,1,0,15000.0
2019-09-17,台北市中山區松江路28號10樓之7,10,住宅,36,12.10605044022,0,0,0,1,1,0,13500.0
2019-09-19,台北市中山區新生北路二段68巷8號6樓之6,6,住宅,7,37.45857636213,2,1,1,1,1,0,52000.0
2019-08-21,台北市中山區南京東路二段108號6樓之21,6,住宅,13,27.43070099748,1,2,1,1,1,0,50000.0
2019-08-26,台北市中山區新生北路二段68巷9號7樓之8,7,住宅,15,22.51205081862,2,2,1,1,1,0,58000.0
2019-09-20,台北市內湖區瑞光路７６巷６０號五樓之１,5,住宅,26,18.74592568167,2,1,1,1,0,0,18000.0
2019-09-24,台北市內湖區新豐街82號6樓,6,住宅,8,37.92140137896,1,1,1,1,1,1,45000.0
2019-09-18,台北市中山區新生北路二段62巷12號2樓,2,住宅,7,50.31180182952,3,2,2,1,1,0,125000.0
2019-09-15,台北市中山區南京東路二段108號十二樓之17,12,住宅,13,14.72267553537,1,1,1,1,1,0,40000.0
2019-09-20,台北市中山區松江路426號11樓之3,11,住宅,17,61.26835222794001,2,2,2,1,1,1,115000.0
2019-09-18,台北市中山區民權西路9巷22號四樓之2,4,住宅,11,19.57780071192,1,1,1,1,1,0,41000.0
2019-09-18,台北市中山區南京東路二段108號十六樓之5,16,住宅,13,14.38387552305,1,1,1,1,1,0,32000.0
2019-09-08,台北市內湖區康寧路1段173巷7號5樓,5,住宅,24,31.8230011572,3,2,2,0,1,0,38500.0
2019-08-24,台北市信義區忠孝東路五段236巷27弄8號5樓,5,套房,30,23.29552584711,1,1,1,1,1,0,78000.0
2019-10-07,台北市信義區忠孝東路五段101號11樓,11,住宅,9,30.53435111034,1,2,2,1,1,0,102168.0
2019-09-12,台北市南港區經貿二路245號6樓之2,6,住宅,10,22.84177583061,2,1,1,1,1,0,26000.0
2019-09-27,台北市中正區信義路二段261號3樓之6,3,套房,5,13.310000484,1,1,1,1,1,0,35000.0
2019-09-25,台北市士林區天玉街38巷7號7樓,7,住宅,38,43.904851596540006,3,2,2,1,1,0,51000.0
2019-09-25,台北市士林區中山北路7段14巷29之13號6樓,6,住宅,45,48.73577677221,4,2,2,1,1,0,63000.0
2019-10-02,台北市士林區中山北路7段14巷19號5樓,5,住宅,35,44.42212661535,4,2,2,1,1,0,70000.0
2019-09-22,台北市士林區磺溪街３５巷１２號四樓,4,住宅,35,33.56540122056,3,2,2,1,0,0,29500.0
2019-10-06,台北市北投區文林北路44號2樓,2,住宅,44,20.38245074118,2,2,1,1,0,0,19500.0
2019-09-15,台北市士林區德行西路111巷2弄4號5樓,5,住宅,44,30.782401119360003,3,2,2,0,0,0,35000.0
2019-09-12,台北市北投區石牌路二段315巷28弄16號7樓,7,套房,15,12.27545044638,1,1,1,1,1,0,20000.0
2019-09-14,台北市北投區文林北路268號3樓,3,住宅,52,28.283751028500003,3,2,2,1,0,0,22000.0
2019-09-19,台北市大安區大安路一段１６巷１３號八樓之８,8,套房,24,12.42367545177,1,1,1,1,1,0,21000.0
2019-09-25,台北市大安區仁愛路四段27巷28弄1號4樓之1,4,住宅,40,54.05070196548,3,2,2,1,1,0,46500.0
2019-09-26,台北市大安區光復南路688號6樓,6,住宅,6,32.06802616611,2,1,1,1,1,0,58000.0
2019-09-21,台北市大安區信義路二段52號9樓之6,9,住宅,13,11.22880040832,1,1,1,1,1,0,25000.0
2019-09-21,台北市士林區克強路15巷7號,1,住宅,45,36.33932632143,0,0,0,0,0,0,35000.0
2019-08-29,台北市北投區中和街20巷76號,1,住宅,43,36.06707631153,3,2,1,1,0,0,18000.0
2019-08-30,台北市北投區自強街5巷102弄7號2樓,2,住宅,50,28.09015102146,3,2,1,1,0,0,18000.0
2019-08-13,台北市北投區裕民六路125號3樓,3,住宅,8,44.31927661161,2,2,2,1,1,0,80000.0
2019-09-18,台北市信義區基隆路一段101巷5之1號3樓,3,住宅,16,41.31545150238,2,2,1,1,1,1,50000.0
2019-10-03,台北市中山區中山北路一段121巷33號十二樓之1,12,住宅,12,20.80897575669,1,1,1,1,1,0,42000.0
2019-10-05,台北市中山區民權東路一段72號六樓之7,6,住宅,45,13.77282550083,0,0,0,0,1,0,16000.0
2019-09-12,台北市中山區中山北路二段115巷22號11樓之1,11,住宅,33,36.39982632363,3,2,2,1,1,0,48000.0
2019-09-15,台北市中山區龍江路269號7樓,7,住宅,14,28.150651023660004,2,2,1,1,1,0,45000.0
2019-09-19,台北市中山區北安路829號5樓之8,5,套房,13,13.24345048158,1,1,1,1,1,0,26000.0
2019-09-20,台北市內湖區成功路二段179號4樓,4,住宅,43,26.13902595051,2,1,1,1,0,0,22000.0
2019-09-12,台北市中山區長春路88號11樓之13,11,住宅,43,6.8062502475,0,0,0,1,1,0,10000.0
2019-10-08,台北市中山區新生北路三段21號十二樓之1,12,住宅,17,13.79097550149,2,2,1,1,1,0,27000.0
2019-10-07,台北市中山區復興北路86號3樓,3,住宅,45,30.785426119470003,3,1,2,1,1,0,37000.0
2019-09-18,台北市信義區光復南路４２１巷６號二樓之１,2,套房,5,14.743850536139998,1,1,1,1,1,0,30000.0
2019-10-09,台北市信義區景雲街7之1號2樓,2,住宅,15,28.24140102696,2,2,1,1,1,0,35000.0
2019-10-08,台北市松山區復興北路333號4樓之1,4,住宅,40,40.2627514641,0,0,0,0,1,0,48000.0
2019-09-24,台北市信義區永吉路１８７巷６號,1,住宅,46,23.07772583919,3,2,1,1,0,0,27000.0
2019-09-20,台北市士林區天母西路41巷5號4樓,4,住宅,37,51.96950188980001,4,1,2,1,1,1,35000.0
2019-09-23,台北市士林區菁山路55之5號3樓,3,住宅,14,75.26502773691,3,2,2,1,1,1,64000.0
2019-10-08,台北市士林區基河路30號4樓之1,4,住宅,25,18.49485067254,1,1,1,1,1,0,30000.0
2019-09-23,台北市士林區通河街３２５巷１８之４號,4,套房,53,8.91770032428,1,0,1,1,1,0,9000.0
2019-09-20,台北市北投區石牌路二段３２５巷１０號二樓,2,住宅,11,59.45335216194001,3,2,2,1,1,1,48000.0
2019-09-21,台北市北投區民族街８０號,3,住宅,51,29.41812606975,3,2,2,1,0,0,16000.0
2019-09-16,台北市大安區和平東路1段199巷7號6樓之2,6,住宅,17,20.45807574393,2,1,1,1,1,0,38000.0
2019-10-08,台北市大安區大安路一段176巷29號3樓,3,住宅,34,46.72415169906,4,2,2,1,1,0,60000.0
2019-09-23,台北市大安區瑞安街208巷39號2樓之5,2,住宅,8,19.57780071192,2,1,1,1,1,0,41475.0
2019-09-30,台北市中正區南昌路一段108號14樓之2,14,住宅,14,25.31017592037,2,1,1,1,1,0,34000.0
2019-09-28,台北市大同區雙連街75號2樓之2,2,住宅,6,60.191452188780005,3,2,2,1,1,1,75000.0
2019-09-23,台北市信義區信義路五段117號11樓,11,住宅,14,46.74230169972,1,1,2,1,1,1,48000.0
2019-09-28,台北市信義區基隆路二段131之8號8樓,8,住宅,45,23.89145086878,2,2,1,1,1,0,33000.0
2019-09-29,台北市中山區中山北路一段53巷3號3樓之5,3,住宅,24,25.90307594193,2,1,1,1,1,0,36800.0
2019-09-30,台北市中山區新生北路二段68巷8號12樓之1,12,住宅,7,25.113550913220003,2,1,1,1,1,0,67000.0
2019-10-03,台北市中山區新生北路三段56巷1號7樓之4,7,住宅,42,13.022625473550002,1,1,1,1,1,0,22000.0
2019-09-26,台北市中山區南京東路一段132巷18號4樓之1,4,住宅,11,23.625250859100003,2,2,2,1,1,0,53000.0
2019-09-15,台北市中山區長安東路一段20號2樓之3,2,住宅,16,16.416675596970002,1,1,1,1,1,0,29000.0
2019-09-25,台北市中山區林森北路107巷82號4樓之7,4,住宅,29,11.99412543615,0,0,0,1,1,0,14000.0
2019-09-25,台北市中山區林森北路409號11樓之2,11,住宅,41,19.623175713570003,0,0,0,1,1,0,26000.0
2019-09-28,台北市萬華區和平西路三段85號6樓之6,6,住宅,12,23.640375859650003,1,1,1,1,1,0,30000.0
2019-09-23,台北市萬華區莒光路223號2樓,2,住宅,41,11.4345004158,0,0,0,1,1,0,12500.0
2019-09-23,台北市大同區民權西路216號8樓,8,住宅,44,28.61045104038,0,0,0,1,1,0,33000.0
2019-09-23,台北市大安區安和路二段189巷17號2樓,2,住宅,54,27.76345100958,3,2,1,1,0,0,35000.0
2019-09-24,台北市中正區和平西路一段55巷11號5樓,5,住宅,40,16.093000585200002,2,1,1,1,0,0,18000.0
2019-10-11,台北市中正區林森南路137號10樓,10,住宅,23,16.940000616,1,1,1,1,1,0,20000.0
2019-09-15,台北市文山區羅斯福路六段１４６號十二樓之５,12,套房,6,20.055750729300005,1,0,1,1,1,0,26500.0
2019-10-03,台北市文山區興隆路二段220巷29號2樓,2,住宅,49,40.36560146784,3,2,2,1,0,0,28000.0
2019-09-26,台北市松山區民權東路三段１０３巷５弄７號三樓,3,住宅,38,25.37067592257,3,2,1,1,0,0,29000.0
2019-09-26,台北市內湖區新富街５８號四樓,4,住宅,8,82.51595300058,3,2,2,1,1,0,111000.0
2019-09-29,台北市北投區大業路452巷6號12樓之8,12,住宅,27,34.2732512463,3,2,2,1,1,0,40000.0
2019-10-14,台北市士林區福港街91號2樓,2,住宅,38,24.55997589309,3,2,1,1,0,0,18000.0
2019-09-28,台北市士林區中山北路六段47號十一樓,11,住宅,11,49.15020178728,3,1,2,1,1,0,96000.0
2019-09-26,台北市士林區德行東路３３０號五樓,5,住宅,41,34.5152512551,3,2,2,1,0,0,30000.0
2019-09-26,台北市北投區實踐街４１號,4,住宅,53,27.951001016400003,3,2,2,1,0,0,26000.0
2019-09-24,台北市士林區中山北路7段82巷10弄10號3樓,3,住宅,29,43.64470158708,3,2,2,1,1,0,33000.0
2019-09-27,台北市士林區士東路278號2樓,2,住宅,15,15.09172554879,1,0,1,1,1,0,16000.0
2019-10-08,台北市大安區仁愛路四段345巷15弄7號1樓,1,住宅,37,28.186951024980004,2,2,1,1,1,0,33000.0
2019-10-04,台北市大安區安和路二段69巷18號3樓之6,3,住宅,18,12.91977546981,1,1,1,1,1,0,26000.0
2019-09-30,台北市中山區民生東路一段39號5樓,5,住宅,29,51.05292685647,0,0,0,0,1,0,68000.0
2019-09-16,台北市中山區建國北路一段55號3樓,3,套房,16,14.22052551711,1,1,1,1,1,0,21000.0
2019-09-06,台北市內湖區安泰街53巷1號4樓,4,住宅,39,36.13362631395,3,2,2,1,0,0,18000.0
2019-10-08,台北市中山區新生北路二段68巷8號8樓之1,8,住宅,7,25.113550913220003,2,1,1,1,1,0,53000.0
2019-09-28,台北市中山區撫順街15號10樓之1,10,住宅,12,34.09477623981,2,2,1,1,1,0,47000.0
2019-09-05,台北市信義區信義路五段91巷12弄1號5樓之6,5,套房,15,29.944476088890003,1,1,1,1,1,0,39261.0
2019-10-11,台北市大同區重慶北路二段45號九樓之1,9,套房,40,7.716775280609999,1,1,1,1,1,0,11500.0
2019-10-01,台北市大同區雙連街７９號三樓之２,3,住宅,6,59.97062718075,4,2,2,1,1,0,80000.0
2019-10-15,台北市大同區長安西路287號11樓之7,11,住宅,46,9.75865035486,1,0,1,1,1,0,10000.0
2019-10-15,台北市萬華區東園街66巷125號五樓,5,住宅,44,27.64245100518,4,2,1,0,0,0,12000.0
2019-10-04,台北市松山區南京東路五段415號12樓之3,12,住宅,6,15.79957557453,1,1,1,1,1,0,32000.0
2019-10-10,台北市松山區八德路四段232號5樓,5,住宅,36,45.598851658140006,4,2,2,1,1,0,39000.0
2019-10-07,台北市內湖區成功路四段61巷53號2樓,2,住宅,6,61.02937721925,3,2,2,1,1,1,65000.0
2019-10-02,台北市內湖區民權東路六段123巷34弄15號6樓,6,住宅,21,64.69870235268,3,2,2,1,1,1,63000.0
2019-10-03,台北市中山區北安路789號11樓之5,11,住宅,10,22.67842582467,2,1,2,1,1,1,42000.0
2019-10-09,台北市內湖區新豐街80號6樓,6,住宅,8,49.44665179806,2,2,1,1,1,1,45000.0
2019-09-27,台北市內湖區民權東路六段１５０號十一樓之２,11,住宅,14,58.61240213136,3,2,2,1,1,1,45000.0
2019-09-25,台北市中山區松江路４００號三樓,3,住宅,49,26.87107597713,0,1,1,1,0,0,26000.0
2019-09-25,台北市中山區錦州街２３１巷２９號,1,住宅,53,26.81360097504,3,2,2,1,0,0,34000.0
2019-09-25,台北市中山區中山北路二段４５巷７號四樓之２,4,套房,44,13.0680004752,1,1,1,1,1,0,18000.0
2019-09-30,台北市北投區福美路２１７號十樓,10,住宅,6,57.46290208956,3,2,2,1,1,1,32500.0
2019-10-15,台北市北投區中和街497號二樓,2,住宅,41,29.971701089880003,3,1,1,1,0,0,18000.0
2019-09-18,台北市士林區忠誠路二段21巷16號3樓,3,住宅,14,60.40622719659,3,2,2,1,1,0,90000.0
2019-10-15,台北市士林區福港街224巷8號3樓,3,住宅,45,22.16720080608,2,2,1,1,0,0,17000.0
2019-09-30,台北市大安區大安路1段16巷13號2樓之5,2,住宅,24,11.53130041932,1,0,1,1,1,0,18000.0
2019-10-07,台北市大安區四維路192巷6之2號3樓,3,住宅,54,31.816951156980004,2,3,2,0,1,0,33000.0
2019-10-09,台北市大安區復興南路一段107巷5弄1號七樓,7,住宅,7,72.98720265408001,4,2,3,1,1,0,113500.0
2019-09-20,台北市中山區中山北路二段93巷8號4樓之11,4,套房,18,12.89255046882,1,1,1,1,1,0,31000.0
2019-09-30,台北市中山區中山北路三段2號13樓之1,13,住宅,9,65.34302737611,3,2,2,1,1,0,100000.0
2019-08-31,台北市中山區南京東路二段108號十三樓之13,13,住宅,13,16.785725610390003,1,1,1,1,1,0,38000.0
2019-08-31,台北市中山區林森北路63號5樓之1,5,住宅,16,60.76317720957,3,2,2,1,1,0,92000.0
2019-10-07,台北市信義區基隆路1段127號8樓,8,住宅,42,41.13395149578,0,0,0,0,1,0,36000.0
2019-10-15,台北市信義區基隆路二段39巷14號1樓,1,住宅,36,53.4215019426,3,2,2,0,0,0,77193.0
2019-09-25,台北市大同區南京西路80號11樓之2,11,住宅,15,38.27835139194,3,2,2,1,1,0,70000.0
2019-10-10,台北市中正區杭州南路一段18巷11號9樓,9,住宅,25,34.572726257190006,3,2,2,0,1,0,51084.0
2019-09-30,台北市大同區市民大道一段201號9樓之3,9,住宅,14,25.186150915860004,2,2,1,1,1,0,42000.0
2019-10-01,台北市大同區南京西路25巷32號7樓之1,7,住宅,15,30.16832609703,2,2,1,1,1,0,48000.0
2019-09-02,台北市中山區松江路313巷17號,1,住宅,43,24.708200898480005,1,1,1,0,1,0,31000.0
2019-09-23,台北市內湖區康寧路3段70巷85號2樓,2,住宅,16,43.13045156838,3,2,2,1,1,0,46000.0
2019-05-01,台北市中山區林森北路587號5樓之2,5,住宅,12,27.20685098934,1,2,1,1,1,0,58000.0
2019-09-25,台北市中山區南京東路二段108號18樓之17,18,住宅,13,13.87265050446,1,1,1,1,1,0,34000.0
