date,address,floor,type,age,twPing,bedRoom,livingRoom,restRoom,furniture,elevator,parkingSpace,price
2020-03-28,新北市汐止區南興路７２號八樓之５,8,住宅,11,40.852626485550005,3,2,2,1,1,0,28000.0
2020-03-30,新北市汐止區福德一路１１８號七樓之７,7,套房,16,12.25730044572,1,1,1,1,1,0,12000.0
2020-03-30,新北市汐止區長江街１０１之５號３樓,3,住宅,28,33.25080120912,3,2,2,1,1,0,18284.0
2020-03-27,新北市汐止區大同路二段２８５號２１樓之７,21,住宅,28,23.58592585767,2,2,1,1,1,0,18500.0
2020-03-27,新北市樹林區大安路３２３巷１１號四樓,4,住宅,31,44.09542660347,3,2,2,1,0,1,20000.0
2020-03-04,新北市板橋區民生路三段319號32樓之4,32,住宅,17,21.86772579519,2,1,2,1,1,0,20000.0
2020-03-05,新北市三重區溪尾街42之2號3樓,3,住宅,15,36.28790131956,2,2,2,0,1,1,25000.0
2020-03-27,新北市中和區圓通路３３５巷３３弄５５號八樓,8,住宅,17,50.31482682963001,3,2,2,1,1,1,32000.0
2020-03-31,新北市永和區國中路１１４號四樓,4,住宅,52,25.0470009108,1,2,1,1,0,0,19000.0
2020-03-26,新北市三重區福和街1號4樓之2,4,住宅,26,10.53305038302,1,0,1,1,1,0,10000.0
2020-04-13,新北市汐止區莊敬街128號22樓-1,22,住宅,28,9.70722535299,1,0,1,1,1,0,11300.0
2020-03-27,新北市土城區學府路一段９８巷８號二樓,2,住宅,30,29.118651058860003,2,1,1,1,1,0,12000.0
2020-03-31,新北市土城區裕生路８３巷１６弄３號二樓,2,住宅,40,25.17102591531,3,1,1,1,0,0,14500.0
2020-04-01,新北市板橋區光環路二段３６號十九樓,19,住宅,5,31.05465112926,2,2,2,1,1,0,25000.0
2020-03-31,新北市新莊區新泰路４７６巷１１號十樓,10,住宅,32,59.75282717283,3,2,2,1,1,1,28000.0
2020-04-01,新北市泰山區福德街３６號,1,住宅,42,20.6607507513,3,1,1,1,0,0,18000.0
2020-04-01,新北市新莊區新泰路２５５巷５號二樓,2,住宅,35,29.65407607833,3,2,2,1,0,0,17000.0
2020-04-05,新北市新莊區民安路１８８巷８弄５號十樓之十八,10,住宅,22,17.590375639650002,3,2,1,1,1,0,18000.0
2020-04-07,新北市新莊區新北大道三段65號15樓之6,15,住宅,17,50.3360018304,3,2,2,1,1,1,27000.0
2020-04-02,新北市板橋區民生路三段６號二十二樓之３,22,住宅,23,25.52797592829,2,1,1,1,1,0,25000.0
2020-03-30,新北市板橋區文化路二段１８２巷３弄４６之３號九樓,9,套房,9,29.7055010802,1,0,1,1,1,0,29000.0
2020-04-02,新北市汐止區新台五路一段１５６之１號５樓,5,住宅,42,23.346950848980004,3,2,1,1,0,0,14500.0
2020-04-05,新北市中和區中興街２１８號八樓之六,8,住宅,15,30.304451101980003,2,1,1,1,1,1,28500.0
2020-03-17,新北市三峽區民生街27巷16號2樓之2,2,套房,27,7.0210252553100005,1,0,1,1,1,0,5800.0
2020-03-20,新北市土城區清水路85巷3弄21號2樓,2,住宅,42,23.144275841610003,2,1,1,1,0,0,10000.0
2020-03-21,新北市土城區南天母路39之1號4樓,4,住宅,29,19.96802572611,2,2,1,1,1,0,12000.0
2020-04-06,新北市板橋區大觀路二段１５０巷７１之３號,4,住宅,45,33.202401207360005,3,2,1,0,0,0,11000.0
2020-03-30,新北市新莊區福前街２４７號十一樓,11,住宅,11,54.95820199848001,3,2,2,1,1,0,35000.0
2020-04-15,新北市新莊區昌德街89號7樓,7,住宅,8,77.86047783129,3,2,3,1,1,1,38000.0
2020-03-26,新北市永和區中山路一段220號5樓之1,5,套房,22,15.04332554703,1,0,1,0,1,0,20500.0
2020-03-15,新北市中和區景平路425之1號13樓,13,住宅,7,39.01040141856,3,1,2,0,1,0,34500.0
2020-04-06,新北市中和區中和路３９０號十樓之十六,10,套房,17,21.302050774620003,1,1,1,1,1,0,24000.0
2020-04-07,新北市中和區連城路319巷10之1號,2,住宅,44,25.01372590959,3,1,1,1,0,0,16000.0
2020-04-07,新北市三峽區學勤路１９２之５號六樓,6,住宅,16,43.51160158224,2,2,1,1,1,1,22000.0
2020-04-20,新北市汐止區龍安路28巷26號24樓-3,24,住宅,26,22.98092583567,2,2,1,1,1,0,20000.0
2020-03-23,新北市中和區水源路3巷5之1號,2,住宅,46,22.941600834240003,3,2,1,1,0,0,18000.0
2020-04-17,新北市中和區大勇街31巷19號1樓,1,住宅,49,3.630000132,1,0,1,1,0,0,6000.0
2020-04-16,新北市中和區景德街23號13樓之12,13,住宅,6,11.80657542933,1,1,1,1,1,0,14700.0
2020-03-24,新北市八里區龍米路2段28號14樓之5,14,住宅,15,21.710425789470005,2,2,1,1,1,0,16500.0
2020-04-18,新北市新莊區化成路205號之48二樓,2,住宅,28,41.97792652646999,4,2,2,1,1,0,25000.0
2020-04-02,新北市林口區文化三路二段３５６號二十九樓,29,住宅,9,97.10552853111,3,2,2,1,1,1,62000.0
2020-03-27,新北市五股區民義路一段22巷1號2樓,2,住宅,32,34.30652624751,3,1,2,1,0,0,15000.0
2020-04-13,新北市板橋區長安街232之2號,3,住宅,45,22.127875804650003,3,2,1,1,0,0,15000.0
2020-03-26,新北市板橋區四川路2段123號19樓之8,19,住宅,23,16.15955058762,2,2,1,1,1,0,20200.0
2020-03-30,新北市土城區永豐路13巷37號2樓,2,住宅,5,27.04955098362,2,1,1,1,1,0,16200.0
2020-04-13,新北市淡水區民族路73之2號,1,住宅,36,30.09572609439,3,2,2,1,0,0,17000.0
2020-03-30,新北市淡水區新興街49號九樓,9,住宅,26,52.61080191312001,4,2,2,1,1,0,19700.0
2020-04-20,新北市中和區景安路208巷44之2號,3,住宅,47,25.63385093214,3,2,1,0,0,0,27000.0
2020-03-30,新北市中和區景新街496巷39弄7之4號,5,住宅,42,23.84305086702,3,2,2,1,0,0,10000.0
2020-03-26,新北市新店區順安街79號4樓,4,套房,29,13.1285004774,1,1,1,1,1,0,12000.0
2020-03-28,新北市新店區中興路3段326號4樓,4,住宅,41,22.436425815870003,2,1,1,1,0,0,17000.0
2020-03-25,新北市三重區仁愛街53巷13號3樓,3,住宅,39,13.987600508640002,2,1,1,1,0,0,13000.0
2020-04-21,新北市三重區興華街97號1樓,1,住宅,42,25.107500913000003,0,0,0,0,0,0,25000.0
2020-03-19,新北市板橋區長江路二段298號12樓,12,住宅,4,56.75202706371001,3,2,2,0,1,1,42000.0
2020-02-26,新北市板橋區中山路二段195號2樓,2,住宅,54,23.33182584843,0,0,0,0,0,0,18000.0
2020-04-19,新北市新店區中央路181號9樓之3,9,住宅,11,70.98465258126001,2,2,2,1,1,1,55000.0
2020-04-17,新北市淡水區新春街85巷25弄87號三樓,3,住宅,10,54.861401994960005,3,2,2,1,1,1,22000.0
2020-04-24,新北市淡水區淡金路38巷33號9樓之29,9,套房,14,18.162100660440004,1,1,1,1,1,0,13547.0
2020-04-08,新北市泰山區明志路三段145巷5弄5號,1,住宅,37,29.9172510879,3,2,2,1,0,0,18000.0
2020-04-01,新北市新莊區新北大道四段185號11樓之3,11,住宅,10,63.543152310660005,0,0,0,0,1,0,50000.0
2020-03-28,新北市中和區明禮街35號12樓,12,住宅,18,26.93460097944,2,1,1,0,1,0,28000.0
2020-04-04,新北市中和區中和路362之4號10樓,10,住宅,31,13.01657547333,1,0,1,0,1,0,12000.0
2020-03-28,新北市中和區中原二街125號10樓,10,住宅,10,63.08335229394,3,1,2,0,1,0,35500.0
2020-04-05,新北市永和區成功路2段227號18樓,18,住宅,17,36.47847632649,2,1,2,0,1,0,36000.0
2020-04-08,新北市中和區景平路150號9樓之5,9,住宅,10,26.18742595227,2,1,2,0,1,0,23500.0
2020-04-12,新北市永和區永和路二段6號10樓,10,住宅,24,45.80455166562,3,1,2,0,1,0,29339.0
2020-04-09,新北市中和區中正路１４０號十五樓,15,住宅,14,26.60790096756,2,2,1,1,1,0,22000.0
2020-04-09,新北市永和區民樂街３８號五樓,5,住宅,40,33.05417620197,3,2,2,1,0,0,21000.0
2020-04-09,新北市三重區捷運路１１號十三樓之二,13,住宅,26,45.29030164692,4,2,2,1,1,0,32000.0
2020-04-19,新北市三重區中正南路135號12樓,12,住宅,20,35.39855128722,3,2,2,1,1,0,30000.0
2020-04-10,新北市三重區朝陽街６０號九樓,9,住宅,4,26.61092596767,2,1,1,1,1,0,27000.0
2020-03-25,新北市泰山區民生路14巷9號,1,住宅,27,22.605825822030003,0,0,0,0,1,0,21000.0
2020-04-11,新北市淡水區新市五路三段３９０號六樓,6,套房,4,17.35442563107,1,0,1,1,1,0,9000.0
2020-04-18,新北市新莊區中原東路103號11樓,11,住宅,7,37.68545137038,2,2,1,1,1,1,29000.0
2020-04-09,新北市林口區忠孝路１１７號六樓,6,住宅,4,54.08397696669,3,2,2,1,1,1,27906.0
2020-04-11,新北市新莊區建興街５５號五樓,5,住宅,10,61.50430223652,4,2,2,1,1,0,40000.0
2020-04-11,新北市板橋區民生路三段６６號九樓之２,9,住宅,23,22.92647583369,2,1,1,1,1,0,28000.0
2020-04-25,新北市汐止區龍安路202巷48號4樓 A室,4,套房,39,6.279900228360001,1,0,1,1,1,0,9500.0
2020-04-11,新北市永和區竹林路１１９巷２２弄３９號三樓,3,住宅,45,29.47560107184,3,2,2,1,0,0,21000.0
2020-04-10,新北市永和區福和路３８５號四樓之四,4,套房,27,9.24137533605,1,0,1,1,1,0,13000.0
2020-04-12,新北市中和區安樂路５號八樓之二,8,套房,27,15.841925576070002,1,1,1,1,1,0,15000.0
2020-04-05,新北市中和區華新街127之3號,4,住宅,54,14.244725517990002,2,1,1,1,0,0,13000.0
2020-04-10,新北市樹林區中山路1段306巷62號3樓,3,住宅,41,27.04955098362,3,2,2,1,0,0,13500.0
2020-04-10,新北市新店區文化路23之3號8樓,8,住宅,14,18.277050664620003,1,1,1,1,1,0,19000.0
2020-03-24,新北市三重區溪尾街42之2號3樓,3,住宅,15,36.28790131956,2,2,2,0,1,1,25000.0
2020-04-24,新北市板橋區文化路一段362號二十三樓之3,23,住宅,13,66.54092741967001,4,2,3,1,1,0,58000.0
2020-04-12,新北市板橋區合宜一路９號四樓之２,4,住宅,5,54.229176971970006,3,2,2,1,1,1,24000.0
2020-03-31,新北市板橋區中山路2段465巷37之2號,3,住宅,50,27.814876011450004,3,2,1,1,0,0,17000.0
2020-04-11,新北市泰山區仁德路５６號七樓,7,住宅,18,27.684801006720004,3,2,2,1,1,0,17800.0
2020-04-01,新北市新莊區和興街19號3樓,3,住宅,47,29.02487605545,2,1,1,1,0,0,17000.0
2020-04-09,新北市新莊區天泉二街24巷12號5樓,5,住宅,36,29.9777510901,2,2,2,1,0,0,15000.0
2020-04-10,新北市泰山區辭修路36巷8弄29號3樓,3,住宅,40,26.64420096888,2,1,2,1,0,0,13500.0
2020-04-11,新北市淡水區新市一路三段１８號十四樓,14,住宅,13,44.13172660479,2,2,2,1,1,1,18500.0
2020-04-19,新北市八里區文昌七街179號4樓,4,住宅,4,49.567651802460006,3,2,2,1,1,1,20000.0
2020-04-14,新北市新莊區榮華路一段６０號四樓之三,4,住宅,7,51.56717687517,3,2,2,1,1,1,33000.0
2020-03-11,新北市新莊區中正路新建巷28弄27之3號,4,住宅,42,25.66712593335,3,2,1,1,0,0,14000.0
2020-04-14,新北市新莊區自強街70巷3弄5之1號,2,住宅,48,9.982500363,1,1,1,1,0,0,12000.0
2020-04-15,新北市土城區民族街62巷1號3樓,3,住宅,39,21.01165076406,3,2,1,1,0,0,11000.0
2020-04-20,新北市土城區延和路146巷14弄3號3樓,3,住宅,29,23.85817586757,2,2,1,1,1,0,17800.0
2020-04-10,新北市汐止區祥雲街21號3樓,3,住宅,42,21.42305077902,2,1,1,1,0,0,10500.0
2020-04-16,新北市汐止區水源路2段28號13樓,13,住宅,25,42.912651560460006,3,2,2,1,1,0,16200.0
2020-04-05,新北市汐止區福德一路２０１巷１２號七樓之７,7,套房,29,9.59530034892,1,0,1,1,1,0,11336.0
2020-04-07,新北市三重區後竹圍街175巷32弄12號2樓,2,住宅,16,16.51347560049,1,1,1,1,1,0,18000.0
2020-04-21,新北市三重區正義南路43號2樓,2,住宅,52,15.08567554857,2,1,1,1,0,0,14000.0
2020-04-28,新北市三重區重陽路二段52巷74弄7號四樓,4,住宅,46,25.712500935,3,2,1,1,0,0,17000.0
2020-04-17,新北市三重區重新路五段515-1號15樓,15,住宅,13,14.50790052756,1,1,1,1,1,0,14500.0
2020-04-14,新北市新店區安德街71巷14號9樓,9,住宅,31,22.84480083072,2,1,1,1,1,0,12000.0
2020-03-13,新北市新店區中興路三段２０９號五樓,5,住宅,35,31.04860112904,3,1,2,1,0,0,19000.0
2020-04-02,新北市新店區北新路二段193號6樓,6,住宅,35,39.28567642857,3,2,2,1,1,0,38800.0
2020-04-27,新北市新店區中央三街119號17樓,17,住宅,23,53.79660195624,3,2,2,1,1,0,30000.0
2020-04-05,新北市新店區安祥路145巷21號2樓,2,住宅,31,31.75342615467,3,2,2,1,0,0,10000.0
2020-04-20,新北市新店區安泰路26號3樓,3,住宅,8,45.27517664637001,3,2,2,1,1,1,21500.0
2020-04-16,新北市中和區中和路２１７巷２２號,1,住宅,46,29.89305108702,3,2,1,1,0,0,20000.0
2020-04-27,新北市永和區安樂路310號12樓之5,12,住宅,28,37.3890013596,2,1,1,1,1,0,27000.0
2020-04-20,新北市中和區南山路236巷53之1號10樓,10,住宅,28,22.605825822030003,2,1,1,1,1,0,20000.0
2020-04-29,新北市三重區重新路四段168號五樓之二,5,住宅,16,22.306350811140003,2,1,1,1,1,0,22000.0
2020-04-15,新北市蘆洲區光榮路６１巷１１號,1,住宅,17,32.95435119834,1,1,2,0,1,0,30000.0
2020-04-17,新北市中和區中山路二段１５６號十三樓之１,13,套房,6,17.89287565065,1,1,1,1,1,0,22000.0
2020-04-18,新北市中和區民利街６８巷５弄３６號六樓,6,住宅,19,24.15765087846,2,2,1,1,1,0,21000.0
2020-04-17,新北市永和區環河西路二段２４５之２號四樓,4,住宅,21,22.35172581279,2,1,1,1,1,0,19500.0
2020-04-19,新北市淡水區淡金路３８巷３３號七樓之２３,7,套房,14,13.5217504917,1,1,1,1,1,0,10500.0
2020-04-15,新北市新莊區中正路３７０號十八樓,18,住宅,9,22.01292580047,2,1,1,1,1,0,25000.0
2020-04-17,新北市板橋區民生路一段３５號四樓之二,4,住宅,28,32.164826169630004,3,2,2,1,1,0,22000.0
2020-04-19,新北市淡水區中山北路二段１８９巷１５弄２號五樓,5,住宅,7,41.7752515191,2,2,1,1,1,1,17000.0
2020-04-14,新北市淡水區沙崙路一段25號十樓,10,住宅,4,54.53772698319,3,2,2,1,1,1,19000.0
2020-04-22,新北市淡水區新市三路二段295號8樓,8,住宅,5,45.00595163658,3,2,2,1,1,1,16410.0
2020-04-20,新北市中和區景德街21號13樓之8,13,住宅,6,13.818200502480003,1,1,1,1,1,0,17200.0
2020-04-20,新北市中和區景德街21號13樓之11,13,住宅,6,12.15747544209,1,1,1,1,1,0,15200.0
2020-04-30,新北市三重區正義南路129號九樓之八,9,住宅,6,10.74480039072,1,0,1,1,1,0,14500.0
2020-04-19,新北市汐止區福德二路８１號十一樓之３,11,住宅,14,41.47880150832,3,2,2,1,1,1,26000.0
2020-04-01,新北市三重區成功路41巷45號2樓,2,住宅,23,12.46602545331,2,2,2,1,0,0,14300.0
2020-04-07,新北市蘆洲區長安街251號五樓,5,住宅,35,35.147476278090004,3,2,2,0,0,0,18000.0
2020-04-18,新北市中和區圓通路２９９巷３４號十樓,10,住宅,15,46.98430170852,3,2,2,1,1,1,28000.0
2020-05-06,新北市永和區永和路一段175號4樓,4,住宅,13,65.02540236456001,4,2,2,1,1,0,55000.0
2020-04-29,新北市中和區和平街76巷11弄2之1號,2,住宅,43,20.48530074492,2,1,1,1,0,0,13000.0
2020-04-29,新北市中和區景德街21號13樓之12,13,住宅,6,11.70977542581,1,1,1,1,1,0,14600.0
2020-04-20,新北市中和區景德街21號13樓之9,13,住宅,6,12.16957544253,1,1,1,1,1,0,14500.0
2020-04-29,新北市中和區景德街23號13樓之18,13,住宅,6,12.16957544253,1,1,1,1,1,0,15200.0
2020-04-11,新北市中和區泰和街38巷24之4號,5,住宅,43,25.8940009416,3,2,2,0,0,0,21000.0
2020-04-12,新北市中和區景平路989巷2號15樓之3,15,住宅,28,17.89892565087,1,1,1,1,1,0,15500.0
2020-04-15,新北市中和區秀峰街103巷7弄5之1號,2,住宅,46,17.25762562755,2,2,1,1,0,0,17000.0
2020-04-27,新北市中和區民享街89巷4弄15號5樓,5,住宅,38,43.61142658587,4,2,2,1,0,0,26110.0
2020-04-01,新北市新店區碧安街4號3樓,3,住宅,44,26.57765096646,3,2,1,1,0,0,16000.0
2020-04-01,新北市新店區安祥路145巷21號2樓,2,住宅,31,31.75342615467,3,2,2,1,0,0,10000.0
2020-04-21,新北市淡水區沙崙路一段１２６巷６１號二樓,2,住宅,6,56.34970204908,3,2,2,1,1,1,20000.0
2020-04-22,新北市淡水區新市一路一段156號19樓,19,住宅,7,25.824425939070004,2,1,1,1,1,0,16000.0
2020-04-24,新北市淡水區新市三路一段136號3樓,3,住宅,4,26.2570009548,1,2,1,1,1,1,15000.0
2020-04-20,新北市淡水區沙崙路一段57號2樓,2,住宅,4,36.74770133628,2,1,1,1,1,1,18500.0
2020-04-29,新北市新莊區新莊路540號5樓503室,5,住宅,34,9.87057535893,1,0,1,1,0,0,8800.0
2020-04-24,新北市土城區峰延街15號2樓之1,2,住宅,25,24.87760090464,2,2,1,1,1,0,12000.0
2020-05-03,新北市板橋區三民路二段21巷77號,1,套房,42,5.99857521813,1,1,1,1,1,0,9000.0
2020-04-19,新北市土城區學享街５８號五樓之５,5,套房,15,14.29917551997,1,1,1,1,1,0,16000.0
2020-04-16,新北市新莊區中正路161號4樓之1,4,住宅,31,46.51542669147,3,2,2,1,1,0,24000.0
2020-04-22,新北市新莊區中原路２３２號十三樓,13,住宅,8,75.47072774439,3,2,2,1,1,1,54000.0
2020-04-22,新北市淡水區新民街１２０巷４５弄３４號三樓,3,住宅,17,43.584201584880006,3,2,2,1,1,0,17000.0
2020-04-22,新北市淡水區新市一路三段１０１巷１０６號八樓,8,套房,12,27.318775993410004,1,1,1,1,1,1,15500.0
2020-04-21,新北市樹林區學勤路３８６號十六樓,16,住宅,15,43.82620159368,2,2,1,1,1,1,23000.0
2020-04-17,新北市中和區民享街62號2樓,2,住宅,38,21.949400798160003,3,1,1,1,0,0,14400.0
2020-04-19,新北市永和區安樂路１４４巷１８號十五樓之六,15,住宅,15,25.603600931040003,2,2,1,1,1,0,28000.0
2020-04-22,新北市中和區中正路６６號九樓之３,9,住宅,4,24.2907508833,2,2,1,1,1,0,23800.0
2020-03-02,新北市三重區三和路四段400巷3號4樓,4,住宅,42,22.082500803,3,2,1,0,0,0,17500.0
2020-04-20,新北市汐止區樟樹一路119巷16號4樓,4,住宅,35,31.57797614829,3,2,2,1,0,0,14500.0
2020-04-09,新北市汐止區中興路177之3號二樓,2,住宅,7,42.83097655749,3,2,2,1,1,1,24500.0
2020-04-22,新北市永和區中正路588號7樓之9,7,套房,30,10.44835037994,1,0,1,1,1,0,11200.0
2020-04-23,新北市中和區景平路490號13樓之5,13,套房,15,12.91372546959,1,0,1,1,1,0,16600.0
2020-04-22,新北市八里區龍米路二段３６號十九樓,19,住宅,10,44.258776609410006,2,2,1,1,1,1,20000.0
2020-04-23,新北市淡水區新市一路三段１０１巷１７６號十六樓,16,住宅,9,43.4692515807,3,2,2,1,1,1,22800.0
2020-04-23,新北市泰山區辭修路36巷8弄27號3樓,3,住宅,40,26.64420096888,3,2,1,1,0,0,13400.0
2020-04-10,新北市五股區新五路二段586號十二樓,12,住宅,5,25.70040093456,2,1,1,1,1,0,20000.0
2020-04-28,新北市土城區延平街69巷10號三樓,3,住宅,45,20.91182576043,3,2,1,1,0,0,12000.0
2020-04-13,新北市五股區成泰路一段189巷22號之1九樓,9,住宅,30,59.74980217272,4,2,2,1,1,0,21200.0
2020-04-13,新北市五股區西雲路80號五樓,5,住宅,39,25.791150937860003,3,1,1,1,0,0,12000.0
2020-04-17,新北市泰山區仁愛路108號三樓,3,住宅,15,49.07457678453001,4,2,3,1,1,0,23000.0
2020-04-22,新北市五股區新五路二段638號十三樓,13,住宅,4,20.11322573139,1,1,1,1,1,0,16000.0
2020-04-26,新北市泰山區泰林路二段164巷22號4樓,4,住宅,45,20.87855075922,3,2,2,1,0,0,13100.0
2020-04-27,新北市五股區五福路75號14樓,14,住宅,27,20.10717573117,2,1,1,1,1,0,15000.0
2020-04-12,新北市三重區大同北路189巷4號二樓,2,住宅,45,22.385000814,2,1,1,1,0,0,12000.0
2020-04-26,新北市蘆洲區長安街299巷18號4樓,4,住宅,33,35.36830128612,3,2,2,1,0,0,23000.0
2020-05-03,新北市三重區安慶街149巷6號三樓,3,住宅,45,13.310000484,1,1,1,1,0,0,16200.0
2020-04-17,新北市汐止區明峰街125號13樓,13,住宅,29,29.61777607701,3,1,2,1,1,0,17400.0
2020-04-17,新北市中和區連城路317號四樓,4,住宅,28,38.63832640503,4,2,2,1,1,0,20200.0
2020-04-20,新北市中和區連城路317之1號四樓,4,住宅,28,38.82587641185,4,2,2,1,1,0,20200.0
2020-04-21,新北市中和區華新街192巷28之2號,3,住宅,46,18.01085065494,2,1,1,1,0,0,12300.0
2020-04-18,新北市三峽區民生街1巷1之58號七樓,7,住宅,5,26.68957597053,2,1,1,1,1,0,15000.0
2020-04-17,新北市鶯歌區尖山路122號13樓,13,住宅,5,22.42735081554,3,1,1,1,1,0,11800.0
2020-04-23,新北市三峽區民權街170巷13號五樓,5,住宅,4,35.9672513079,3,2,2,1,1,0,15500.0
2020-04-24,新北市三峽區中山路257巷29號五樓,5,住宅,29,28.30492602927,3,2,1,1,1,0,14500.0
2020-04-13,新北市淡水區沙崙路一段126巷118號六樓,6,住宅,7,46.94497670709,3,2,2,1,1,0,18884.0
2020-04-14,新北市淡水區新市三路一段142號二十樓,20,套房,4,26.2570009548,1,1,1,1,1,1,13000.0
2020-04-17,新北市淡水區沙崙路一段126巷106號五樓,5,住宅,7,57.61112709495,3,2,2,1,1,1,18700.0
2020-04-24,新北市淡水區新市五路三段172號10樓,10,住宅,6,44.98477663580999,3,2,2,1,1,1,16000.0
2020-04-22,新北市淡水區新市三路二段267號二十六樓,26,住宅,5,37.29825135630001,2,2,1,1,1,1,13600.0
2020-04-22,新北市淡水區新市三路一段142號五樓,5,住宅,4,26.626050968220003,1,2,1,1,1,1,12000.0
2020-04-24,新北市淡水區淡金路二段507之1號九樓,9,住宅,11,47.01455170962001,3,1,2,1,1,1,15000.0
2020-05-04,新北市淡水區新市三路二段299號十八樓,18,住宅,5,28.08107602113,2,1,1,1,1,0,12000.0
2020-05-04,新北市淡水區北新路69巷46號五樓,5,住宅,28,23.9882508723,2,2,1,1,1,0,12350.0
2020-05-04,新北市三芝區樂全街98號十四樓,14,套房,27,12.47812545375,1,1,1,1,1,0,4800.0
2020-04-13,新北市五股區御史路60之10號五樓,5,套房,5,17.551050638219998,1,1,1,1,1,0,10000.0
2020-04-14,新北市新莊區建安街17巷6號七樓,7,住宅,26,28.843376048850004,3,2,2,1,1,0,20000.0
2020-04-21,新北市新莊區中平路377巷17弄64號五樓,5,住宅,18,23.480050853820003,2,2,1,1,1,0,19000.0
2020-04-24,新北市新莊區民生街15巷2弄9之3號,4,住宅,47,26.774275973610003,3,2,1,1,0,0,13000.0
2020-04-13,新北市土城區學府路二段22巷13號10樓,10,住宅,31,27.346000994400004,3,2,1,1,1,0,20200.0
2020-04-30,新北市土城區裕民路251之1號十五樓,15,住宅,29,23.95497587109,2,2,2,1,1,0,17000.0
2020-02-10,宜蘭縣冬山鄉鹿埔路726巷7號1樓,1,住宅,5,12.80785046574,2,1,1,1,0,0,9500.0
2020-02-12,宜蘭縣羅東鎮唐莊路52號,1,住宅,28,38.24810139084,1,3,2,0,1,0,25000.0
2020-01-21,宜蘭縣五結鄉孝威南路19之12號11樓,11,套房,28,10.68732538863,1,1,1,0,1,0,5500.0
2020-02-16,宜蘭縣宜蘭市校舍一路83巷30號三樓,3,住宅,29,16.55582560203,2,1,1,1,1,0,8500.0
2020-02-24,宜蘭縣羅東鎮站東路170巷3號3之3,3,套房,9,11.42845041558,1,0,1,1,1,0,8500.0
2020-02-29,宜蘭縣羅東鎮南宜一路25號5樓,5,住宅,30,27.960076016730003,3,1,2,1,1,0,10800.0
2020-03-10,宜蘭縣羅東鎮倉前路８３號十二樓之１,12,套房,26,11.43147541569,1,0,1,1,1,0,11000.0
2020-03-06,宜蘭縣五結鄉中正西路41巷4弄2號5樓之1,5,套房,29,15.59992556727,1,1,1,1,1,0,7300.0
2020-03-01,宜蘭縣宜蘭市民權新路47巷17之4號,5,住宅,40,26.6805009702,3,2,2,0,0,0,10000.0
2020-04-01,宜蘭縣宜蘭市大坡路一段116巷5弄10號二樓,2,住宅,28,24.61140089496,3,2,2,0,1,0,12000.0
2020-04-05,宜蘭縣冬山鄉香和路227巷27之1號三樓,3,住宅,4,14.483700526680002,2,1,1,1,1,0,11000.0
2020-03-31,宜蘭縣羅東鎮禮運路13號5樓,5,住宅,29,25.09237591245,3,2,2,1,1,0,11000.0
2020-03-21,宜蘭縣宜蘭市中華路85號四樓,4,住宅,24,28.283751028500003,3,2,2,0,1,0,13000.0
2020-04-07,宜蘭縣宜蘭市中山路二段151號五樓之2,5,套房,23,11.84590043076,1,1,1,1,1,0,8000.0
2020-04-05,宜蘭縣五結鄉孝威南路19之4號九樓,9,套房,28,8.3490003036,1,1,1,1,1,0,5500.0
2020-04-02,宜蘭縣羅東鎮民意街123之1號,2,住宅,42,30.791476119690003,3,2,1,1,0,0,12000.0
2020-04-19,宜蘭縣礁溪鄉和平路93之1號,1,套房,30,10.60565038566,1,1,1,1,1,0,7000.0
2020-04-24,宜蘭縣羅東鎮光榮路269號之8號3樓,3,住宅,27,18.479725671990003,3,2,1,1,1,0,13000.0
2020-04-19,宜蘭縣宜蘭市舊城北路110之2號,2,住宅,27,39.07695142098,3,2,2,1,1,0,12000.0
2020-05-04,宜蘭縣宜蘭市中山路二段145號7樓之3,7,住宅,23,29.194276061610005,3,2,2,1,1,0,15000.0
2020-01-21,桃園市龜山區南美街１８號三樓,3,住宅,10,37.26497635509,3,2,2,1,1,0,16000.0
2020-01-17,桃園市桃園區民光東路89號13樓之2,13,住宅,28,36.09430131252,3,2,2,1,1,0,14000.0
2020-01-17,桃園市蘆竹區光明路一段７０號六樓,6,住宅,29,44.576401620960006,3,2,2,1,1,1,20000.0
2020-01-15,桃園市平鎮區廣泰路262之1號6樓,6,住宅,6,41.242851499740006,2,2,2,1,1,1,16000.0
2020-02-06,桃園市桃園區介壽路403號3樓,3,住宅,29,41.50905150942,3,2,2,1,1,0,13000.0
2020-02-07,桃園市桃園區大興西路二段251號6樓之2,6,住宅,30,36.27580131912,4,2,2,1,1,0,14400.0
2020-02-10,桃園市楊梅區東森路60號4樓,4,住宅,16,33.68337622485,2,2,2,1,1,0,11500.0
2020-02-10,桃園市楊梅區福羚路56號4樓,4,住宅,28,30.04430109252,3,2,2,1,1,0,12100.0
2020-01-20,桃園市中壢區力行北街125號2樓,2,住宅,42,30.98810112684,3,2,2,1,0,0,12000.0
2020-02-12,桃園市桃園區大有路169號15樓,15,住宅,26,25.65502593291,3,2,2,1,1,0,16500.0
2020-01-31,桃園市龜山區文興路２１３號八樓之１,8,住宅,17,50.7595018458,3,2,2,1,1,1,25000.0
2020-01-31,桃園市中壢區環西路二段２８０號七樓,7,住宅,12,35.47115128986,2,2,2,1,1,1,16000.0
2020-01-31,桃園市桃園區大連三街６７巷６號六樓,6,住宅,24,43.76267659137,4,2,2,1,1,0,18000.0
2020-01-31,桃園市桃園區大興西路一段３２５號十七樓之２,17,住宅,26,35.915826306030006,4,2,2,1,1,0,22000.0
2020-02-03,桃園市桃園區安東街32之1號4樓,4,住宅,9,26.93762597955,2,1,1,1,1,0,17500.0
2020-02-02,桃園市蘆竹區南順四街３１號四樓,4,住宅,12,48.08237674845,3,2,2,1,1,1,22000.0
2020-02-03,桃園市蘆竹區南竹路一段９０之２號,3,住宅,31,55.16390200596,4,2,2,1,1,1,18000.0
2020-02-10,桃園市平鎮區廣泰路239號10樓,10,住宅,8,29.74785108174,2,2,1,1,1,0,15500.0
2020-01-30,桃園市八德區豐德二路６３號六樓,6,住宅,5,34.92362626995,2,2,1,1,1,1,15000.0
2020-02-01,桃園市龜山區復興一路２３０號十四樓之２,14,住宅,19,46.16755167882,3,2,2,1,1,1,25000.0
2020-02-03,桃園市中壢區環西路二段２８０號三樓,3,住宅,12,30.773326119030003,3,2,2,1,1,0,15000.0
