date,address,floor,type,age,twPing,bedRoom,livingRoom,restRoom,furniture,elevator,parkingSpace,price
2022-01-24,台中市西屯區至善路１２６號６樓之１６,6,套房,30,5.96227521681,1,0,1,1,1,0,5500.0
2022-01-18,台中市北屯區進化北路６４巷６之６號,3,住宅,42,22.19442580707,3,2,1,1,0,0,18000.0
2022-01-24,台中市北區中正路３８６號１０樓之４,10,套房,28,9.15062533275,1,0,1,1,1,0,7800.0
2022-01-24,台中市北屯區東光路８０８號６樓,6,住宅,29,43.64470158708,2,1,1,1,1,0,16200.0
2022-01-14,台中市北屯區北屯路２４０巷５之３號,4,住宅,35,29.841626085150004,3,2,1,1,0,0,14000.0
2022-01-21,台中市北屯區軍福十三路１２１號４樓之２,11,住宅,9,25.93332594303,3,2,2,1,1,0,18000.0
2022-01-25,台中市北區漢口路四段４９號１０樓之４,10,套房,30,11.05335040194,1,0,1,1,1,0,7800.0
2021-12-28,台中市北區美德街１８９之１號,2,住宅,42,24.39965088726,4,2,2,1,0,0,15000.0
2022-01-25,台中市北屯區太原路三段１３４９號９樓之３,9,住宅,8,43.17885157014,3,2,2,1,1,0,16200.0
2022-01-25,台中市北區東光東街７１號９樓,9,住宅,29,26.72890097196,3,2,1,1,1,0,16000.0
2022-01-25,台中市西屯區寧夏東八街１１之２號,3,住宅,31,29.8265010846,3,2,2,1,1,0,18000.0
2022-01-25,台中市南屯區大業路５６５號３樓之７,3,住宅,28,49.61907680433,3,2,2,1,1,0,20000.0
2022-01-01,台中市南屯區大墩六街２３２號４樓之９,4,住宅,30,16.57095060258,1,2,1,1,1,0,12500.0
2022-01-01,台中市南屯區東興西街９號２樓之７號,2,套房,32,11.67347542449,1,0,1,1,1,0,7700.0
2021-12-27,台中市西區忠明南路３２５號７樓之２,7,住宅,32,10.60867538577,1,0,1,1,1,0,8500.0
2021-12-30,台中市西區華美西街一段４０號５樓之８,5,住宅,34,9.80402535651,1,0,1,1,1,0,9600.0
2022-01-21,台中市太平區旱溪西路二段２４５號三樓之３,3,住宅,7,59.03287714665,3,2,2,1,1,1,30881.0
2022-01-01,台中市大肚區蔗南路１８０巷７９之１號,2,住宅,42,14.86182554043,2,2,1,1,0,0,9000.0
2022-01-23,台中市南區福田五街２２號九樓之１,9,住宅,8,50.82302684811,3,2,2,1,1,1,35000.0
2022-01-23,台中市西區華美街１５８號五樓,5,住宅,44,31.74435115434,3,2,2,1,0,0,15000.0
2022-01-12,台中市清水區港都路１５３號３樓之２,3,住宅,3,55.545052019820005,3,2,2,1,1,1,38800.0
2021-12-28,台中市清水區港都路１６５號１１樓之７,11,住宅,3,47.60745173118,2,2,2,1,1,1,35750.0
2021-12-28,台中市清水區港都路１５３號１５樓之１,15,住宅,3,49.20465178926,2,2,2,1,1,1,33550.0
2021-12-28,台中市清水區港都路１５３號８樓之２,8,住宅,3,45.95882667123001,2,2,2,1,1,1,35750.0
2022-01-01,台中市豐原區成功路６３０巷９之１號,1,住宅,34,22.59070082148,3,1,1,1,0,0,16200.0
2022-01-18,台中市南屯區向上南路一段３４５號十一樓,11,住宅,27,89.48555325402,4,2,3,1,1,1,45000.0
2022-01-20,台中市西屯區市政南一路１００號六樓之９,6,住宅,5,23.30762584755,2,2,1,1,1,0,27000.0
2022-01-01,台中市西屯區東大路一段３９８號１６樓之９,16,住宅,28,25.806275938410003,2,2,1,1,1,0,12000.0
2022-01-04,台中市南屯區忠勇路１０７號４樓之１,4,住宅,29,38.97410141724,3,2,2,1,1,1,17000.0
2022-01-25,台中市北屯區北屯路２８６號１０樓之１,10,住宅,27,11.80657542933,1,1,1,1,1,0,8000.0
2022-01-25,台中市北屯區文心路四段６７２號６樓之１４,6,套房,28,10.55422538379,1,0,1,1,1,0,7500.0
2022-01-24,台中市北區北平四街２８號８樓之３,8,住宅,33,56.72782706283,4,2,2,1,1,1,24000.0
2022-01-25,台中市北區太原路三段３６號２樓之２,2,住宅,28,15.53640056496,2,1,1,1,1,0,10000.0
2022-01-01,台中市北屯區天津路四段３０７號１５樓之６,15,住宅,28,9.05987532945,1,0,1,1,1,0,8000.0
2022-01-26,台中市北屯區文心路四段６７２號２１樓之３３,21,套房,28,7.075475257290001,1,0,1,1,1,0,6800.0
2022-01-26,台中市北屯區文心路四段６７２號１０樓之１８,10,套房,28,11.28022541019,1,0,1,1,1,0,6800.0
2022-01-21,台中市北屯區修齊街１１巷９號,1,住宅,30,34.200651243660005,3,2,2,1,1,1,20000.0
2022-01-05,台中市西屯區工業區一路９８巷７弄５０號１０樓之２,10,住宅,29,32.91805119702,2,1,2,1,1,0,15000.0
2022-01-26,台中市西屯區福聯街１５巷９號３樓２３,3,套房,29,6.72155024442,1,0,1,1,1,0,4500.0
2022-01-25,台中市南屯區寶山五街１１號７樓之１,7,住宅,30,32.24045117238,3,2,2,1,1,0,15000.0
2022-01-25,台中市西屯區福聯街１５巷９號１２樓之２,12,套房,29,7.825675284570001,1,0,1,1,1,0,4500.0
2022-01-21,台中市大雅區神林南路１９７巷１１號,1,住宅,43,14.36572552239,2,1,1,1,0,0,14000.0
2022-01-05,台中市西區三民路一段３６號１５樓之１１,15,住宅,28,29.179151061060004,3,1,1,1,1,1,13000.0
2022-01-26,台中市太平區宜昌路３１８號４樓之１,4,套房,30,17.926150651860002,1,1,1,1,1,0,8000.0
2022-01-07,台中市太平區中山路一段１８１巷２０之３號３樓,3,住宅,28,6.16797522429,1,0,1,1,1,0,5500.0
2022-01-03,台中市龍井區台灣大道五段３巷６２弄１２０號６樓之１,6,住宅,30,7.565525275110001,1,0,1,1,1,0,5500.0
2022-01-22,台中市太平區長安路４９３巷２１號三樓之１,3,住宅,2,40.97967649017,2,2,1,1,1,1,20000.0
2022-01-23,台中市西屯區西屯路三段１５９之７４號三樓之１,3,住宅,32,57.57482709363,4,2,2,1,1,0,21000.0
2022-01-23,台中市西屯區台灣大道四段１２７０號七樓之９,7,住宅,13,42.63435155034,2,2,2,1,1,1,21000.0
2022-01-27,台中市南屯區永春東一路５９３號四樓之１,4,住宅,7,71.74392760887001,3,2,2,1,1,1,45000.0
2022-01-26,台中市西屯區惠中三街２３號十四樓之７,14,住宅,16,60.27010219164001,3,2,2,1,1,1,38000.0
2022-01-25,台中市西屯區櫻花路３０號５樓之４８,5,套房,28,6.815325247830001,1,0,1,1,1,0,7500.0
2022-01-26,台中市西屯區青海路二段１７６號七樓之５,7,住宅,29,33.47465121726,3,2,2,1,1,0,16000.0
2022-01-10,台中市南屯區文心南五路一段３９３號８樓之５,8,住宅,4,26.72285097174,2,2,2,1,1,0,16900.0
2022-01-25,台中市北屯區遼陽一街６３號６樓之２,6,住宅,33,27.79672601079,3,2,1,1,1,0,18500.0
2022-01-25,台中市北區梅亭東街７６巷２之２號,3,住宅,45,22.04015080146,3,2,1,0,0,0,11000.0
2022-01-27,台中市北屯區崇德十六路２８３號四樓之５,4,住宅,13,27.06770098428,2,2,1,1,1,0,18000.0
2022-01-25,台中市西屯區福雅路１４３號九樓之２,9,住宅,29,44.53707661953,3,2,2,1,1,1,23000.0
2022-01-24,台中市北屯區瀋陽路三段１８號１８樓之１,18,住宅,13,39.29777642901,3,2,2,1,1,0,15000.0
2022-01-10,台中市龍井區龍井區竹師路二段７５巷２８號１０樓之６,10,住宅,3,26.65932596943,1,1,1,1,1,0,10600.0
2022-01-19,台中市龍井區台灣大道五段３巷６２弄１２０號３樓之１,3,住宅,30,7.565525275110001,1,0,1,1,1,0,5500.0
2022-01-10,台中市龍井區台灣大道五段３巷６２弄１１０號４樓,4,住宅,30,8.92677532461,1,0,1,1,1,0,6000.0
2022-01-17,台中市西區忠明南路１１０號５樓之２,5,住宅,26,43.44807657993,2,2,2,1,1,0,33000.0
2022-01-27,台中市南區信義南街２０２號３樓之２,3,住宅,28,9.91595036058,1,0,0,1,1,0,7400.0
2022-01-27,台中市西屯區至善路２４０號十四樓之９,14,住宅,25,14.92837554285,1,0,0,1,1,0,12000.0
2022-01-28,台中市南屯區向心路１０９號７樓之８,7,住宅,26,14.28707551953,1,0,0,1,1,0,9000.0
2022-01-28,台中市北區民權路４１５號５樓之１０,5,住宅,18,41.28520150128,3,2,2,1,1,1,28000.0
2022-02-08,台中市龍井區舊車路１之１２４號８樓,8,住宅,29,34.926651270060006,3,2,2,1,1,0,10000.0
2021-10-23,基隆市仁愛區獅球路１３９之８號,4,住宅,46,20.85737575845,3,1,1,1,0,0,7000.0
2021-10-19,基隆市中山區安一路３１號４樓,4,住宅,29,22.133925804870003,2,1,1,1,0,0,10000.0
2021-10-19,基隆市暖暖區碇內街３５１號,1,住宅,28,32.77285119174,3,1,2,1,1,0,11000.0
2021-10-23,基隆市安樂區基金一路１２１巷１４之６號１樓,1,住宅,27,25.04095091058,3,2,2,1,0,0,10000.0
2021-10-19,基隆市安樂區中和路８５巷２３號８樓之２,8,住宅,26,12.6142504587,2,1,1,1,1,0,8000.0
2021-10-23,基隆市七堵區明德二路１１號２樓,2,住宅,5,19.44167570697,3,1,2,1,1,0,12000.0
2021-11-05,基隆市中山區復興路２５９巷２５之２號２樓,2,住宅,29,21.93427579761,2,1,1,1,0,0,7000.0
2021-11-05,基隆市信義區東信路３５巷３號,1,住宅,52,20.75755075482,2,1,1,1,0,0,12000.0
2021-11-05,基隆市安樂區安和二街１４之１號９樓,9,住宅,27,27.69690100716,3,2,2,1,1,0,15000.0
2021-11-05,基隆市信義區深溪路３６巷５０弄１４號７樓,7,住宅,28,39.17072642439,4,2,2,1,1,0,13700.0
2021-11-05,基隆市中正區觀海街１２６號,1,住宅,24,30.71585111694,4,1,2,1,1,0,12000.0
2021-11-06,基隆市信義區深溪路３６巷５０弄８號２樓,2,住宅,28,33.520026218910004,4,2,2,1,1,0,15000.0
2021-11-06,基隆市安樂區中和路８５巷２２號９樓之２,9,住宅,26,21.40792577847,4,2,2,1,1,0,15000.0
2021-11-06,基隆市七堵區泰安路１之３號７樓,7,住宅,4,19.95290072556,2,2,1,1,1,0,15000.0
2021-11-06,基隆市暖暖區暖暖街２８１巷１５號１０樓,10,住宅,10,31.63545115038,3,2,2,1,1,0,18000.0
2021-11-06,基隆市暖暖區暖暖街２０９之１號,2,住宅,43,23.67062586075,3,1,1,1,0,0,10000.0
2021-11-06,基隆市信義區東明路１５３之１號,2,住宅,54,22.06435080234,2,2,2,1,0,0,12000.0
2021-11-06,基隆市暖暖區東碇路３１０之１號２樓,2,住宅,26,7.538300274120001,1,1,1,1,1,0,7200.0
2021-11-06,基隆市中正區新豐街１６１巷１０８號６樓,6,住宅,7,16.72522560819,1,1,1,1,1,0,11000.0
2021-11-06,基隆市信義區信二路８２號４樓,4,住宅,23,20.808975756690003,2,1,1,1,1,0,12000.0
2021-11-09,基隆市暖暖區碇內街２３８號８樓,8,住宅,27,22.54532581983,2,1,1,1,1,0,12000.0
2021-11-09,基隆市七堵區明德二路１５之５１號６樓之８,6,住宅,28,15.88730057772,2,1,1,1,1,0,11000.0
2021-11-09,基隆市中正區調和街１７之３號２樓,2,住宅,36,24.941125906950003,3,1,1,1,0,0,12000.0
2021-11-09,基隆市安樂區樂利二街６２巷２７４號３樓,3,住宅,24,25.6520009328,3,1,2,1,1,0,12000.0
2021-11-09,基隆市安樂區武聖街７６號,1,住宅,33,28.3140010296,3,2,2,1,0,0,12000.0
2021-11-09,基隆市信義區深澳坑路１６６之５號３樓,3,住宅,28,9.16877533341,1,0,0,1,1,0,6500.0
2021-11-09,基隆市暖暖區暖暖街３５７號７樓,7,住宅,30,33.486751217700004,3,2,2,1,1,0,15000.0
2021-11-09,基隆市安樂區樂利二街６２巷２９８號７樓,7,住宅,24,19.49915070906,3,1,1,1,1,0,12000.0
2021-11-09,基隆市暖暖區碇內街２２９號６樓,6,住宅,28,20.88762575955,3,1,1,1,1,0,9000.0
2021-11-09,基隆市安樂區安和一街１３１巷６之２號,3,住宅,41,29.75390108196,3,1,1,1,0,0,8000.0
2021-11-09,基隆市安樂區麥金路４７５之３號,4,住宅,41,30.07152609351,3,1,2,1,0,0,8500.0
2021-11-09,基隆市暖暖區碇內街１８４巷７號３樓,3,住宅,29,19.481000708400003,2,2,1,1,0,0,9500.0
2021-11-09,基隆市中正區中正路６５６巷３５之７號,4,住宅,48,18.4222506699,2,1,1,1,0,0,11000.0
2021-11-09,基隆市中正區豐稔街１１８號２樓之２,3,住宅,8,19.00910069124,2,1,1,1,1,0,11500.0
2021-11-09,基隆市暖暖區國安路３０巷１７之３號,4,住宅,41,21.87982579563,2,1,1,1,0,0,9000.0
2021-11-09,基隆市暖暖區東勢街２６巷１２５之１號３樓,3,住宅,28,16.65262560555,2,2,2,1,1,0,15000.0
2021-11-09,基隆市七堵區長安街２３２之２號,3,住宅,41,17.272750628100003,2,1,1,1,0,0,9000.0
2021-11-10,基隆市七堵區福二街１３６之９號,2,住宅,41,15.87217557717,2,1,1,1,0,0,11000.0
2021-11-10,基隆市暖暖區源遠路１５２巷３５號６樓,6,住宅,30,25.673175933570004,2,1,1,1,1,0,10000.0
2021-11-10,基隆市暖暖區碇內街１４１號１２樓,12,住宅,14,30.116901095160003,2,2,2,1,1,0,10000.0
2021-11-10,基隆市安樂區安一路１２４號５樓,5,住宅,40,7.82870028468,2,1,1,1,0,0,5000.0
2021-11-11,基隆市中正區觀海街１２９號８樓,8,住宅,24,7.30235026554,1,1,1,1,1,0,8600.0
2021-11-12,基隆市中正區正榮街７７巷５號,1,住宅,40,26.73797597229,2,2,1,1,0,0,5500.0
2021-11-12,基隆市信義區信二路６３號１１樓,11,住宅,25,24.61745089518,2,2,2,1,1,0,13000.0
2021-11-12,基隆市安樂區基金二路１巷１７４之３號５樓之１,5,住宅,31,20.46715074426,2,1,1,1,1,0,10000.0
2021-11-12,基隆市信義區崇法街８９巷９號５樓,5,住宅,3,19.92567572457,2,2,1,1,1,0,17000.0
2021-11-12,基隆市中正區正義路７４巷３０弄１號,1,住宅,54,24.65072589639,1,1,1,1,0,0,5000.0
2021-11-12,基隆市中正區和平街２９巷３９號,1,住宅,52,16.22912559015,3,1,1,1,0,0,10000.0
2021-11-12,基隆市中正區新豐街３９８號,1,住宅,27,25.470500926200003,3,2,2,1,1,0,12000.0
2021-11-12,基隆市暖暖區碇內街１８４巷１１號４樓,4,住宅,29,20.700075752730005,2,1,1,1,0,0,6000.0
2021-11-12,基隆市信義區東信路１４９號５樓,5,住宅,39,22.49390081796,3,1,1,1,0,0,7500.0
2021-11-12,基隆市仁愛區南新街３１巷１之２號,3,住宅,52,20.691000752400004,1,1,1,1,0,0,10500.0
2021-11-12,基隆市信義區東光路２０５巷３０號２樓,2,住宅,28,27.72715100826,3,2,2,1,0,0,10000.0
2021-11-12,基隆市暖暖區源遠路１８８巷２３號２樓,2,住宅,28,29.30620106568,3,2,2,1,0,0,10000.0
2021-11-12,基隆市七堵區明德二路１５之４２號６樓,6,住宅,28,22.109725803990003,3,2,2,1,1,0,12000.0
2021-11-12,基隆市安樂區麥金路１９９號１３樓,13,住宅,26,27.08282598483,3,2,2,1,1,0,14000.0
2021-11-12,基隆市仁愛區南榮路４５５巷２６號,1,住宅,48,23.15940084216,3,1,1,1,0,0,13500.0
2021-11-12,基隆市安樂區中平街３３之１號,2,住宅,42,25.73367593577,3,2,1,1,0,0,10000.0
2021-11-12,基隆市安樂區武聖街１２２號４樓,4,住宅,33,27.134250986700003,3,1,1,1,0,0,9000.0
2021-11-13,基隆市信義區深澳坑路５７之５號３樓,3,住宅,25,22.959750834900003,3,2,2,1,0,0,12000.0
2021-11-13,基隆市安樂區樂利三街２６３巷３５之２號,3,住宅,41,26.57462596635,3,2,1,1,0,0,8500.0
2021-11-13,基隆市安樂區中和路１６８巷３弄２０號３樓,3,住宅,26,29.36367606777,3,2,2,1,0,0,15000.0
2021-11-13,基隆市中正區新豐街１６４號１８樓,18,住宅,27,16.66170060588,3,1,1,1,1,0,10500.0
2021-11-13,基隆市中正區新豐街４６６號之１,1,住宅,26,21.68622578859,3,2,1,1,1,0,13000.0
2021-11-13,基隆市安樂區麥金路４８８之４號,5,住宅,45,17.34232563063,2,1,1,1,0,0,5000.0
2021-11-13,基隆市中山區復興路２９１之２號,3,住宅,43,23.37720085008,3,1,1,1,0,0,10000.0
2021-11-13,基隆市安樂區基金一路１０８之３號,1,住宅,31,21.42910077924,3,1,1,1,1,0,13500.0
2021-11-13,基隆市中山區復興路２５９巷２６之２號５樓,5,住宅,29,29.57240107536,3,2,2,1,0,0,9000.0
2021-11-13,基隆市安樂區麥金路２４１號１５樓,15,住宅,7,14.98887554505,2,1,1,1,1,0,17500.0
2021-11-13,基隆市中山區德安路４２巷９號５樓,5,住宅,30,25.984750944900004,3,2,2,1,0,0,5500.0
2021-11-13,基隆市安樂區基金一路１３５巷２１弄１７號５樓,5,住宅,30,34.66952626071,2,1,2,1,1,0,14000.0
2021-11-13,基隆市中正區新豐街３７２號１５樓,15,住宅,27,17.28485062854,2,1,1,1,1,0,10000.0
2021-11-13,基隆市中正區觀海街７２號２樓,2,住宅,24,17.52080063712,2,1,2,1,1,0,11000.0
2021-11-13,基隆市中正區觀海街１６８號５樓,5,住宅,24,17.52080063712,2,1,2,1,1,0,11000.0
2021-11-13,基隆市信義區福民街５５巷４４號４樓,4,住宅,26,29.94447608889,3,2,2,1,0,0,8000.0
2021-11-13,基隆市七堵區明德二路１５之５２號３樓之１,3,住宅,28,17.05797562029,3,1,1,1,1,0,12000.0
2021-11-20,基隆市中正區觀海街１６９號１４樓,14,住宅,24,7.399150269060001,1,0,1,1,1,0,6000.0
2021-11-16,基隆市中正區新豐街３６０號１０樓,10,住宅,27,17.51777563701,2,1,1,1,1,0,15000.0
2021-11-19,基隆市暖暖區暖中路７７之３號,4,住宅,42,22.983950835780004,3,2,1,1,0,0,5500.0
2021-11-19,基隆市安樂區樂利三街３４巷２４之２號,3,住宅,44,24.52972589199,3,2,1,1,0,0,10000.0
2021-11-19,基隆市中正區調和街３００號７樓之８,7,住宅,4,22.89622583259,2,1,1,1,1,0,15000.0
2021-11-19,基隆市安樂區武嶺街３０９號６樓之４,6,住宅,27,7.72282528083,1,0,1,1,1,0,6500.0
2021-11-19,基隆市仁愛區復興街１６巷１４之１號,2,住宅,50,16.53767560137,2,1,1,1,0,0,12000.0
2021-11-19,基隆市中正區觀海街３９號４樓,4,住宅,24,17.36652563151,2,1,2,1,1,0,9000.0
2021-11-19,基隆市中山區安一路９９之２號,3,住宅,46,27.87235101354,3,2,2,1,0,0,13000.0
2021-11-19,基隆市暖暖區暖碇路３８巷８５號８樓,8,住宅,14,31.8532511583,3,2,2,1,1,0,15000.0
2021-11-20,基隆市中正區立德路１００號,1,住宅,41,31.22405113542,2,1,1,1,0,0,12000.0
2021-11-20,基隆市中山區復興路２５９巷２５之１號３樓,3,住宅,29,21.9010007964,2,2,2,1,0,0,8500.0
2021-11-20,基隆市中山區中山二路２１之１號３樓,3,住宅,46,17.073100620840002,2,1,1,1,0,0,13500.0
2021-11-20,基隆市安樂區基金一路１２１巷２８號１樓,1,住宅,27,26.05735094754,3,1,2,1,0,0,10000.0
2021-11-20,基隆市安樂區中和路１６８巷５弄３８號５樓,5,住宅,26,31.0970011308,3,1,2,1,0,0,9000.0
2021-11-20,基隆市中正區觀海街１４８號１１樓,11,住宅,24,27.639426005070003,3,2,2,1,1,0,12000.0
2021-11-20,基隆市信義區信一路３３號３樓,3,住宅,22,17.109400622160003,2,1,1,1,0,0,12500.0
2021-11-20,基隆市七堵區百二街３８巷３之２號,3,住宅,44,25.603600931040003,3,2,1,1,0,0,9000.0
2021-11-20,基隆市暖暖區金華街２６７號７樓之２,7,住宅,27,6.712475244090001,1,0,1,1,1,0,7000.0
2021-11-20,基隆市中正區中正路６４０巷２０號,1,住宅,43,13.40680048752,1,2,1,1,0,0,7000.0
2021-11-20,基隆市中正區立德路９６之２號,3,住宅,41,28.89782605083,3,2,2,1,0,0,10000.0
2021-11-20,基隆市中正區新豐街３０３巷１５弄２４號５樓,5,住宅,27,24.04270087428,3,2,1,1,0,0,8000.0
2021-11-20,基隆市七堵區東新街８２之１３號３樓,3,住宅,4,28.991601054240004,3,2,2,1,1,0,15000.0
2021-11-20,基隆市安樂區樂利三街８巷６１號５樓,5,住宅,28,24.17580087912,2,2,1,1,1,0,11000.0
2021-11-20,基隆市暖暖區金華街２６９號３樓之１,3,住宅,27,30.026151091860005,3,2,2,1,1,0,13500.0
2021-11-22,基隆市信義區正信路２２７巷２３弄６號６樓,6,住宅,26,7.35377526741,1,0,1,1,1,0,7500.0
2021-11-23,基隆市暖暖區過港路１０巷１２６號２樓,2,住宅,28,9.63462535035,2,1,1,1,1,0,7000.0
2021-11-23,基隆市中正區中正路６５６巷１４２之２號,3,住宅,47,28.08712602135,3,1,2,1,0,0,9000.0
2021-11-23,基隆市中正區觀海街１７０號１３樓,13,住宅,24,27.639426005070003,3,2,2,1,1,0,15000.0
2021-11-23,基隆市中正區新豐街３０３巷１５弄１３號５樓,5,住宅,27,26.293300956120003,3,2,2,1,0,0,7500.0
2021-11-23,基隆市安樂區中平街５之１號４樓,4,住宅,34,28.05990102036,3,2,2,1,0,0,9000.0
2021-11-23,基隆市中山區中華路１４３之３號,4,住宅,43,27.24315099066,3,2,2,1,0,0,12500.0
2021-11-23,基隆市中正區正義路１００巷１２３之２號,3,住宅,50,18.58257567573,3,2,1,1,0,0,5500.0
2021-11-23,基隆市中正區正義路２巷４３之２號２樓,-4,住宅,38,28.67095104258,2,2,1,1,0,0,10000.0
2021-11-26,基隆市安樂區武嶺街２１７之４號７樓,7,住宅,27,30.24697609989,3,2,2,1,1,0,14200.0
2021-11-26,基隆市中山區復旦路１７之４號５樓,5,住宅,34,33.01485120054,3,2,2,1,0,0,11000.0
2021-11-26,基隆市中正區調和街５之３號,4,住宅,42,26.840825976030004,4,1,2,1,0,0,13500.0
2021-11-27,基隆市中正區觀海街５８號５樓,5,住宅,24,15.37910055924,2,1,2,1,1,0,10500.0
2021-11-27,基隆市信義區深澳坑路１之３４號４樓,4,住宅,32,33.46557621693,4,2,2,1,1,0,10000.0
2021-11-27,基隆市安樂區中和路１６８巷８弄４號２樓,2,住宅,28,24.34822588539,3,2,1,1,0,0,9000.0
2021-11-29,基隆市中正區和一路８４巷２３之２號,3,住宅,44,18.71567568057,2,1,1,1,0,0,6600.0
2021-11-29,基隆市暖暖區碇內街１９６巷２號４樓,4,住宅,39,25.31017592037,3,1,1,1,0,0,8000.0
2021-11-30,基隆市中正區觀海街２２１號１０樓,10,住宅,24,7.084550257620001,1,0,1,1,1,0,7000.0
2021-11-30,基隆市安樂區樂利三街８巷５１號７樓,7,住宅,28,23.10192584007,3,2,2,1,1,0,12000.0
2021-11-30,基隆市安樂區基金一路１１０之８３號５樓,5,住宅,30,9.982500363,1,0,1,1,1,0,6000.0
2021-11-30,基隆市安樂區武嶺街２９７號２樓之２,2,住宅,27,17.83842564867,2,1,1,1,1,0,13000.0
2021-12-03,基隆市中正區調和街４８號５樓,5,住宅,43,18.90020068728,2,1,1,1,0,0,7800.0
2021-12-05,基隆市七堵區福五街２０６號底一層,-1,住宅,27,13.902900505560002,3,1,2,1,1,0,13500.0
2021-12-07,基隆市七堵區崇廉街２６號３樓,3,住宅,28,20.08902573051,1,1,1,1,0,0,8500.0
2021-12-09,基隆市信義區深澳坑路２之５號２樓之１４,2,住宅,27,11.08662540315,1,1,1,1,1,0,8500.0
2021-11-30,基隆市安樂區樂利三街５７號１２樓之１,12,住宅,26,6.745750245300001,1,1,1,1,1,0,7000.0
2021-11-26,基隆市信義區深澳坑路２之５號２樓之１９,2,住宅,27,10.820425393470002,1,1,1,1,1,0,6000.0
2021-11-17,基隆市安樂區武嶺街３０７號２樓之１３,2,住宅,27,28.42290103356,3,2,2,1,1,0,13500.0
2021-11-26,基隆市信義區深澳坑路２之５號５樓之８,5,住宅,27,9.23230033572,1,1,1,1,1,0,7000.0
2021-11-27,基隆市安樂區中和路１６８巷１０弄１２號２樓,2,住宅,28,26.77730097372,3,2,2,1,0,0,8000.0
2021-11-27,基隆市仁愛區成功一路５４號３樓,3,住宅,22,9.87360035904,1,1,1,1,0,0,7000.0
2021-11-27,基隆市安樂區基金一路１３５巷１１９號５樓,5,住宅,28,33.858826231230005,3,2,2,1,1,0,14000.0
2021-11-27,基隆市安樂區安一路２５６之３號,4,住宅,41,15.50615056386,3,1,1,1,0,0,9500.0
2021-11-29,基隆市中正區調和街２９６號８樓,8,住宅,4,29.75692608207,3,2,2,1,1,0,15000.0
2021-12-01,基隆市中正區新豐街４０８號１５樓,15,住宅,27,29.983801090320004,3,2,2,1,1,0,14500.0
2021-12-05,基隆市中正區新豐街１６４號７樓,7,住宅,27,16.66170060588,2,1,1,1,1,0,13500.0
2021-12-07,基隆市安樂區武聖街１５４號５樓,5,住宅,33,27.35810099484,3,2,1,1,0,0,8500.0
2021-12-10,基隆市安樂區麥金路４４３號,1,住宅,40,23.111000840400003,4,3,2,1,0,0,10000.0
2021-12-05,基隆市安樂區麥金路４２１巷６５之２號,3,住宅,45,18.57652567551,3,1,1,1,0,0,9000.0
2021-12-10,基隆市信義區深澳坑路１６６之６號７樓,7,住宅,28,13.19807547993,1,1,1,1,1,0,8500.0
2021-12-10,基隆市安樂區武嶺街３０８之１號,2,住宅,45,20.64260075064,2,1,1,1,0,0,10000.0
2021-12-11,基隆市七堵區福二街１３６之１號,2,住宅,41,22.87202583171,2,1,1,1,0,0,10000.0
2021-12-11,基隆市信義區福民街７１巷４號４樓,4,住宅,38,19.47495070818,2,1,1,1,0,0,7000.0
2021-12-11,基隆市安樂區中和路１６８巷７弄１０號２樓,2,住宅,27,27.98730101772,2,2,1,1,0,0,8000.0
2021-12-14,基隆市仁愛區仁一路２９３巷２之１４號,2,住宅,50,29.657101078440004,2,2,1,1,0,0,7750.0
2021-12-14,基隆市中正區中正路２０３之３號,3,住宅,48,11.068475402490002,2,1,1,1,0,0,7500.0
2021-12-14,基隆市安樂區麥金路１４７之２號５樓,5,住宅,26,23.85817586757,3,2,1,1,1,0,14000.0
2021-12-14,基隆市仁愛區南新街３１巷１４之２號,3,住宅,41,24.2907508833,3,2,1,1,0,0,10000.0
2021-12-15,基隆市中正區新豐街３０３巷１１弄３３號４樓,4,住宅,29,21.76790079156,2,2,2,1,1,0,12500.0
2021-12-15,基隆市中正區觀海街１５３號１６樓,16,住宅,24,7.30235026554,1,1,1,1,1,0,6000.0
2021-12-17,基隆市安樂區中和路１６４巷５２號２樓,2,住宅,25,20.66982575163,3,2,2,1,0,0,10000.0
2021-12-17,基隆市安樂區基金一路１２１巷１７之４號４樓,4,住宅,27,25.68527593401,3,2,2,1,0,0,11000.0
2021-12-17,基隆市信義區東明路３９巷４５之１５號,4,住宅,46,21.71345078958,2,1,1,1,0,0,6500.0
2021-11-30,基隆市安樂區樂利三街２０３號１０樓,10,住宅,32,34.844976267090004,3,2,2,1,1,0,13000.0
2021-12-01,基隆市中正區觀海街１３５號７樓,7,住宅,24,19.958950725780003,2,1,2,1,1,0,11000.0
2021-12-01,基隆市安樂區麥金路１９１號１０樓,10,住宅,26,31.52655114642,4,2,2,1,1,0,15000.0
2021-12-03,基隆市中正區觀海街８８號１３樓,13,住宅,24,17.52080063712,2,1,2,1,1,0,10000.0
2021-12-03,基隆市信義區東信路３５巷３４之３號,4,住宅,42,23.41652585151,3,1,1,1,0,0,8000.0
2021-12-05,基隆市中山區德安路１０１之２號,3,住宅,44,14.14187551425,2,1,1,1,0,0,7800.0
2021-12-05,基隆市暖暖區東勢街２６巷１１７號３樓,3,住宅,29,27.63640100496,3,1,1,1,1,0,13500.0
2021-12-05,基隆市七堵區東新街８３之９號７樓,7,住宅,25,38.33885139414,4,2,2,1,1,0,17000.0
2021-12-05,基隆市暖暖區暖暖街２４６巷１２號３樓,3,住宅,29,21.95242579827,2,1,1,1,1,0,11000.0
2021-12-05,基隆市中正區觀海街１２３號１１樓,11,住宅,24,19.958950725780003,2,1,2,1,1,0,12000.0
2021-12-05,基隆市暖暖區碇內街４０２號２樓,2,住宅,28,17.65692564207,3,1,1,1,1,0,9700.0
