date,address,floor,type,age,twPing,bedRoom,livingRoom,restRoom,furniture,elevator,parkingSpace,price
2019-11-05,台北市大安區光復南路440號10樓,10,住宅,38,44.73067662657,4,2,2,0,1,0,50000.0
2019-07-23,台中市北屯區綏遠路二段１５巷７之３號,4,住宅,35,28.816151047860004,3,2,2,1,0,0,13000.0
2019-07-17,台中市西屯區國安一路１２７號二十樓之７,20,住宅,13,24.52367589177,2,1,1,1,1,1,18000.0
2019-07-19,台中市西屯區上安路１８巷８０號二樓之３,2,住宅,16,32.66395118778,2,2,1,1,1,1,20000.0
2019-07-19,台中市西屯區福安十街９０號七樓之６,7,套房,14,16.14745058718,1,1,1,1,1,0,20000.0
2019-07-18,台中市南屯區嶺東路329號10樓1002房,10,住宅,5,64.66240235136,1,1,1,1,1,0,23030.0
2019-07-25,台中市西屯區河南路三段６３號十四樓,14,住宅,11,132.06847980249,4,3,4,1,1,1,90000.0
2019-07-25,台中市北屯區松竹路一段９３７號八樓之２,8,住宅,5,52.13285189574,3,2,2,1,1,1,25000.0
2019-07-22,台中市南區福田一街２０１號五樓之１,5,住宅,4,32.62765118646,3,2,2,1,1,0,20000.0
2019-07-27,台中市北區太平路６２號７樓之１,7,套房,35,13.51570049148,1,1,1,1,1,0,10000.0
2019-07-29,台中市北屯區太原路三段１３６９號五樓之２,5,住宅,8,44.57337662085,3,2,2,1,1,1,24000.0
2019-07-29,台中市太平區新興路１８號十四樓之２,14,住宅,10,39.24937642725,2,2,1,1,1,1,18151.0
2019-07-24,台中市西屯區台灣大道三段６８９號九樓之２,9,住宅,10,75.41022774219,4,2,2,1,1,1,35000.0
2019-07-25,台中市西屯區四川路８７巷５８號七樓之３,7,住宅,26,12.829025466510002,1,0,1,1,1,0,9000.0
2019-07-29,台中市西屯區台灣大道四段１２７０號十五樓之１０,15,住宅,13,23.67970086108,2,1,1,1,1,0,17421.0
2019-08-07,台中市南屯區黎明東街５６１之９號二樓,2,住宅,26,33.489776217810004,2,2,1,1,1,1,20000.0
2019-08-26,台中市南屯區嶺東路860號2樓,2,住宅,29,44.543126619750005,3,1,2,1,1,0,10000.0
2019-08-07,台中市南區新榮街９５號三樓,3,住宅,16,38.74117640877,3,2,2,0,1,1,20000.0
2019-08-03,台中市南區學府路１６８巷７號１３樓之１３,13,套房,26,13.013550473220002,1,1,1,1,1,0,7000.0
2019-08-13,台中市西屯區何厝街３７巷１３號五樓之２,5,住宅,11,33.09652620351,2,1,1,1,1,1,20000.0
2019-08-15,台中市太平區祥順路一段309號十二樓之5,12,住宅,5,26.99812598175,3,2,2,1,1,0,19000.0
2019-08-16,台中市西屯區台灣大道四段１２６６號九樓之１,9,住宅,10,112.78107910113,4,2,3,1,1,1,40000.0
2019-08-16,台中市北屯區中清路二段４１５巷２０號三樓,3,住宅,31,34.01612623695,3,2,2,1,1,0,13200.0
2019-08-07,台中市南區復興路二段113號10樓之4,10,住宅,41,25.86677594061,3,2,1,1,1,0,17100.0
2019-08-07,台中市東區練武路229巷5號6樓之2,6,住宅,39,22.10670080388,3,1,2,1,1,0,14000.0
2019-08-18,台中市西屯區弘孝路９５號十一樓,11,住宅,25,75.00487772745,4,2,2,1,1,1,40000.0
2019-08-17,台中市西屯區上安路２２６號四樓之２,4,住宅,9,78.15390284196,3,2,2,1,1,1,41000.0
2019-07-26,台中市西屯區皇城街２５號八樓之２,8,住宅,16,53.08270193028001,3,2,2,1,1,1,14000.0
2019-08-14,台中市北屯區文心路四段６３３號１４樓之２,14,住宅,26,41.251926500070006,3,2,2,1,1,1,20000.0
2019-08-21,台中市北屯區文心路四段５０６號六樓之１１,6,住宅,8,42.74627655441,2,2,2,1,1,1,25000.0
2019-08-19,台中市北區健行路１７４號７樓之５,7,套房,33,13.089175475970002,1,1,1,1,1,0,9000.0
2019-09-01,台中市北屯區永興街358號1樓,1,住宅,27,52.635001914,0,0,0,0,1,0,40000.0
2019-08-22,台中市南屯區文山三街１２９號九樓之１,9,住宅,11,43.80502659291,3,2,2,1,1,1,18000.0
2019-08-23,台中市太平區廣三街３５號之１三樓,3,住宅,31,39.59120143968,3,1,1,0,1,0,10000.0
2019-08-26,台中市北屯區崇德六路１００號十一樓之１５,11,住宅,15,31.82905115742,2,2,1,1,1,1,20000.0
2019-08-24,台中市南區學府路１３５巷２弄３號１２樓之２,12,住宅,26,30.27117610077,3,2,2,1,1,0,12000.0
2019-08-31,台中市北屯區崇德路一段５６６之２號,3,住宅,39,30.59182611243,3,2,2,1,0,0,17000.0
2019-08-30,台中市北屯區軍福十三路１２１號七樓之３,7,住宅,9,21.07517576637,2,2,2,1,1,0,15000.0
2019-08-31,台中市西屯區國安一路５１之９號十三樓之３,13,住宅,17,46.37022668619001,3,2,2,1,1,1,26000.0
2019-08-30,台中市南區忠明南路１１０８號四樓之２,4,住宅,6,70.60955256762001,3,2,2,0,1,1,31000.0
2019-08-31,台中市西區樂群街３６４號五樓之１,5,住宅,42,25.47655092642,3,2,1,0,0,0,18000.0
2019-08-31,台中市東區六順路30號6樓之1,6,住宅,7,51.43105187022,3,2,2,1,1,1,25000.0
2019-08-30,台中市西屯區西屯路二段２４７號六樓之１３,6,套房,13,21.44120077968,1,1,1,1,1,0,18500.0
2019-09-04,台中市西區三民西路８９號五樓之１,5,住宅,8,72.50622763659,4,2,2,1,1,1,30000.0
2019-09-05,台中市南區學府路１６８巷７號１２樓之１３,12,套房,26,13.013550473220002,1,1,1,1,1,0,6500.0
2019-09-01,台中市北區陝西路１０８號１１樓之７,11,套房,34,13.48242549027,1,1,1,1,1,0,8000.0
2019-09-10,台中市西屯區市政南一路９８號七樓之１３,7,住宅,5,25.74880093632,2,2,1,1,1,1,24000.0
2019-09-12,台中市太平區育賢路３２９號八樓之２,8,住宅,8,46.185701679480005,2,2,2,1,1,1,25000.0
2019-09-15,台中市南屯區龍富十二街１３號六樓之６,6,住宅,5,40.10847645849,3,2,2,1,1,1,20000.0
2019-09-17,台中市西區美村路一段８０６號９樓之１,9,住宅,29,86.4242531427,6,2,3,1,1,0,24700.0
2019-09-14,台中市西屯區文華路７０號六樓之３,6,住宅,18,53.240001936,3,2,2,1,1,1,17940.0
2019-09-15,台中市太平區樹孝路１１５巷６號之７三樓,3,住宅,31,37.63100136840001,3,2,2,1,1,1,13000.0
2019-09-17,台中市北屯區和福路１６８號九樓之５,9,住宅,11,48.887026777710005,3,2,2,1,1,1,25000.0
2019-09-19,台中市西屯區至善路３８巷５２號四樓之５,4,住宅,14,38.04240138336,2,2,2,1,1,1,25000.0
2019-09-26,台中市太平區新安街１１１號三樓之１３,3,住宅,7,53.575776948210006,3,2,2,1,1,1,35000.0
2019-08-03,台中市西屯區台灣大道三段590號二十四樓之13,24,住宅,13,126.70817960757,4,2,3,1,1,0,107844.0
2019-09-15,台中市西屯區府會園道188號十三樓,13,住宅,24,171.65363124195002,4,3,4,1,1,0,80000.0
2019-09-24,台中市南區仁義街８６－６號１２樓,12,套房,28,9.10222533099,1,0,1,1,1,0,4800.0
2019-09-17,台中市南區建國南路一段262號12樓之2,12,住宅,28,53.99020196328,3,2,2,1,1,0,17100.0
2019-09-17,台中市太平區中山路一段245巷18號10樓之18,10,住宅,24,7.090600257839999,1,0,1,1,1,0,4000.0
2019-09-17,台中市太平區中山路一段245巷1號六樓之15,6,住宅,24,5.21207518953,1,0,1,1,1,0,3800.0
2019-09-17,台中市太平區中山路一段245巷1號五樓之5,5,住宅,24,6.33132523023,1,0,1,1,1,0,4500.0
2019-09-25,台中市太平區中山路一段245巷1號四樓之10,4,住宅,24,7.29327526521,1,0,1,1,1,0,3800.0
2019-09-30,台中市西屯區逢甲路２２５巷１５號十樓之１,10,住宅,24,29.992876090650004,2,2,1,1,1,1,17000.0
2019-09-17,台中市西屯區櫻城六街8號4樓,4,住宅,32,50.4872518359,2,2,2,1,1,0,17100.0
2019-10-03,台中市北屯區太和東街１１８號十一樓之６,11,住宅,8,45.99210167244,3,2,2,1,1,1,19000.0
2019-09-27,台中市北屯區中平路４１８號三樓之２,3,住宅,14,44.41910161524,3,2,2,1,1,0,25000.0
2019-09-28,台中市北屯區旅順路一段２０號４樓之１,4,住宅,33,27.318775993410004,1,2,1,1,1,0,14000.0
2019-09-25,台中市西區模範街２巷１４號五樓,5,住宅,33,47.63770173228001,3,2,2,1,1,0,28000.0
2019-09-25,台中市西區館前路１２號１２樓之１,12,住宅,25,65.29462737435001,3,2,2,1,1,1,39000.0
2019-09-29,台中市北屯區太順路６６號九樓之３,9,住宅,7,52.51400190960001,3,2,2,1,1,1,18000.0
2019-10-21,台中市西區自治街176號八樓之4,8,住宅,42,33.71665122606,3,2,2,1,1,0,15000.0
2019-10-01,台中市北區育樂街５６號十二樓之５,12,住宅,4,32.58530118492,2,1,1,1,1,1,24000.0
2019-09-30,台中市北屯區瀋陽路二段１７５號四樓之２６,4,套房,16,21.80420079288,1,1,1,1,1,0,7000.0
2019-10-18,台中市北屯區漢口路五段１３５之６號五樓,5,住宅,7,49.87922681379,3,2,2,1,1,1,23000.0
2019-10-14,台中市大里區新生路１７１巷１８弄３號五樓,5,住宅,28,27.94797601629,3,2,2,1,1,0,12000.0
2019-10-29,台中市北區興進路258號6樓之3,6,住宅,7,65.63947738689001,4,2,2,0,1,0,32000.0
2019-10-13,台中市西屯區上安北街２１號二樓之３,2,住宅,9,70.38872755959001,3,2,3,1,1,1,35000.0
2019-10-12,台中市中區民族路１９２號４樓之１,4,套房,30,10.91117539677,1,1,1,1,1,0,6500.0
2019-10-09,台中市西區華美西街一段36號七樓之2,7,住宅,34,15.863100576840004,2,2,1,1,1,0,17100.0
2019-10-09,台中市太平區宜昌路338號3樓,3,住宅,30,29.65105107822,3,2,2,1,1,0,13000.0
2019-10-09,台中市西屯區福星路168號三樓之9,3,住宅,16,28.00242601827,2,2,1,1,1,0,15000.0
2019-10-16,台中市北區育樂街５６號六樓之１６,6,套房,4,22.10065080366,1,1,1,1,1,0,20000.0
2019-10-20,台中市北區育樂街５６號七樓之８,7,套房,4,32.58530118492,1,1,1,1,1,1,20000.0
2019-10-17,台中市大里區大明路１４１巷１１號２樓,2,住宅,29,46.28855168322,4,2,2,1,1,1,23000.0
2019-10-20,台中市南屯區黎明東街７５號二樓,2,住宅,11,56.02602703731,3,2,2,1,1,1,26000.0
2019-10-21,台中市西區大業北路２９號二樓,2,住宅,35,28.37752603191,2,2,2,1,0,0,15000.0
2019-08-15,基隆市信義區崇法街162號,3,住宅,50,24.321000884400004,3,2,1,1,0,0,10000.0
2019-08-15,基隆市中正區新豐街303巷19弄20號2樓,2,住宅,27,28.50155103642,3,2,1,1,0,0,11500.0
2019-09-02,基隆市仁愛區仁一路257號22樓之一,22,住宅,15,17.46937563525,0,0,0,1,1,0,24237.0
2019-08-30,基隆市中正區正義路2巷45號底五層之2,-5,住宅,38,32.512701182280004,3,2,1,0,0,0,7500.0
2019-08-30,基隆市安樂區中和路168巷7弄28號3樓,3,住宅,27,27.98730101772,3,2,2,1,0,0,19000.0
2019-10-18,基隆市中正區新豐街333巷41號3樓,3,住宅,28,31.92585116094,3,2,2,1,1,0,8500.0
2019-08-11,台南市北區東豐路305巷86弄6號,2,套房,44,5.99857521813,1,0,0,1,1,0,5500.0
2019-07-31,台南市東區富農街二段39號,4,套房,30,5.99857521813,1,0,0,1,1,0,3500.0
2019-08-03,台南市東區長榮路2段106號七樓之3,7,套房,34,8.34597530349,1,0,1,1,1,0,5000.0
2019-07-22,台南市永康區尚頂里南台街１３巷４５號十五樓之２,15,住宅,28,37.82762637555,4,2,2,1,1,0,13000.0
2019-07-23,台南市東區東門路三段２６６巷３３號十三樓,13,住宅,5,55.36657701333,2,2,2,1,1,1,35000.0
2019-08-08,台南市中西區青年路49號,2,住宅,41,22.59372582159,3,1,2,0,1,0,9000.0
2019-08-11,台南市中西區開山路89巷9號三樓之4,3,住宅,42,26.75612597295,3,2,2,1,0,0,11000.0
2019-08-12,台南市中西區頂美一街7號三樓之19,3,住宅,46,10.399950378180002,1,0,1,1,1,0,7500.0
2019-07-27,台南市永康區東橋七路１９９號十五樓之１,15,住宅,6,45.26610164604,3,2,2,1,1,1,24000.0
2019-08-19,台南市南區水交社路80巷28號四樓,4,住宅,9,29.717601080640005,2,1,2,1,1,0,18000.0
2019-07-30,台南市北區公園南路３６５號十二樓之７,12,套房,16,11.21065040766,1,0,1,1,1,0,9000.0
2019-07-28,台南市北區開元路５２１號二十四樓之３,24,住宅,8,38.37212639535,3,2,2,1,1,0,16000.0
2019-07-26,台南市安平區育平路52號十樓之7,10,住宅,10,37.23170135388,3,2,1,1,1,1,19000.0
2019-08-19,台南市中西區永華路一段36號五樓之9,5,住宅,27,13.04380047432,1,0,1,1,1,0,9500.0
2019-07-21,台南市永康區新行街133號四樓之2,4,住宅,30,35.12932627743,3,2,2,1,1,0,13000.0
2019-08-07,台南市中西區民族路二段66號6樓之2,6,住宅,30,22.630025822910003,2,1,2,1,1,0,13000.0
2019-08-12,台南市北區長榮路四段31巷30之1號,2,住宅,39,33.547251219900005,3,2,2,1,0,0,11000.0
2019-08-17,台南市永康區中華路727巷96號五樓之2,5,住宅,24,36.13362631395,2,2,2,1,1,0,14700.0
2019-08-10,台南市永康區中華二路266巷32號6樓之1,6,住宅,25,9.88570035948,1,1,1,1,1,0,7000.0
2019-08-21,台南市中西區萬昌街133號四樓之10,4,住宅,17,11.531300419320004,1,1,1,1,1,0,10000.0
2019-08-20,台南市東區中華東路二段169號三樓之21,3,住宅,15,10.24567537257,1,1,1,1,1,0,7500.0
2019-08-21,台南市東區東安路238號五樓,5,住宅,31,34.79657626533,3,2,2,0,1,0,16000.0
2019-08-01,台南市南區金華路二段21巷6之3號,4,住宅,45,22.89017583237,3,2,2,1,0,0,10800.0
2019-08-10,台南市南區健康路一段133巷75弄14號四樓,4,住宅,35,41.05832649303,3,1,2,1,0,0,12600.0
2019-08-01,台南市北區開元路485巷41弄6號4樓之7,4,住宅,23,27.143325987030003,3,2,2,1,1,0,15930.0
2019-08-01,台南市北區東豐路491號六樓之9,7,住宅,40,33.77715122826,3,2,2,1,1,0,12060.0
2019-08-10,台南市北區崇安街101號3樓,3,住宅,26,29.21545106238,2,1,1,1,0,0,10800.0
2019-08-01,台南市永康區中華路154巷18弄8號8樓之2,8,住宅,30,31.04255112882,2,2,2,1,1,0,10800.0
2019-08-01,台南市永康區中山南路262巷2號8樓之18,8,住宅,28,35.1202512771,3,2,2,1,1,0,15030.0
2019-08-01,台南市永康區鹽行路146巷20弄9之19號,11,住宅,28,35.586101294040006,3,2,2,1,1,0,12150.0
2019-08-01,台南市東區仁東街23號10樓之5,10,住宅,25,28.06897602069,2,1,1,1,1,0,10800.0
2019-08-11,台南市東區中華東路二段197號5樓之1,5,住宅,28,34.78145126478,2,1,1,0,1,0,10000.0
2019-08-11,台南市南區大林路12號7樓之3,7,住宅,24,44.45237661645,3,2,2,1,1,0,17000.0
2019-08-18,台南市東區富農街一段131巷51號5樓,5,住宅,29,32.80612619295,3,1,2,1,1,0,15000.0
2019-08-23,台南市善化區公園路253號10樓之2,10,住宅,14,26.843850976140004,2,2,1,1,1,0,25000.0
2019-08-11,台南市東區長榮路二段24巷48弄4號五樓,5,住宅,36,25.9242509427,2,1,1,1,0,0,10000.0
2019-08-25,台南市永康區復國路89號五樓之3,5,住宅,16,52.39602690531,3,2,2,1,1,1,16500.0
2019-08-27,台南市永康區國華街102巷86號五樓之1,5,住宅,29,32.01055116402,3,2,2,1,1,0,15000.0
2019-08-06,台南市永康區中正路２５６巷１１號之７,3,住宅,30,35.04160127424,3,2,2,1,1,1,13000.0
2019-08-11,台南市中西區大智街63號5樓之2,5,住宅,41,20.23422573579,2,1,1,1,1,0,8000.0
2019-08-31,台南市南區新興路113巷19號,1,住宅,42,23.951950870980003,1,1,1,0,0,0,9500.0
2019-09-03,台南市中西區法華街107號之1三樓,3,住宅,33,28.56205103862,3,1,2,1,0,0,12000.0
2019-08-17,台南市南區大同路二段１００巷２１弄２號五樓之１,5,住宅,24,44.32230161171999,3,2,2,1,1,1,9000.0
2019-08-16,台南市北區西門路四段２００巷５號六樓,6,住宅,27,54.259426973070006,3,2,2,1,1,1,13000.0
2019-09-09,台南市永康區大橋二街186號七樓之4,7,住宅,30,32.44312617975,3,2,2,0,1,0,11000.0
2019-09-06,台南市永康區中華路7巷6號16樓之2,16,住宅,11,26.73495097218,2,2,1,1,1,0,25000.0
2019-09-03,台南市南區興昌路57號十四樓,14,住宅,7,72.57882763923,3,2,2,1,1,1,31000.0
2019-08-29,台南市北區忠義路三段39巷2號三樓,3,住宅,34,49.88527681401,4,1,2,0,0,0,12000.0
2019-09-07,台南市中西區民權路四段128號十五樓之3,15,住宅,5,46.68785169774,3,1,2,1,1,1,29000.0
2019-09-09,台南市北區長榮路四段31巷23弄7號之3,4,住宅,38,33.59565122166,3,1,2,1,0,0,13000.0
2019-09-08,台南市東區崇明十三街3號七樓,7,住宅,33,28.59532603983,1,1,1,1,1,0,9500.0
2019-09-13,台南市中西區中成路18號六樓之19,6,住宅,26,13.530825492030004,1,1,1,1,1,0,7000.0
2019-08-25,台南市永康區永華路５５８號十樓之５,10,住宅,6,55.17902700651001,3,2,2,1,1,1,27000.0
2019-08-31,台南市北區公園南路３６２巷２號二十樓之３,20,住宅,28,56.04720203808,4,2,2,1,1,0,18610.0
2019-09-16,台南市北區北成路401號11樓之8,11,住宅,13,33.98890123596,2,2,1,1,1,1,20000.0
2019-08-30,台南市永康區復國路６８號七樓之５,7,住宅,16,47.262601718640006,3,2,2,1,1,1,14000.0
2019-09-20,台南市北區公園南路370巷68號16樓,16,住宅,28,10.53607538313,1,0,1,1,1,0,7500.0
2019-09-01,台南市中西區衛民街101號14樓之2,14,住宅,6,90.80747830209,4,2,3,1,1,1,60000.0
2019-09-05,台南市永康區永興路65號9樓之3,9,住宅,31,20.54580074712,1,1,1,1,1,0,8000.0
2019-09-15,台南市永康區中華路7巷20弄36號十七樓之2,17,住宅,28,35.20797628029,3,2,2,1,1,1,18000.0
2019-09-12,台南市南區興昌路98號五樓,5,住宅,6,41.55745151118,2,1,2,0,1,1,16000.0
2019-09-20,台南市安平區建平十七街121號十樓之2,10,住宅,28,22.23677580861,1,1,1,1,1,0,12000.0
2019-09-11,台南市安平區健康路三段331號十五樓之5,15,住宅,6,37.8427513761,3,2,2,0,1,0,19900.0
2019-09-07,台南市東區光華街263號4樓,4,住宅,30,20.497400745360004,2,1,1,0,0,0,8500.0
2019-09-07,台南市東區中華東路二段295巷56號2樓,2,住宅,29,27.975201017280003,2,1,1,0,1,0,9000.0
2019-09-07,台南市東區中華東路二段295巷56號1樓,1,住宅,29,25.83955093962,0,0,1,0,1,0,9000.0
2019-09-05,台南市安平區健康路三段331號18樓之6,18,住宅,6,34.6967512617,2,1,1,1,1,0,24000.0
2019-09-10,台南市安平區華平路21巷32弄22之2號3樓,3,住宅,30,30.40730110572,3,2,2,1,1,0,35191.0
2019-09-08,台南市安平區健康路三段333號19樓之1,19,住宅,6,48.03397674669001,3,1,2,1,1,0,36000.0
2019-09-08,台南市安平區健康路三段317號21樓之5,21,住宅,7,38.40540139656,3,1,2,1,1,0,32000.0
2019-09-14,台南市北區忠義路三段76號2樓之2,2,住宅,4,22.965800835120003,2,1,1,1,1,0,16500.0
2019-09-13,台南市東區崇善路25巷110號11樓,11,住宅,13,27.621276004410003,2,1,2,1,1,1,20000.0
2019-09-05,台南市永康區復國路76號5樓之3,5,住宅,16,53.75727695481,3,2,2,1,1,0,34056.0
2019-09-10,台南市東區建東街43巷25號,2,住宅,30,5.49945019998,0,0,0,1,0,0,12000.0
2019-09-04,台南市東區中華東路二段193號3樓之8,3,住宅,28,42.546626547150005,4,2,2,1,1,0,46544.0
2019-09-20,台南市東區裕農路372之3號六樓,6,住宅,28,40.07217645717,3,2,2,1,1,1,16000.0
2019-09-30,台南市安平區永華五街2號四樓,4,住宅,5,44.75185162734,3,1,2,1,1,1,25000.0
2019-09-30,台南市北區北園街8巷26號7樓之6,7,住宅,16,25.61570093148,2,1,1,1,1,0,14500.0
2019-09-30,台南市永康區忠義街60巷3號十二樓之4,12,住宅,28,18.51602567331,1,1,1,1,1,0,11500.0
2019-09-19,台南市安平區光州二街１４６號六樓之１,6,住宅,30,44.11962660435001,2,2,2,1,1,1,15000.0
2019-09-23,台南市北區公園路634巷31號4樓,4,住宅,38,25.86677594061,3,1,2,0,0,0,8000.0
2019-09-20,台南市東區東興路199巷6號5樓,5,住宅,24,40.00562645475,3,1,3,1,1,0,16000.0
2019-09-16,台南市永康區東橋五路９７號九樓,9,住宅,7,54.7827519921,3,2,2,1,1,1,28000.0
2019-09-22,台南市永康區南台街57號5樓之1,5,住宅,29,30.66745111518,2,1,2,1,1,0,10000.0
2019-09-25,台南市北區西門路四段200巷10號3樓,3,住宅,27,46.31880168432,3,2,2,1,1,1,15000.0
2019-09-29,台南市中西區大同路一段250巷13號4樓之2,4,住宅,39,30.271176100770003,3,2,2,1,0,0,12000.0
2019-09-27,台南市中西區友愛街363號8樓之15,8,住宅,27,12.38435045034,1,0,1,1,1,0,6500.0
2019-09-24,台南市東區自由路三段229號8樓,8,住宅,29,49.76730180972,4,2,4,1,1,1,22000.0
2019-09-27,台南市東區東門路三段15號5樓之3,5,住宅,28,23.7160008624,1,1,1,1,1,1,12000.0
2019-09-28,台南市永康區忠孝路76巷63弄21號4樓,4,住宅,40,23.77045086438,3,1,1,1,0,0,8500.0
2019-09-26,台南市東區崇德十六街18號5樓,5,住宅,31,29.65407607833,3,1,2,1,1,0,11000.0
2019-09-27,台南市東區崇德路260號5樓之7,5,住宅,31,9.36237534045,1,0,1,1,1,0,5500.0
2019-10-19,台南市中西區頂美三街166號七樓之1,7,住宅,7,54.39857697813,3,2,2,1,1,1,30000.0
2019-10-05,台南市北區公園南路363號4樓之5,4,住宅,16,22.55137582005,2,2,1,1,1,0,14000.0
2019-10-09,台南市北區北門路二段576巷15號七樓之1,7,住宅,19,42.16547653329,3,2,2,1,1,1,15800.0
2019-10-16,台南市安平區永華五街6號四樓,4,住宅,5,44.38582661403001,3,1,2,1,1,0,25000.0
2019-10-05,台南市永康區忠義街60巷3號十一樓之15,11,住宅,28,14.92535054274,1,1,1,1,1,0,9300.0
2019-10-03,台南市永康區復華三街66號十一樓之7,11,住宅,28,28.525751037300004,3,1,2,0,1,0,13000.0
2019-10-28,台南市東區長榮路一段177號16樓之2,16,住宅,26,70.80617757477,4,2,2,1,1,1,32000.0
2019-10-09,台南市永康區中華二路340巷12號5樓之3,5,住宅,31,35.4227512881,3,2,2,1,1,1,20000.0
2019-10-04,台南市東區東門路三段266巷33號,1,住宅,5,45.74405166342001,3,2,2,0,1,1,26800.0
2019-10-29,台南市北區開元路519號十六樓之11,16,住宅,8,31.28152613751,2,1,1,0,1,0,15000.0
2019-10-13,台南市安平區健康三街12巷1號三樓,3,住宅,23,21.807225792990003,2,1,1,1,1,0,10000.0
2019-10-25,台南市安平區育平路212號十五樓之29,15,住宅,28,20.942075761530003,2,2,1,1,1,0,9000.0
2019-10-19,台南市中西區民權路四段128號十五樓之3,15,住宅,5,46.68785169774,3,1,2,1,1,1,29000.0
2019-10-27,台南市東區東寧路560號四樓之三,4,住宅,28,33.98890123596,3,1,2,1,1,1,15000.0
2019-10-26,台南市東區東寧路546號十樓之1,10,住宅,28,34.55155125642,1,2,1,1,1,1,17000.0
2019-10-15,台南市東區中華東路三段389號5樓之2,5,住宅,23,34.31257624773,2,2,1,1,1,1,16000.0
2019-10-15,台南市東區怡東路78號4樓,4,住宅,40,29.99590109076,3,1,2,1,0,0,10000.0
2019-10-17,台南市東區東成街185巷117號2樓之 2整編後門牌-自由路三段241號2樓之2,2,住宅,29,26.63210096844,3,1,2,1,1,0,14000.0
2019-10-19,台南市東區富強二街19號2樓,2,住宅,17,39.9905014542,3,2,2,1,1,0,15000.0
2019-10-27,台南市東區長榮路2段106號七樓之3,7,套房,34,8.34597530349,1,0,0,1,1,0,5000.0
2019-10-22,台南市東區德東街252號7樓,7,住宅,30,30.54645111078,1,2,2,0,1,1,12000.0
2019-11-05,台南市安平區國平路318號,1,住宅,29,25.96055094402,0,0,0,0,1,0,8000.0
2019-10-22,台南市中西區信義街108巷57號4樓之5,4,住宅,30,8.00112529095,1,0,1,1,1,0,4500.0
2019-10-28,台南市東區民族路一段18巷12號2樓,2,住宅,44,11.71280042592,2,1,1,1,0,0,7000.0
2019-10-26,台南市永康區中山南路74之14號4樓,4,住宅,41,24.88970090508,2,1,1,0,0,0,6300.0
2019-11-03,台南市永康區忠義街60巷3號十樓之14,10,住宅,28,14.92535054274,1,0,1,1,1,0,9000.0
2019-11-06,台南市安南區本原街三段234巷106弄18之26號,4,套房,10,8.00112529095,1,1,1,1,1,0,5300.0
2019-11-07,台南市東區大同路一段173號6樓,6,住宅,32,46.33695168498,3,2,1,0,1,0,14000.0
2019-07-23,高雄市三民區九如一路５６５巷１號十二樓之２,12,住宅,29,43.17885157014,3,2,2,1,1,1,16000.0
2019-07-16,高雄市左營區崇德路５８號六樓,6,住宅,15,27.212900989560005,2,1,1,1,1,1,18500.0
2019-08-11,高雄市小港區中鋼路62之1號4樓,4,住宅,8,21.56522578419,2,1,1,1,1,0,13000.0
2019-07-20,高雄市楠梓區大學南路１２１１號九樓,9,住宅,7,46.08890167596,3,1,2,1,1,0,25000.0
2019-08-03,高雄市左營區重安路43巷9號8樓,8,住宅,30,28.67095104258,2,2,2,1,1,0,13000.0
2019-08-07,高雄市三民區正興路53巷4號3樓之2,3,住宅,31,45.46272665319,3,2,2,1,1,0,12000.0
2019-08-05,高雄市苓雅區苓雅二路203號14樓之2,14,住宅,34,51.28585186494,4,2,2,1,1,0,20000.0
2019-07-21,高雄市三民區松江街２１７之２號,3,住宅,42,30.67047611529,3,2,1,1,0,0,9500.0
2019-07-25,高雄市三民區興隆街５８號十樓之２,10,住宅,27,24.0790008756,2,1,1,1,1,0,13000.0
2019-07-22,高雄市左營區保靖街６３號十四樓,14,住宅,20,30.83987612145,3,2,2,1,1,1,20000.0
2019-07-24,高雄市鼓山區裕國街１７號十一樓,11,住宅,11,81.48140296296,4,2,3,1,1,1,40000.0
2019-07-26,高雄市苓雅區中華四路106號20樓,20,住宅,29,64.80155235642,5,2,3,1,1,0,25000.0
2019-07-28,高雄市鼓山區龍德路４０３號八樓,8,住宅,18,35.03857627413,3,2,2,1,1,0,18000.0
2019-08-14,高雄市新興區球庭路68號10樓之1,10,住宅,11,30.42242610627,2,1,1,1,1,0,22500.0
2019-07-28,高雄市三民區文濱路１７巷２號七樓,7,住宅,5,44.01072660039001,3,2,2,1,1,1,27000.0
2019-08-14,高雄市燕巢區橫山路92號4樓之15,4,住宅,5,9.15062533275,1,0,1,1,1,0,5800.0
2019-07-28,高雄市左營區保靖街５９號九樓,9,住宅,20,25.63687593225,3,2,1,1,1,0,15000.0
2019-08-16,高雄市左營區自由二路79號,1,住宅,26,10.587500385,0,0,0,1,1,0,19100.0
2019-08-10,高雄市三民區建興路81之1號12樓,12,住宅,11,23.25317584557,2,1,1,1,1,0,15000.0
2019-07-29,高雄市鼓山區博愛二路３５１號十二樓,12,住宅,18,26.92552597911,2,2,1,1,1,0,15500.0
2019-08-09,高雄市前金區文武一街52號5樓之6,5,住宅,33,10.481625381150002,1,0,1,1,1,0,5000.0
2019-07-31,高雄市苓雅區新光路６２巷１８號３３樓之２,33,住宅,26,34.26720124608,3,2,2,0,1,0,10900.0
2019-08-01,高雄市鼓山區龍德路３９９號八樓,8,住宅,18,35.552826292830005,3,2,2,1,1,0,17000.0
2019-08-17,高雄市左營區立大路50巷17弄5號9樓之3,9,住宅,29,23.01722583699,2,1,1,1,1,0,11000.0
2019-08-14,高雄市三民區建國三路20號12樓之4,12,住宅,28,10.6177503861,1,0,1,1,1,0,4500.0
2019-08-18,高雄市三民區建國一路519之2號5樓,5,住宅,44,11.96992543527,2,1,1,1,0,0,9000.0
2019-08-05,高雄市三民區覺民路５３１巷３７弄２之３號,4,住宅,44,21.69530078892,3,1,1,0,0,0,10000.0
2019-08-15,高雄市鹽埕區七賢三路213號10樓之2,10,住宅,39,33.11467620417,3,2,2,1,1,0,11000.0
