date,address,floor,type,age,twPing,bedRoom,livingRoom,restRoom,furniture,elevator,parkingSpace,price
2020-04-16,台南市永康區忠義街60巷1號十二樓之14,12,住宅,28,14.92535054274,1,1,1,1,1,0,12000.0
2020-04-18,台南市永康區中山東路156號二樓之6,2,住宅,22,10.03392536487,1,1,1,1,1,0,9000.0
2020-04-07,台南市北區開元路485巷41弄10號十二樓之11,12,住宅,23,8.781575319329999,1,0,1,1,1,0,6500.0
2020-04-09,台南市北區開元路519號十樓之7,10,住宅,8,26.23280095392,2,1,1,1,1,1,20000.0
2020-04-07,台南市東區長榮路一段227號5樓之6,5,住宅,24,11.16830040612,1,1,1,1,1,0,7000.0
2020-04-15,台南市東區東寧路562號11樓之1,11,住宅,28,47.05085171094001,3,2,2,1,1,0,16500.0
2020-04-12,台南市南區大同路二段104號6樓之2,6,住宅,24,53.29142693787,4,2,2,1,1,0,12000.0
2020-04-09,台南市安平區健康路三段317號7樓之2,7,住宅,7,34.4547512529,2,2,1,1,1,0,15200.0
2020-04-14,台南市永康區國華街102巷57號五樓之1,5,住宅,28,39.39155143242,4,2,2,1,1,0,16400.0
2020-04-17,台南市安平區健康路三段329號2樓之8,2,住宅,6,35.65870129668,2,2,1,1,1,0,16000.0
2020-04-22,台南市北區公園南路343號13樓之5,13,住宅,15,27.35205099462,2,2,1,1,1,0,17000.0
2020-04-17,台南市北區小東路423巷5號10樓之5,10,住宅,12,54.241276972410006,3,2,2,1,1,0,17500.0
2020-04-13,台南市中西區西門路二段225巷8號3樓,3,住宅,17,40.577351475540006,3,2,2,1,0,0,16000.0
2020-04-17,台南市北區小東路423巷5號3樓之5,3,住宅,12,56.25592704567,3,2,2,1,1,0,14300.0
2020-04-18,台南市中西區健康路一段260號3樓之1,3,住宅,27,57.877327104630005,2,1,2,1,1,0,13000.0
2020-04-18,台南市中西區府前路90巷71之2號,4,住宅,40,16.87345061358,3,1,1,0,0,0,7500.0
2020-04-27,台南市中西區民族路三段146號,4,套房,51,10.000650363660002,1,0,1,1,1,0,4500.0
2020-04-20,台南市東區崇賢三路32號十五樓之1,15,住宅,6,55.07920200288,3,1,2,1,1,0,40000.0
2020-04-10,台南市南區體育路４３巷７１之４號,5,住宅,42,30.85197612189,3,2,2,1,0,0,8500.0
2020-04-18,台南市永康區鹽洲里鹽行路146巷20弄7之13號,8,住宅,28,42.40747654209,3,2,2,1,1,0,16000.0
2020-04-28,台南市永康區中山南路262巷6號11樓之5,11,住宅,28,51.63070187748001,3,1,2,1,1,0,13000.0
2020-04-24,台南市永康區中華二路266巷30號三樓之1,3,住宅,25,9.51060034584,1,1,1,1,1,0,7500.0
2020-04-09,台南市東區東平路１１１號七樓之７,7,住宅,30,29.76902608251,2,2,2,1,1,0,16000.0
2020-04-24,台南市南區金華路二段100巷35號四樓之2,4,住宅,32,23.56777585701,3,1,2,0,1,0,10000.0
2020-04-22,台南市北區北園街8巷18號三樓,3,住宅,27,29.89910108724,2,2,2,1,1,0,15000.0
2020-04-20,台南市北區開元路485巷41弄12號2樓之2,2,住宅,23,22.16720080608,2,2,1,1,1,0,13500.0
2020-04-17,台南市東區長榮路一段3號8樓之2,8,住宅,13,55.19415200706,3,2,2,1,1,1,32500.0
2020-04-17,台南市東區富農街二段73巷12之3號,4,住宅,44,24.41780088792,3,1,1,1,0,0,12000.0
2020-04-20,台南市東區衛國街114巷20之6號,7,住宅,43,21.92217579717,3,2,1,1,1,0,9900.0
2020-04-20,台南市東區大同路二段87號15樓之3,15,住宅,29,35.5740012936,3,2,2,1,1,0,13000.0
2020-04-27,台南市東區崇德路787號四樓之1,4,住宅,26,45.98907667233,4,2,2,1,1,0,14000.0
2020-04-20,台南市永康區中華路7巷20弄38號15樓之1,15,住宅,28,41.542326510630005,3,2,2,1,1,0,14000.0
2020-04-27,台南市永康區中華一路203巷16號十樓之5,10,住宅,25,22.81455082962,3,1,2,1,1,0,13000.0
2020-05-01,台南市東區裕農路726巷2弄15號三樓之1,3,住宅,42,24.53880089232,3,2,1,1,0,0,9000.0
2020-05-01,台南市北區北園街26號10樓之6,10,住宅,25,19.59897571269,2,2,1,1,1,0,11000.0
2020-05-01,台南市中西區民權路三段400巷18號8樓,8,住宅,24,43.8020015928,3,2,2,1,1,0,18000.0
2020-05-01,台南市永康區成功路44之1號7樓,7,住宅,31,31.76552615511,2,1,2,1,1,0,11000.0
2020-05-01,台南市永康區中正北路531號9樓之3,9,住宅,27,24.487375890450004,2,2,1,1,1,0,11000.0
2020-05-01,台南市善化區文化路6號7樓之3,7,住宅,16,30.84592612167,2,1,1,1,1,0,12000.0
2020-05-01,台南市東區中華東路二段167號8樓之8,8,住宅,15,10.345500376200002,1,1,1,1,1,0,8370.0
2020-05-01,台南市中西區忠義路二段32號八樓之3,8,住宅,43,11.02915040106,2,1,1,1,1,0,10800.0
2020-04-23,台南市北區公園南路343號6樓之2,6,住宅,15,23.30157584733,2,2,1,1,1,0,17000.0
2020-04-22,台南市北區公園路591之46號九樓之14,9,住宅,29,24.87155090442,2,1,1,1,1,0,9000.0
2020-02-06,高雄市鹽埕區五福四路263號4樓之4,4,住宅,41,10.21240037136,1,0,1,1,1,0,7600.0
2020-02-06,高雄市苓雅區廣東一街119號5樓,5,住宅,40,31.124226131790003,3,2,2,1,0,0,10000.0
2020-02-06,高雄市左營區民族一路969號6樓,6,住宅,27,45.50810165484,3,2,2,1,1,0,13500.0
2020-02-11,高雄市燕巢區橫山路92號3樓之9,3,住宅,5,6.025800219120001,1,0,1,1,1,0,5800.0
2020-02-11,高雄市燕巢區橫山路92號6樓之5,6,住宅,5,6.025800219120001,1,0,1,1,1,0,5500.0
2020-01-22,高雄市左營區立文路９２號八樓之１,8,住宅,9,25.824425939070004,2,1,1,1,1,0,19500.0
2020-02-10,高雄市左營區文府路238巷54號4樓,4,住宅,28,46.887501705000005,3,2,2,1,1,0,11000.0
2020-02-11,高雄市苓雅區英明路210巷5號3樓,3,住宅,37,31.0365011286,3,2,2,1,0,0,8000.0
2020-02-15,高雄市路竹區復興路313巷10號,3,套房,6,29.99892609087,1,0,1,1,1,0,33000.0
2020-02-17,高雄市左營區文自路526之1號7樓之5,7,住宅,24,32.04382616523,2,2,1,1,1,0,13500.0
2020-01-31,高雄市左營區新莊一路２７８號九樓之２,9,住宅,17,26.64420096888,2,1,1,1,1,1,11000.0
2020-01-31,高雄市鳳山區勝利路９７號十二樓,12,住宅,11,53.8752519591,3,2,2,1,1,1,17000.0
2020-02-14,高雄市新興區復興一路49號4樓之9,4,住宅,43,5.42382519723,1,0,1,1,1,0,4000.0
2020-01-26,高雄市新興區興華路６５號十四樓之６,14,住宅,16,25.88190094116,2,1,1,1,1,0,15000.0
2020-02-17,高雄市鼓山區鼓山一路161巷46號4樓之1、50弄7號,4,住宅,40,25.101450912780003,3,1,2,1,0,0,11000.0
2020-01-30,高雄市鼓山區美術東七街２２號四樓,4,住宅,17,37.82762637555,3,2,2,0,1,0,18000.0
2020-02-17,高雄市燕巢區橫山路92號6樓之22,6,住宅,5,6.025800219120001,1,0,1,1,1,0,5500.0
2020-02-03,高雄市左營區安吉街４２８號九樓之２,9,住宅,18,23.73112586295,2,2,1,1,1,0,18000.0
2020-02-03,高雄市左營區重安路４２巷７號二樓,2,住宅,39,27.23105099022,3,2,2,1,0,0,10500.0
2020-01-21,高雄市新興區七賢二路55號13樓之3,13,住宅,6,24.02152587351,2,1,1,1,1,0,25000.0
2020-02-09,高雄市苓雅區澄清路１８７號１０樓之３,10,住宅,27,33.07535120274,3,2,2,1,1,0,10000.0
2020-02-17,高雄市鼓山區中華一路91號4樓之1,4,住宅,40,15.575725566390002,2,1,1,1,0,0,6500.0
2020-02-06,高雄市左營區文天路１２２號十二樓之２,12,住宅,7,29.89002608691,2,2,1,1,1,1,19000.0
2020-02-19,高雄市燕巢區橫山路92號7樓之22,7,住宅,5,6.025800219120001,1,0,1,1,1,0,5500.0
2020-02-18,高雄市三民區鼎華路188號6樓之12,6,住宅,29,12.248225445390002,1,1,1,1,1,0,6500.0
2020-02-21,高雄市三民區中山一路325巷2號7樓之1,7,住宅,27,14.48067552657,1,1,1,1,1,0,6500.0
2020-02-10,高雄市三民區河北一路２６８號六樓之１２,6,套房,43,10.4665003806,1,1,1,1,1,0,7000.0
2020-02-21,高雄市小港區中鋼路60號6樓,6,住宅,8,19.949875725450003,2,1,1,1,1,0,10500.0
2020-02-19,高雄市苓雅區信守街135號6樓,6,住宅,36,39.75757644573,3,2,2,1,1,0,13500.0
2020-02-11,高雄市苓雅區仁義街２５號六樓之３,6,住宅,19,26.707725971190005,2,1,1,1,1,0,16800.0
2020-02-07,高雄市前金區市中一路９９號九樓之３,9,住宅,21,34.08570123948,3,2,2,1,1,0,18000.0
2020-02-13,高雄市鳳山區北昌五街１號九樓,9,住宅,7,27.38835099594,2,2,1,1,1,1,14500.0
2020-02-21,高雄市燕巢區橫山路92號4樓之21,4,住宅,5,6.025800219120001,1,0,1,1,1,0,5500.0
2020-02-21,高雄市燕巢區橫山路92號4樓之1,4,住宅,5,6.155875223850001,1,0,1,1,1,0,5800.0
2020-02-13,高雄市左營區民族一路１１７８號六樓,6,住宅,25,22.42130081532,3,2,1,1,1,0,12000.0
2020-02-10,高雄市鳳山區建國路三段５９３號九樓,9,住宅,14,25.75485093654,2,1,1,1,1,0,17000.0
2020-02-25,高雄市苓雅區興中一路62-4號5樓,5,住宅,44,34.512226254990004,5,2,2,0,0,0,12000.0
2020-02-25,高雄市燕巢區橫山路92號2樓之25,2,住宅,5,6.025800219120001,1,0,1,1,1,0,5500.0
2020-02-25,高雄市燕巢區橫山路92號3樓之10,3,住宅,5,10.13980036872,1,0,1,1,1,0,4950.0
2020-02-18,高雄市左營區立文路102號2樓之2,2,住宅,9,25.81232593863,2,1,1,1,1,0,23000.0
2020-02-08,高雄市前鎮區鄭和路６９號六樓,6,住宅,26,55.844527030710005,4,2,2,1,1,1,22000.0
2020-02-26,高雄市三民區明誠一路366之1號10樓,10,住宅,22,22.648175823570003,2,2,1,1,1,0,12000.0
2020-02-16,高雄市三民區民族一路５２７之１號七樓,7,住宅,23,32.08012616655,3,2,2,1,1,0,15000.0
2020-02-18,高雄市鼓山區美術東三路18號15樓,15,住宅,18,37.46160136224,3,2,2,1,1,0,30000.0
2020-02-12,高雄市鼓山區內惟路４５９巷１２號３三樓,3,住宅,37,27.55472600199,3,2,2,1,0,0,6000.0
2020-02-18,高雄市鼓山區裕誠路２１３２號八樓,8,住宅,18,28.11132602223,2,2,1,1,1,0,16000.0
2020-02-27,高雄市小港區東高街14之2號,3,住宅,47,14.20237551645,2,1,1,1,0,0,4500.0
2020-02-27,高雄市仁武區霞海中街5號7樓,7,住宅,5,26.178350951940004,2,2,1,1,1,0,13500.0
2020-03-02,高雄市燕巢區橫山路92號3樓之5,3,住宅,5,6.025800219120001,1,0,1,1,1,0,5800.0
2020-03-02,高雄市燕巢區橫山路92號2樓之8,2,住宅,5,6.025800219120001,1,0,1,1,1,0,5800.0
2020-03-03,高雄市前金區市中一路99號21樓之9,21,住宅,21,18.51905067342,1,1,1,1,1,0,14000.0
2020-03-04,高雄市苓雅區尚信街45號,1,住宅,30,51.1527518601,0,2,1,0,1,0,28000.0
2020-03-04,高雄市左營區立大路337號11樓之9,11,住宅,27,7.653250278300001,1,0,1,1,1,0,5500.0
2020-03-04,高雄市燕巢區橫山路92號2樓之20,2,住宅,5,6.025800219120001,1,0,1,1,1,0,5500.0
2020-02-15,高雄市鼓山區富農路２１５號六樓,6,住宅,18,35.32595128458,3,2,2,1,1,0,16000.0
2020-02-15,高雄市三民區凱歌路285之2號,3,住宅,48,20.473200744480003,2,2,1,0,0,0,5000.0
2020-03-05,高雄市鳳山區林森路31號7樓,7,住宅,32,42.75232655463,3,1,2,1,1,0,9000.0
2020-03-05,高雄市橋頭區經武路66號12樓之9,12,住宅,5,18.0895006578,2,1,2,1,1,1,18501.0
2020-03-09,高雄市燕巢區橫山路92號3樓之28,3,住宅,5,6.155875223850001,1,0,1,1,1,0,5500.0
2020-03-09,高雄市燕巢區橫山路92號3樓之8,3,住宅,5,6.025800219120001,1,0,1,1,1,0,5800.0
2020-03-10,高雄市三民區立忠路95巷22之4號,5,住宅,43,24.46015088946,3,2,2,1,0,0,8000.0
2020-02-16,高雄市前鎮區新光路7號37樓5,37,住宅,24,37.207501353000005,2,2,2,1,1,0,20000.0
2020-02-18,高雄市鳳山區北昌五街22號15樓,15,住宅,10,22.666325824230004,2,2,1,1,1,0,12900.0
2020-02-16,高雄市左營區大中二路８１６號十二樓,12,住宅,8,25.67015093346,2,1,1,1,1,0,15000.0
2020-03-10,高雄市燕巢區橫山路92號6樓之25,7,住宅,5,6.025800219120001,1,0,1,1,1,0,5500.0
2020-02-17,高雄市苓雅區廣州一街４７之２號,3,住宅,45,26.53530096492,3,2,2,1,0,0,11000.0
2020-02-25,高雄市新興區文化路43號5樓,5,住宅,41,20.58210074844,3,2,2,1,0,0,9500.0
2020-02-12,高雄市鼓山區裕國街133號14樓,14,住宅,18,36.01565130966,2,2,2,1,1,0,17300.0
2020-02-11,高雄市前鎮區鄭和南路335號10樓,10,住宅,18,24.21512588055,2,2,1,1,1,0,15500.0
2020-03-13,高雄市鼓山區文忠路82號9樓之3,9,住宅,28,32.27977617381,3,2,2,1,1,0,10000.0
2020-03-10,高雄市苓雅區海邊路42號12樓之3,12,住宅,43,20.25237573645,2,1,1,1,1,0,12000.0
2020-03-13,高雄市鳳山區中崙二路583巷10之1號7樓,7,住宅,27,32.51572618239,3,1,1,1,1,0,12600.0
2020-02-24,高雄市左營區榮總路９３號九樓,9,住宅,24,34.503151254660004,3,2,2,1,1,0,15000.0
2020-03-14,高雄市新興區八德一路326號5樓之2,5,住宅,40,28.50155103642,3,2,2,1,1,0,9000.0
2020-02-23,高雄市鼓山區美術東四路４４９號４樓,4,住宅,18,37.56747636609,2,2,1,1,1,1,21000.0
2020-03-13,高雄市前鎮區鎮華街8巷1號4樓,4,住宅,38,30.23185109934,3,1,2,1,0,0,7500.0
2020-03-10,高雄市三民區鼎中路560巷110號11樓,11,住宅,29,33.56540122056,3,2,2,1,1,0,12000.0
2020-03-14,高雄市三民區寧夏街1巷22之3號,4,住宅,45,18.2407506633,3,2,1,1,0,0,7500.0
2020-03-13,高雄市新興區六合一路129號11樓之6,11,住宅,6,23.55870085668,1,1,1,1,1,0,16000.0
2020-03-16,高雄市苓雅區新光路62巷17號8樓之1,8,住宅,26,41.01597649149,3,2,2,1,1,0,15000.0
2020-03-17,高雄市苓雅區林森二路21號8樓之5,8,住宅,35,25.50680092752,2,1,1,1,1,0,11000.0
2020-03-09,高雄市苓雅區新光路62巷20號5樓之3,5,住宅,26,38.526401400960005,2,2,2,1,1,0,13000.0
2020-02-25,高雄市左營區重上街５號七樓之２,7,住宅,19,26.102725949190003,2,1,1,1,1,0,14000.0
2020-03-17,高雄市燕巢區橫山路92號3樓之27,3,住宅,5,6.025800219120001,1,0,1,1,1,0,5500.0
2020-02-23,高雄市左營區榮成一街20之1號13樓,13,住宅,24,26.02407594633,3,2,1,1,1,0,16000.0
2020-02-27,高雄市左營區新莊一路201號2樓之2,2,住宅,18,25.27387591905,2,2,1,1,1,0,14500.0
2020-03-17,高雄市鼓山區文忠路108號6樓之3,6,住宅,32,17.55710063844,1,0,1,1,1,0,9500.0
2020-03-11,高雄市鼓山區翠華路110巷6之3號,4,住宅,44,17.953375652850003,3,1,1,1,0,0,12000.0
2020-02-25,高雄市三民區自由一路３３巷７號二樓,2,住宅,41,18.91230068772,2,2,1,0,0,0,8200.0
2020-02-28,高雄市鼓山區美術東四路２１８號六樓,6,住宅,17,38.05147638369,3,2,2,1,1,1,24000.0
2020-02-27,高雄市苓雅區興中二路１３８號七樓之１１,7,住宅,4,26.629075968330003,2,1,1,1,1,0,24136.0
2020-03-18,高雄市苓雅區安業路30號2樓,2,住宅,55,17.17897562469,2,1,1,1,0,0,6000.0
2020-02-27,高雄市左營區重上街５２號五樓,5,住宅,23,40.3535014674,3,2,2,1,1,1,15000.0
2020-03-03,高雄市燕巢區橫山路92號2樓之26,2,住宅,5,6.025800219120001,1,0,1,1,1,0,5500.0
2020-03-01,高雄市左營區孟子路５４０號九樓之１,9,住宅,19,46.74835169994001,3,2,2,1,1,1,21000.0
2020-03-18,高雄市苓雅區新光路62巷5號32樓之3,32,住宅,26,76.20277777101,4,2,3,1,1,0,27000.0
2020-03-05,高雄市鼓山區美術東二路３１９號十二樓,12,住宅,15,61.87335224994,4,2,2,1,1,1,31000.0
2020-03-06,高雄市三民區建德路２１０巷６弄５號三樓之４,3,住宅,44,18.28915066506,2,1,1,1,0,0,7000.0
2020-03-06,高雄市前鎮區英德街７２３號六樓,6,住宅,32,47.13252671391,3,2,2,1,1,0,10000.0
2020-03-10,高雄市左營區立文路92號7F之1,7,住宅,9,25.82140093896,2,1,1,1,1,0,17000.0
2020-03-02,高雄市苓雅區永平路１２巷３號２樓,2,住宅,37,27.44280099792,3,2,2,1,0,0,12000.0
2020-03-09,高雄市三民區陽明路５８巷４號,1,住宅,44,22.81152582951,2,2,2,1,0,0,17500.0
2020-02-27,高雄市左營區重惠街１６１巷２９號二樓之５,2,套房,28,12.92280046992,1,1,1,1,1,0,10000.0
2020-03-10,高雄市鳳山區北昌五街１號九樓,9,住宅,7,27.38835099594,2,2,1,1,1,1,14000.0
2020-03-10,高雄市新興區七賢一路２１６號９樓之２,9,住宅,29,42.75232655463,3,2,2,1,1,1,17000.0
2020-03-23,高雄市苓雅區新光路62巷17號8樓之2,8,住宅,26,36.48452632671,3,2,2,1,1,0,15000.0
2020-03-16,高雄市左營區明華一路１５８號十樓之２,10,住宅,10,38.187601388640005,3,2,2,1,1,1,25000.0
2020-03-09,高雄市左營區重義路59-1號20樓,20,住宅,25,23.111000840400003,2,2,1,1,1,0,15500.0
2020-03-26,高雄市燕巢區橫山路92號1樓之5,1,住宅,5,5.2695501916200005,1,0,1,1,1,0,5800.0
2020-03-14,高雄市三民區天祥二路２８號四樓之１,4,住宅,9,35.94305130702,2,1,1,1,1,1,17000.0
2020-03-13,高雄市鼓山區大順一路１０４１巷１１號七樓之１,7,住宅,28,37.866951376980005,2,1,1,0,1,0,15000.0
2020-03-06,高雄市苓雅區福建街9巷11號12樓之7,12,住宅,28,9.235325335830002,1,0,1,1,1,0,7000.0
2020-03-29,高雄市楠梓區楠梓路213巷6號2樓,2,住宅,29,43.06087656585,4,1,2,1,1,0,14000.0
2020-03-27,高雄市燕巢區橫山路92號3樓之22,3,住宅,5,6.025800219120001,1,0,1,1,1,0,5500.0
2020-03-27,高雄市苓雅區青年二路212號六樓之2,6,套房,32,17.34535063074,1,1,1,1,1,0,10000.0
2020-03-13,高雄市鼓山區美術東四路４４６號十三樓之１,13,住宅,14,22.36382581323,2,1,1,1,1,0,15000.0
2020-03-28,高雄市前鎮區修文街162巷14之2號,3,住宅,44,23.92170086988,3,2,2,0,0,0,8000.0
2020-03-26,高雄市三民區民祥街6號20樓之4,20,住宅,28,42.02632652823,3,2,2,1,1,0,11000.0
2020-03-30,高雄市三民區凱國路72之3號,4,住宅,48,16.88857561413,1,2,1,1,0,0,8000.0
2020-03-19,高雄市左營區重仁路２４５號八樓,8,住宅,26,41.55745151118,3,2,2,1,1,1,20000.0
2020-03-31,高雄市燕巢區橫山路92號2樓之27,2,住宅,5,6.025800219120001,1,0,1,1,1,0,5500.0
2020-03-31,高雄市三民區鼎力路267巷11號3樓,3,住宅,39,26.949725979990003,3,2,2,1,0,0,8500.0
2020-04-06,高雄市三民區林森一路317巷3號4樓,4,住宅,39,27.0132509823,3,2,2,1,0,0,11500.0
2020-04-01,高雄市新興區自立二路98號5樓,5,住宅,7,43.33010157564001,3,2,2,1,1,0,30000.0
2020-03-30,高雄市苓雅區仁德街28號9樓8,9,住宅,20,38.13920138688,3,2,2,1,1,0,30000.0
2020-04-01,高雄市前金區自立二路35號8樓之2,8,住宅,5,36.2092513167,3,2,2,1,1,0,30000.0
2020-04-06,高雄市鳥松區大埤路36之50號,3,住宅,46,12.732225462990002,1,1,1,1,1,0,5000.0
2020-03-31,高雄市燕巢區橫山路92號5樓之16,5,住宅,5,6.155875223850001,1,0,1,1,1,0,5500.0
2020-03-23,高雄市鼓山區美術北三路２１０號九樓,9,住宅,8,20.52462574635,2,1,1,1,1,0,16000.0
2020-03-17,高雄市三民區天祥二路１８號十五樓,15,住宅,9,49.7915018106,3,2,2,1,1,1,26500.0
2020-04-06,高雄市苓雅區新光路62巷17號21樓之1,21,住宅,26,43.64167658696999,3,2,2,1,1,0,15000.0
2020-03-25,高雄市鳳山區工協街４９號十二樓,12,住宅,11,54.5105019822,3,2,2,1,1,1,15000.0
2020-04-07,高雄市苓雅區建國一路140巷25弄77之3號2樓,2,住宅,28,35.174701279080004,3,1,1,1,0,0,16500.0
2020-04-08,高雄市鹽埕區大安街102號5樓之1,5,住宅,46,24.774750900900003,2,2,1,1,0,0,9500.0
2020-04-08,高雄市前金區五福三路61號11樓之19,11,住宅,43,9.72537535365,2,1,1,1,1,0,6000.0
2020-04-10,高雄市三民區建國一路385巷18弄81號,2,住宅,43,24.76265090046,3,2,2,1,0,0,12500.0
2020-03-13,高雄市前鎮區汕頭街79號11樓之1,11,住宅,27,53.43360194304,3,2,2,1,1,0,17500.0
2020-03-15,高雄市前鎮區英明一路72巷20弄38之4號5樓,5,住宅,43,22.55137582005,3,2,2,1,0,0,11000.0
2020-04-01,高雄市前鎮區鄭和路63號22樓,21,住宅,26,58.33712712135,4,2,2,1,1,0,23000.0
2020-03-30,高雄市三民區大慶街32號3樓,3,住宅,34,41.74802651811,3,2,2,1,1,0,19800.0
2020-03-29,高雄市三民區興昌街４１號十四樓,14,住宅,8,31.602176149170003,2,2,1,1,1,0,22000.0
2020-03-19,高雄市鼓山區河西一路1445號13樓之1,13,住宅,16,22.990000836,2,1,1,1,1,0,17000.0
2020-03-29,高雄市鼓山區美術東三路３６號五樓,5,住宅,18,27.41255099682,2,1,1,1,1,0,16000.0
2020-04-10,高雄市鳳山區福誠二街111號14樓,14,住宅,7,45.92857667013,3,2,2,1,1,0,22000.0
2020-03-29,高雄市鳳山區工協街４３號十三樓,13,住宅,11,53.8752519591,3,2,2,1,1,1,18000.0
2020-03-23,高雄市鳳山區文殿街９１號三樓,3,住宅,12,22.89622583259,2,2,1,1,1,0,14500.0
2020-04-10,高雄市燕巢區橫山路92號5樓之13,5,住宅,5,6.025800219120001,1,0,1,1,1,0,5800.0
2020-04-13,高雄市苓雅區青年一路4巷26之1號,2,住宅,43,22.41222581499,3,2,2,1,0,0,11000.0
2020-04-14,高雄市苓雅區廣東一街91巷39之1號,2,住宅,44,24.23327588121,3,2,2,1,0,0,9500.0
2020-03-29,高雄市鼓山區西藏街３１６巷１６之１號,2,住宅,47,18.67332567903,3,2,1,1,0,0,10000.0
2020-04-01,高雄市鼓山區美術南二路７０巷３７號六樓,6,住宅,16,34.02217623717,3,2,2,1,1,0,19000.0
2020-04-10,高雄市三民區覺民路285巷38號9樓,9,住宅,8,24.12135087714,2,1,1,1,1,0,13000.0
2020-04-01,高雄市前金區文武二街200號4樓之6,4,住宅,16,19.41747570609,2,1,1,1,1,0,13500.0
2020-04-15,高雄市苓雅區大順三路281巷1之3號,4,住宅,43,23.07167583897,3,2,1,1,0,0,8000.0
2020-03-17,高雄市苓雅區尚文街11巷3號,1,住宅,48,19.71695071698,0,0,0,0,0,0,10000.0
2020-04-02,高雄市三民區鼎安路66號3樓之2,3,住宅,31,33.49885121814,3,2,2,1,1,0,12000.0
2020-04-02,高雄市楠梓區援中路９２號十一樓,11,住宅,6,49.39220179608,2,2,2,1,1,1,17000.0
2020-04-17,高雄市苓雅區福德一路134巷12弄39之2號,3,住宅,44,18.13185065934,2,1,1,1,0,0,6700.0
2020-04-20,高雄市三民區大豐二路116之12號10樓,10,住宅,18,33.562376220450005,2,2,2,1,1,0,13500.0
2020-04-20,高雄市三民區建國三路83號8樓之3,8,住宅,33,4.60102516731,1,0,1,1,1,0,3500.0
2020-04-21,高雄市苓雅區廣州一街81號4樓,4,住宅,40,29.85372608559,3,2,2,1,0,0,9000.0
2020-04-20,高雄市左營區立文路88號10樓之2,10,住宅,9,16.764550609620002,2,1,1,1,1,0,17000.0
2020-04-20,高雄市燕巢區橫山路92號1樓之12,1,住宅,5,5.2695501916200005,1,0,1,1,1,0,5500.0
2020-04-18,高雄市楠梓區益群路9巷1-3號,3,住宅,44,24.75660090024,3,2,1,0,0,0,10000.0
2020-04-15,高雄市三民區南台路195巷13號15樓之11,15,住宅,25,11.94270043428,1,1,1,1,1,0,8600.0
2020-04-22,高雄市鼓山區昌盛路16號10樓之1,10,住宅,24,21.36557577693,2,2,1,1,1,0,13000.0
2020-04-22,高雄市苓雅區新光路62巷20號13樓之1,13,住宅,26,41.02505149182,3,1,2,1,1,0,12000.0
2020-04-22,高雄市左營區果峰街46號18樓,18,住宅,38,33.04510120164,3,2,2,1,1,0,11000.0
2020-04-23,高雄市楠梓區秀群路499巷7弄29號14樓,14,住宅,10,16.80992561127,2,1,1,1,1,0,15000.0
2020-04-23,高雄市鳳山區八德路372號3樓,3,住宅,11,23.66760086064,2,2,1,1,1,0,13500.0
2020-04-25,高雄市大寮區鳳林三路315之11號11樓,11,住宅,22,47.07505171182,4,1,2,1,1,0,12000.0
2020-04-24,高雄市新興區忠孝一路76巷14號3樓,3,住宅,42,27.73622600859,3,2,2,1,0,0,8000.0
2020-04-25,高雄市苓雅區新光路62巷21號31樓,31,住宅,26,30.62510111364,2,2,1,1,1,0,9000.0
2020-04-27,高雄市小港區中鋼路60之1號5樓,5,住宅,8,20.97837576285,2,1,1,1,1,0,12000.0
2020-04-23,高雄市楠梓區加宏路100巷7之4號,4,住宅,44,24.5932508943,2,1,1,1,0,0,8000.0
2020-04-10,高雄市左營區孟子路１８９巷５９號五樓,5,住宅,20,52.27200190080001,4,2,2,1,1,1,21650.0
2020-04-16,高雄市鼓山區文忠路６４號六樓之１,6,住宅,28,23.458875853050003,2,2,1,1,1,0,12500.0
2020-04-28,高雄市三民區建國三路83號8樓之4,8,住宅,33,8.77552531911,1,0,1,1,1,0,5000.0
2020-04-16,高雄市三民區春陽街５０號五樓之２,5,住宅,22,24.71122589859,2,2,1,1,1,0,13500.0
2020-04-16,高雄市三民區覺民路５０１號六樓之３,6,住宅,26,31.63242615027,2,2,1,0,1,1,12000.0
2020-04-10,高雄市三民區民族一路５５７號七樓,7,住宅,8,49.81570181148,3,2,2,1,1,1,24000.0
2020-04-13,高雄市前鎮區鄭和南路３２１號八樓,8,住宅,18,44.521951618980005,3,2,2,1,1,1,27000.0
2020-04-27,高雄市苓雅區自強三路5號22樓之5,22,住宅,24,23.25317584557,1,1,1,1,1,0,11000.0
2020-04-28,高雄市苓雅區新光路62巷17號24樓之3,24,住宅,26,40.74070148148,3,2,2,0,1,0,12000.0
2020-04-27,高雄市鳳山區濱山街55巷1號7樓,7,住宅,28,33.13887620505,3,2,2,1,1,0,16000.0
2020-04-15,高雄市鼓山區明華路347號8樓,8,住宅,28,31.42067614257,3,2,2,0,1,0,14000.0
2020-04-14,高雄市前金區允文街５１號四樓之６,4,套房,18,13.66997549709,1,1,1,1,1,0,10500.0
2020-04-29,高雄市前鎮區翠亨北路399巷12號13樓,13,住宅,16,44.67017662437,3,2,2,1,1,0,13500.0
2020-04-30,高雄市前金區自立二路73巷22之8號,5,住宅,46,25.54915092906,3,2,2,1,0,0,7800.0
2020-04-27,高雄市苓雅區河北路230號7樓之4,7,住宅,33,11.23182540843,1,0,1,1,1,0,6000.0
2020-04-27,高雄市左營區博愛三路635號三樓之一,4,住宅,21,13.80912550215,2,1,1,1,1,0,13000.0
2020-04-30,高雄市楠梓區楠梓西巷95弄39號,1,住宅,41,25.107500913000003,3,1,2,1,0,0,9000.0
2020-04-17,高雄市左營區介壽路２２１巷１９號三樓,3,住宅,12,24.73240089936,2,2,1,1,1,0,14000.0
2020-04-14,高雄市苓雅區光華一路321號9樓之3,9,住宅,26,11.25602540931,1,1,1,1,1,0,9000.0
2020-05-06,高雄市前鎮區中山二路182號9樓,9,住宅,12,27.808826011230003,2,1,1,1,1,0,15000.0
2020-05-05,高雄市新興區文橫一路68號4樓之4,4,住宅,30,9.98552536311,1,0,1,1,1,0,5800.0
2020-05-05,高雄市新興區八德二路6號10樓之5,10,住宅,42,8.10095029458,1,1,1,1,1,0,6000.0
2020-04-16,高雄市左營區立文路96號4樓之1,4,住宅,9,25.10447591289,2,1,1,1,1,0,25000.0
2020-04-23,高雄市鼓山區文信路２３３號九樓,9,住宅,19,23.310650847660003,2,2,1,1,1,0,16000.0
2020-04-30,高雄市鼓山區龍勝路148號14樓,14,住宅,17,29.53912607415,2,2,1,1,1,0,17500.0
2020-04-23,高雄市前金區市中一路９９號十三樓之７,13,住宅,21,21.35347577649,2,1,1,1,1,0,14300.0
2020-04-12,高雄市前鎮區新光路21號31樓12,31,住宅,24,22.515075818730004,2,1,1,1,1,0,14500.0
2020-04-18,高雄市苓雅區仁義街23號14樓-5,14,住宅,19,29.20032606183,2,2,1,1,1,0,17000.0
2020-01-20,新北市板橋區中正路250巷30之2號,3,住宅,48,17.7870006468,2,2,1,1,0,0,16000.0
2020-01-18,新北市板橋區大華街１２８號八樓之１,8,住宅,21,51.55810187484,4,2,2,1,1,1,38000.0
